,date,username,tweet,replies_count,retweets_count,likes_count,link
331269,2020-11-08,pablalunar,"la vacuna rusa no tiene arvejas, papa, zanahoria y mayonesa entre sus componentes? todo bien pero eso de rusa no tiene nada yo no me la doy",3,612,6178,https://twitter.com/PablaLunar/status/1325280664988553216
322373,2020-11-12,mariaaagm,"Me tomaba un tequila por $1 en GOA, mira si no me voy a dar la vacuna rusa...",75,764,5609,https://twitter.com/mariaaagm/status/1326893054020694016
327585,2020-11-09,mmmifla,yo yendo a ponerme la vacuna rusa o cualquiera que salga,1,393,3027,https://twitter.com/mmmifla/status/1325984769612636164
325901,2020-11-11,lrubinska,🇷🇺#AHORA @sputnikvaccine ||  🔴Confirman que la vacuna rusa contra el Covid-19 #SputnikV tiene una eficacia del 92% y que no hubo efectos adversos durante las pruebas.,54,466,2831,https://twitter.com/LRubinska/status/1326452489827266561
329918,2020-11-09,madorni,"El gobierno pretende conseguir voluntarios para la vacuna rusa, incluso a cambio de una compensación económica. Me ofrezco como voluntario, pero sin retribución económica. Si pretendo que me permitan despedir a un funcionario (sin cargo electivo, desde ya) a mi libre elección.",55,184,2753,https://twitter.com/madorni/status/1325781798983446531
329215,2020-11-09,luispetri,"Vacuna rusa CFK, Reforma Judicial CFK, destitución de jueces CFK, alineación con Venezuela CFK, expropiación a Vicentin CFK, recorte de fondos a CABA de nuevo CFK, alguna duda quien gobierna?",701,959,2664,https://twitter.com/luispetri/status/1325832211619344387
326517,2020-11-10,lucaslauriente,los muchachos y yo después de darnos la vacuna rusa  https://t.co/p5Y6K9PzAS,12,338,2235,https://twitter.com/lucaslauriente/status/1326261256177770497
330670,2020-11-08,orwellgeorge,"“El jefe del laboratorio qie va a traer la vacuna rusa, estuvo 12 años preso y creó el sindicato de presos. Se cambió el nombre” @guadavazquez Tranqui.",34,847,2144,https://twitter.com/OrwellGeorge/status/1325575882291994625
79687,2020-11-09,mlauraassis,"🇧🇷 ANVISA interrumpe las pruebas de la vacuna china después de un 'evento adverso grave' en un voluntario brasileño. Cuando el presidente Jair Bolsonaro, hace dos semanas, expresó que no compraría la vacuna del país asiático, fue atacado y criticado.  ¿Quien tenía la razón?",51,302,1940,https://twitter.com/MLauraAssis/status/1325985107094724610
321747,2020-11-12,elisacarrio,"No me voy a poner ninguna vacuna rusa, no pasa los controles de seguridad. @lanacionmas #LaTramaDelPoder",439,346,1851,https://twitter.com/elisacarrio/status/1327071861876862978
328928,2020-11-09,rukhasgunsalu,"-Señor Rial, entienda que esta vacuna rusa puede provocar esterilidad y ligero retraso mental.  -¡Sí, sí, venga el sobre!  https://t.co/QVosHCp8mt",56,422,1843,https://twitter.com/rukhasgunsalu/status/1325853695603576833
329929,2020-11-09,rialjorge,"Me despierto y la manada propone famosos para que se den la vacuna rusa. Con tono agresivo me ponen en la lista. Lejos de ofenderme me parece una buena idea. Ojalá sirva para, después, poder ayudar a los ignorantes ilustrados de las marchas y la tierra plana. Estoy.",363,104,1818,https://twitter.com/rialjorge/status/1325780435192909824
324436,2020-11-11,stevenarce,"Vacuna rusa está registrada en OMS.  Produjo anticuerpos a la mayoría de  voluntarios (a algunos se les aplicó placebo)  Empezó con 70 voluntarios, ahora son 40 mil.  Cumplirá según registro OMS con las mismas 3 fases que otras vacunas.  efectividad 92%  Información, no opinión.",46,174,1597,https://twitter.com/stevenarce/status/1326540940803104768
324255,2020-11-11,sergiodwy,"Si la vacuna rusa funciona. Nos juntamos en Plaza de Mayo con música del disco ""Octubre"" de los Redondos y hacemos el pogo soviético más grande del mundo.",52,214,1343,https://twitter.com/sergiodwy/status/1326551378571849735
325881,2020-11-11,c5n,"⭕️#AHORA Confirman que la vacuna rusa #Sputnik logró el 92% de eficacia  📌40.000 voluntarios están participando en ensayos clínicos de fase III, doble ciego, aleatorizados y controlados con placebo, de los cuales más de 20.000 se han vacunado con la primera dosis  #esperanzarusa  https://t.co/94kqvUolFN",49,288,1283,https://twitter.com/C5N/status/1326456596810100736
321778,2020-11-12,vanepetrillo,"Atenti denunciantes compulsivos. Fiscal Di Lello pidió desestimar la insólita denuncia contra la compra de la vacuna rusa.""Carece de los requisitos mínimos"" q debe tener una denuncia. La hizo un abogado, sobre ""supuestos"", sin pruebas de nada.Todo muy ""confuso"", dice la justicia",50,380,1272,https://twitter.com/Vanepetrillo/status/1327064618133544961
329105,2020-11-09,luisrodriguezrm,Rial se ofreció para ponerse la vacuna Rusa.  Primeros resultados  https://t.co/menQFhp5tS,81,292,1269,https://twitter.com/luisrodriguezrm/status/1325839672078110720
329865,2020-11-09,gustavo__olmos,"Ustedes disculpen, pero para mi... ojo, para mí Echarri, Dady Brieva, Nancy Duplaá y los demás actores Kirchneristas deben ser utilizados como pilotos de prueba con la vacuna rusa  https://t.co/WCwyorleP9",120,223,1237,https://twitter.com/Gustavo__Olmos/status/1325786549980712962
324858,2020-11-11,jotaalonso,La noticia del día: la vacuna rusa Sputnik V fue efectiva en un 92%. Se probó en 40 mil personas en fase 3. Así lo informó el Centro Gameleya y el Fondo de Inversiones Directas de la Federación de Rusia. Por lo tanto la Argentina contará con 10 millones de dosis en diciembre.,23,421,1212,https://twitter.com/jotaalonso/status/1326516933164986369
329168,2020-11-09,angeldebritook,"Jorge Rial, Florencia Peña y Diego Brancatelli son los tres primeros famosos en querer ponerse la vacuna rusa  https://t.co/nF0l7q33KR",725,85,1155,https://twitter.com/AngeldebritoOk/status/1325835031181455361
328667,2020-11-09,profetaargen,Vacuna rusa,6,51,1067,https://twitter.com/ProfetaArgen/status/1325873292880834560
325584,2020-11-11,cyngarciaradio,URGENTE‼️ La vacuna rusa Sputnik V mostró un 92% de efectividad. Así lo indica el primer análisis intermedio de la tercera fase de los ensayos clínicos. Lo confirmó  el Fondo de Inversión Directa de Rusia.  https://t.co/1sSfB6cDmR,52,270,1047,https://twitter.com/cyngarciaradio/status/1326481027364249600
325841,2020-11-11,efenoticias,"Spuntik V, la primera vacuna rusa registrada contra la covid-19, ha probado ser eficaz en el 92 % de los casos, según los primeros resultados publicados hoy por el Centro Gamaleya y el Fondo de Inversiones Directas de Rusia (FIDR).  #coronavirus   https://t.co/bE17PoBSKr  https://t.co/4fLY9qKGIc",124,536,1044,https://twitter.com/EFEnoticias/status/1326462283371978754
330920,2020-11-08,rquiroga777,"""Se pondría la vacuna rusa, doctor Pizzi?""  ""Hace 15 días que ya le saqué la manga izquierda a todas mis camisas y sacos y en la derecha llevo un algodón con alcohol""  😂  https://t.co/unqDqBFZBf",18,158,984,https://twitter.com/rquiroga777/status/1325496652891906050
330321,2020-11-08,hernan_mazza,Se meten en la nariz un polvo que viajó en el culo de una mula desde andá a saber donde y le tienen reacio a meterse la vacuna rusa.,32,203,977,https://twitter.com/hernan_mazza/status/1325629621216350210
325707,2020-11-11,agenciatelam,"La vacuna rusa Sputnik V contra el coronavirus obtuvo 92% de eficacia en los estudios de fase 3 en humanos y no registró ""efectos adversos inesperados""  https://t.co/beEvRL6ZTK",37,351,941,https://twitter.com/AgenciaTelam/status/1326472237503877120
324735,2020-11-11,jotaalonso,"Putin remarcó que la vacuna rusa debería ""ser patrimonio de la humanidad"". El Estado ruso tiene una trayectoria científica de más de cien años. La posición de Rusia rompe con la lógica de las multinacionales de EE UU. Otro motivo para recordar la importancia de Alberto y Cristina",11,300,938,https://twitter.com/jotaalonso/status/1326524087997489155
330647,2020-11-08,irmaar,"En @LaCornisaok @majulluis y @guadavazquez alertan. El dueño del laboratorio HLB que, avalado por el gobierno va a traer la vacuna rusa #COVID19, estuvo preso 2 años por ilícitos en temas de insumos de salud y formó el sindicato de presos. Obviamente es ultra K. Mamita! 😱😱😱",21,395,760,https://twitter.com/irmaar/status/1325580106463633408
326743,2020-11-10,kibudi,"-""La vacuna rusa me parece peligrosa""  https://t.co/M1nqQb4xb7",25,135,757,https://twitter.com/kibudi/status/1326212298923532290
331017,2020-11-08,norberto_pagano,"Hoy Lanata nos va a contar que hay detrás del negocio de la vacuna rusa. Raro que nunca nos contó del negocio detrás de la ""búsqueda""  del ARA San Juan. Un olvido seguramente.",34,255,755,https://twitter.com/norberto_pagano/status/1325460504324747268
328828,2020-11-09,nicolasschrute,Vacuna rusa,0,37,753,https://twitter.com/NicolasSchrute/status/1325859991245434881
329412,2020-11-09,rtultimahora,ÚLTIMA HORA   Ministerio de Salud de Rusia: La efectividad de la vacuna rusa #SputnikV (@sputnikvaccine)  es de más del 90 %  https://t.co/Y1aHG5fBaP  https://t.co/tX4HcJVq68,60,300,753,https://twitter.com/RTultimahora/status/1325820225732956162
320911,2020-11-13,vanepetrillo,"Tras dictamen del fiscal Di Lello, el juez Martínez de Giorgi, en el mismo sentido, desestimó una denuncia que hizo el abogado Igolnikov contra la compra de la vacuna rusa. Para la justicia, la denuncia es confusa, sin pruebas,""no logra mantener un hilo conductor"".",32,218,748,https://twitter.com/Vanepetrillo/status/1327405720527114242
330519,2020-11-08,luisgasulla,"Hoy Lanata hablará de Los increíbles ""antecedentes"" del laboratorio que traerá la vacuna rusa a la Argentina - Periodismo y Punto  https://t.co/O369uLs6M7",58,228,732,https://twitter.com/LuisGasulla/status/1325610356341940224
326460,2020-11-10,julioargroca21,En Italia hay desesperación por segundo brote y no tienen vacuna como ningún país del mundo...y acá gollan ya invita a ponerse el 99% la vacuna rusa .....más asesinos no se consigue,11,196,722,https://twitter.com/JulioArgRoca21/status/1326278016973074433
327874,2020-11-09,tobiasortega98,Mira si no me voy a poner la vacuna rusa si sale bien quedo inmune y si sale mal me muero o sea cualquiera de las 2 opciones me viene perfecto,0,281,711,https://twitter.com/TobiasOrtega98/status/1325953852244373509
325984,2020-11-11,beadixit,"Son pura espuma... Los gorilas van a recibir la vacuna rusa Sputnik V igual que reciben: el aguinaldo, las vacaciones pagas, las 8 horas de trabajo, el IFE, la jubilación de ama de casa, etc, etc, etc. Porque no pueden vivir sin lo que el Peronismo les consigue.",42,245,702,https://twitter.com/BeaDixit/status/1326385320020090881
330972,2020-11-08,ezechilo,Alberto: la vacuna rusa no tiene efectos secundarios   la vacuna rusa:  https://t.co/FyFUTSiNqd,1,59,700,https://twitter.com/EzeChilo/status/1325474893077606402
328643,2020-11-09,tevoyacureosear,"En caso de que Brancatelli se deje aplicar la vacuna rusa, es imposible saber si sufre de efectos secundarios o no.",2,67,682,https://twitter.com/tevoyacureosear/status/1325875160633716739
80063,2020-11-08,jaimerdznl,"El primer estudio se realizará por parte del Tec Salud y es para probar la vacuna mRNA del laboratorio CureVac de Alemania.    El segundo estudio se realizará en el Hospital Metropolitano, en donde se probará la vacuna china del laboratorio CanSinoBio.  https://t.co/zp0DgBqJ4k",31,112,677,https://twitter.com/JaimeRdzNL/status/1325422948207955968
322427,2020-11-12,hernan_mazza,Si crees que: Nestor no estaba en el cajón A Nisman lo mataron Que la vacuna rusa no sirve. Que el rico no roba Que el campo somos todos Que Maldonado se ahogó solo Tené cuidado que podes ser un pelotudo.,43,158,668,https://twitter.com/hernan_mazza/status/1326881746365915136
321628,2020-11-13,eljuantopo,"Me ofrecí como voluntario para la vacuna rusa COVID-19 y fui vacunado esta mañana en el hospital, fui hacer mis cosas normal y hasta ahora no observo ninguna reaksionoski o efecto sekundarioski pueden estar trankiloski toduski иi meиш че сеитгюд ерпестe аьио овут Лопес Обрадор",3,51,667,https://twitter.com/ElJuanTopo/status/1327118921099587585
330668,2020-11-08,orwellgeorge,"“En el domicilio legal del laboratorio con el negocio de la vacuna rusa, hay una pollería que se llama [el pollo sin espinas]” @guadavazquez",25,320,663,https://twitter.com/OrwellGeorge/status/1325576437198368768
324810,2020-11-11,jotaalonso,La logística para transportar millones de dosis de la vacuna rusa Sputnik V contará con la coordinación estratégica del Ministerio de Defensa y la ayuda del Estado ruso. Es obvio que Rusia garantizará la llegada de 10 millones de dosis porque así se lo aseguró Putin al Presidente,8,244,649,https://twitter.com/jotaalonso/status/1326519869475594241
321013,2020-11-13,mariaseoane48,"Carrio dijo x tv que no nos pongamos la vacuna rusa x Putin es Cristina, ergo el que se la ponga se volverá K y deberá vivir en Venezuela. Me niego a creer en su papel de delirante. Esa es la máscara actoral. El mensaje es de odio político, muy consciente.",48,160,643,https://twitter.com/MariaSeoane48/status/1327361083368206338
331115,2020-11-08,actualidadrt,"""¡El gobierno argentino se volvió loco! ¡Quiere millones de dosis de la vacuna rusa que no terminó la tercera fase, en lugar de comprar una estadounidense o británica, que tampoco terminaron la tercera fase!"" 🙄  Con @inafinogenova  https://t.co/b3N2TkA0zq",36,234,635,https://twitter.com/ActualidadRT/status/1325426595520278529
325865,2020-11-11,efenoticias,"#ÚLTIMAHORA | La vacuna rusa anticoronavirus tiene una eficacia del 92 %, según datos preliminares #coronavirus  https://t.co/JNbQU8ZuPp",53,300,619,https://twitter.com/EFEnoticias/status/1326458761872101378
79886,2020-11-09,afpespanol,"#ÚLTIMAHORA Brasil suspende ensayos de vacuna china contra el covid-19 por un ""incidente grave"" (regulador) #AFP  https://t.co/vnbtsnah05",25,678,608,https://twitter.com/AFPespanol/status/1325964916793237506
326680,2020-11-10,cuenteromuisne,Vacuna de Pfizer  |   Vacuna rusa  https://t.co/Q4D8BwF4gH,29,91,604,https://twitter.com/CuenteroMuisne/status/1326224313767391233
79832,2020-11-09,nachomdeo,"Brasil acaba de ordenar la interrupción de los ensayos con la Coronavac, la vacuna china contra el coronavirus. LAs versiones indican que es por la muerte de una de las personas sometidas a las pruebas y se extenderá hasta que se tengan certezas sobre el incidente.",15,298,567,https://twitter.com/nachomdeo/status/1325970957194948619
77805,2020-11-11,lvissxz,Ojalá me salga un nuevo brazo con la vacuna china porque tengo muchísimos pendientes.,3,84,560,https://twitter.com/Lvissxz/status/1326537372733853697
331237,2020-11-08,henrychinaski67,"Hoy Guillermo Moreno diciendo que se pondría una vacuna rusa, ""porque es de un pueblo amigo"". Pero que no se pondría la británica -la de Astrazeneca- porque es del enemigo. A su manera hace lo mismo que Viviana Canosa, darle un pésimo mensaje a la gente, que tiene que cuidarse.",51,75,528,https://twitter.com/HenryChinaski67/status/1325302846242189314
329770,2020-11-09,bocacarnaval12,La vacuna Rusa llegó hace rato y viene vacunando a todos sin parar  https://t.co/tX30xznBeV,1,110,526,https://twitter.com/BocaCarnaval12/status/1325793849168556034
330172,2020-11-09,spitta1969,"La vacuna rusa va a poder ser aprobad con la firma del Lolo Limeres, director del ANMAT. Estos tipos fuman bajo el agua en serio.",25,263,519,https://twitter.com/spitta1969/status/1325730206640984066
327118,2020-11-10,osvaldo_quiroga,"Tuve la desdicha de ver tres minutos el programa de Lanata, cuando hablaba de que la vacuna rusa era un ""negocio"" de @alferdez y @CFKArgentina Ignorante, mentiroso y payaso berreta, Lanata miente descaradamente, como tantos otros que hacen de la vacuna rusa un tema ideológico.",24,131,509,https://twitter.com/osvaldo_quiroga/status/1326148606752157702
328993,2020-11-09,angeldebritook,"Jorge Rial se propuso como candidato para darse la vacuna rusa: ""Ojalá sirva para ayudar a los ignorantes"" - Ciudad Magazine  https://t.co/E0Krv2rJ7m",352,28,503,https://twitter.com/AngeldebritoOk/status/1325849275356602378
324353,2020-11-11,matiasrajnerman,"Si desconfiás de la vacuna rusa, inglesa o la que fuera porque está pensada para controlarte y lavarte el cerebro, ni te gastes: es probable ya te hayan controlado y lavado el cerebro antes.",6,94,502,https://twitter.com/MatiasRajnerman/status/1326546113785028608
326254,2020-11-10,germangrudny,Que le aplicaron a Vicky? VACUNA RUSA o SUERO DE CABALLO  https://t.co/dKTJtFBdWd,203,120,501,https://twitter.com/GermanGrudny/status/1326324801640820736
328181,2020-11-09,pulsionparcial,"Brancatelli, Rial y Florencia Peña se ofrecen a ponerse la vacuna rusa. No hacen más que confirmar el diagnóstico presuntivo de debilidad mental que pesa sobre ellos.",34,90,488,https://twitter.com/pulsionparcial/status/1325921241899950082
325268,2020-11-11,martinthrashh,me levanté con la noticia de que la vacuna rusa parece que funciona  https://t.co/JY35GJ2ZkG,0,15,477,https://twitter.com/Martinthrashh/status/1326496747548504064
325349,2020-11-11,cyngarciaradio,‼️URGENTE‼️ La vacuna rusa Sputnik V mostró un 92% de efectividad. Así lo indica el primer análisis intermedio de la tercera fase de los ensayos clínicos. Lo confirmó  el Fondo de Inversión Directa de Rusia.  Anoche lo anticipábamos en @C5N junto a @VHMok en #BatallaCultural ⬇️🎬  https://t.co/iEtR6dcWDa,29,133,467,https://twitter.com/cyngarciaradio/status/1326493102161399810
329442,2020-11-09,infobae,Quiénes son los primeros famosos que ofrecieron aplicarse la vacuna rusa contra el coronavirus  https://t.co/CRadDrfgwM,635,83,466,https://twitter.com/infobae/status/1325818110922919936
328709,2020-11-09,clarincom,"Los famosos que estarían dispuestos a aplicarse la vacuna rusa para ""generar confianza""  https://t.co/jKUWBFGl4G",776,63,465,https://twitter.com/clarincom/status/1325869919175651331
325886,2020-11-11,actualidadrt,"AMPLIACIÓN   Los desarrolladores de la vacuna rusa Sputnik V han anunciado que su efectividad permite empezar la vacunación masiva en las próximas semanas, según lo ha asegurado Alexánder Gíntsburg, director del Centro Gamaleya de Moscú  https://t.co/BoayEvXKih",13,170,456,https://twitter.com/ActualidadRT/status/1326455749929803776
328270,2020-11-09,sergiodwy,Mucha gente que ya decidió que la vacuna rusa no sirve porque no les gusta Putin y porque es la que eligió el gobierno. Creo que ese nivel de fanatismo y cerrazón política no la tenían ni los cruzados que marcharon a Jerusalén en la Edad Media.,26,90,450,https://twitter.com/sergiodwy/status/1325910091225313280
325523,2020-11-11,hlbchr,Veinte segundos después de inyectarte la vacuna rusa SPUTNIK V.  https://t.co/qh1IFVMbf4,6,158,447,https://twitter.com/hlbchr/status/1326484636067717121
326012,2020-11-11,brissiomauro,"-Algunas revistas científicas dicen que la vacuna Rusa no es segura.  -Qué revistas?  -Ni idea, lo escuché en TN.  -Ahí está el problema.",6,120,445,https://twitter.com/BrissioMauro/status/1326375968429273089
321777,2020-11-12,adntv,ALERTA | Desestiman la denuncia contra la compra de la vacuna rusa Sputnik V. El abogado se presentó sin ningún tipo de pruebas @Vanepetrillo ► #ÑoquisDeLaDerecha @C5N  https://t.co/HJ8i2Ty4I4,16,160,432,https://twitter.com/Adntv/status/1327064908966588421
330632,2020-11-08,lnv22,Yo en año nuevo tirando fuegos artificiales despues de darme la vacuna Rusa  https://t.co/I6ZzBFNctE,1,105,420,https://twitter.com/LNV22/status/1325582887148773376
329586,2020-11-09,xmilianx_,QUE ONDA PA NANA GOOOOD LA VACUNA RUSA VAYAN A VACUNARSE INSTA,4,16,419,https://twitter.com/xmilianx_/status/1325806824168300546
325138,2020-11-11,aran_tirado,"La pugna geopolítica, también en el tema de las vacunas. Putin ya ha dicho que la vacuna rusa será patrimonio de la humanidad. China se pronunció en un mismo sentido. ¿Renunciarán también a sus ganancias las farmacéuticas privadas vinculadas a Occidente?",31,300,407,https://twitter.com/aran_tirado/status/1326502926794297344
326464,2020-11-10,blokeoboludos,"""Tengo miedo de los efectos colaterales de la vacuna rusa"" dice Mabel que vive a Clonazepam y antidepresivos.",34,92,403,https://twitter.com/BloKeoBoludos/status/1326276522387386371
321454,2020-11-13,sergiodwy,"Cuando se habla de aumentos de salarios dicen comunismo, impuesto a los ricos, comunismo; control de precios, comunismo, vacuna rusa, comunismo, expropiación de empresas vaciadas, comunismo, apoyo a la democracia en Bolivia, comunismo. La derecha le hace propaganda al comunismo",22,94,392,https://twitter.com/sergiodwy/status/1327227071366635520
322726,2020-11-12,aristeguionline,Vacuna rusa 'Sputnik V' muestra eficacia del 92% en tercera fase de ensayos  https://t.co/qHnsnQRw0s  https://t.co/efBLERENMF,4,49,391,https://twitter.com/AristeguiOnline/status/1326766706753228800
330662,2020-11-08,cesanz1,"Majul hablando ahora sobre el narco García Furfaro, el dueño del laboratorio contratado para distribuir la vacuna rusa. Fui el primero en desnudar a este personaje en esta nota del 2 de noviembre pasado  https://t.co/p6BqKHIxt1",8,142,389,https://twitter.com/CeSanz1/status/1325577144987242497
330445,2020-11-08,alfredodarrigo,"Lo de siempre:en toda la gestión pública del kirchnerismo NUNCA hay personas decentes. Vuelve a ocurrir con vacuna rusa Sputnik: una asociación ilícita está gestionando su llegada a la Argentina. Lo denuncia ahora en #pptbox Lanata,siempre primero en las denuncias,el que se anima",15,190,387,https://twitter.com/AlfredoDarrigo/status/1325618452174938112
327428,2020-11-10,paulinor76,La vacuna rusa no movió el amperímetro. La efectividad altísima de la vacuna de Pfizer revolucionó los mercados y cambió las expectativas. Las diferencias son abismales...,16,51,384,https://twitter.com/paulinor76/status/1326015416469250048
329881,2020-11-09,chuck_lennon,La vacuna Covid-19 de Pfizer y BioNTech es 90% efectiva  La vacuna Rusa Sputnik V es 100% efectiva,26,91,366,https://twitter.com/chuck_lennon/status/1325784860544413697
79874,2020-11-09,rtultimahora,"ÚLTIMA HORA: Suspenden en Brasil los ensayos de la vacuna china contra el covid-19 tras un ""incidente grave""  https://t.co/w2acUZX9F3  https://t.co/nqHBBSNMzo",22,242,366,https://twitter.com/RTultimahora/status/1325966391493718021
321529,2020-11-13,pascual_serrano,"La OMS estudia la vacuna rusa como opción y en Corea del Sur producirán 150 millones de dosis, pero nosotros nos seguimos riendo de los rusos y haciendo millonarios en Bolsa a los directivos de Pfizer. Y buscando neveras para mantenerla a -80 grados.  https://t.co/81chbyTFqj",11,249,363,https://twitter.com/pascual_serrano/status/1327198909018611712
328125,2020-11-09,lanacion,"Vacuna rusa: Jorge Rial, Flor Peña y Diego Brancatelli se ofrecieron a probarla  https://t.co/mfJyYPqRHo  https://t.co/FXkM7T2q1l",508,40,360,https://twitter.com/LANACION/status/1325926423182405632
322935,2020-11-11,licmacoco,Tenembaum + vacuna rusa =  https://t.co/VCS5fIXSLD,13,38,352,https://twitter.com/LicMacoco/status/1326703217997131782
329831,2020-11-09,nesco_ssj,"- Ni bien salga la vacuna rusa los argentinos saldrán corriendo a aplicársela, confiamos en ello  Los argentinos:  https://t.co/CfIxG64wv7",8,25,350,https://twitter.com/nesco_ssj/status/1325788685577687041
327973,2020-11-09,victorfyt,"Culiau, ponete la vacuna rusa.  https://t.co/MvHQyVejbH",21,54,346,https://twitter.com/victorfyt/status/1325941235572420608
330642,2020-11-08,ppt_oficial,"HOY a las 22, te contamos quién es quién en el negocio de la vacuna rusa. #AlbertoTeVacuna  https://t.co/ZDekzR8umW",36,105,343,https://twitter.com/PPT_oficial/status/1325581033341902848
326107,2020-11-10,etupitooriginal,Los macristas burlándose de que volvió el fondo. Cuando se enteren que vinieron a cobrar la que pidió y se fugó el mamerto se inyectan la vacuna Rusa en el ojo👀.,24,119,337,https://twitter.com/Etupitooriginal/status/1326352397371920385
331027,2020-11-08,majulluis,"úLTIMO MOMENTO.  Preparate. Hoy a partir de las 20, inmediatamente después del análisis del 8-N te contamos que hay detrás de HLB Pharma, el controvertido laboratorio argentino que negocia la compra de la vacuna rusa. Es en @lacornisa. Con @guadavazquez. Por @lanacionmas.",14,111,333,https://twitter.com/majulluis/status/1325457072411062278
324890,2020-11-11,elcomerciocom,"#Covid19 | Vacuna rusa Sputnik V contra el coronavirus tiene eficacia del 92%. Gobierno habla de vacunación masiva ""en las próximas semanas"". ¿Efectos secundarios? »  https://t.co/rGLkezgC8n  https://t.co/zlTszQ2GJb",31,93,333,https://twitter.com/elcomerciocom/status/1326515122928574464
325464,2020-11-11,actualidadrt,"La vacuna rusa #SputnikV ha mostrado un 92 % de la efectividad, según se desprende del primer análisis intermedio de la tercera fase de los ensayos clínicos realizados en Rusia   SEPA MÁS:  https://t.co/BoayEvG8TH  https://t.co/MMtzD2dm3Q",12,106,330,https://twitter.com/ActualidadRT/status/1326488090139975681
329531,2020-11-09,pablalunar,no me parece tan descabellada la idea que planteo solamente digo que Alberto Fernández en asociación con el KKK y en nazismo hicieron la vacuna rusa que tiene un chip que se activa con las antenas que están poniendo en todo el país y una vez que se muera pueda asumir Cristina,1,10,326,https://twitter.com/PablaLunar/status/1325810653798526981
323901,2020-11-11,alejandraguayoa,"#SputnikV, la primera vacuna rusa registrada contra la #COVID19, ha probado ser eficaz en el 92% de los casos, según los primeros resultados de las pruebas publicadas este miércoles.   Esto podría acabar muy pronto chavalos. 🙏",18,14,322,https://twitter.com/alejandraguayoa/status/1326579000723066882
