,date,username,tweet,replies_count,retweets_count,likes_count,link,popularity
326619,2020-11-10,m_bronenberg,"Se equivoca quien cree que la gente le teme a la vacuna rusa por ser rusa, la gente le teme porque desconfía profundamente de nuestro gobierno y descree de los presuntos influyentes que la promoverían, por su declarada sumisión ideológica. Duda, también de lo que se inocularían.",5,18,52,https://twitter.com/M_Bronenberg/status/1326235242617839618,25.0
321362,2020-11-13,bbcmundo,Los desarrolladores de la vacuna rusa contra el coronavirus Spútnik V también dieron buenas noticias. Pero todavía es demasiado pronto para cantar victoria.  https://t.co/XQGCagx95R,3,14,58,https://twitter.com/bbcmundo/status/1327247370174738432,25.0
328094,2020-11-09,by__ashley,"DIPUTADO WOLFF💪 🔺️Para el gobierno el que piensa DISTINTO es ENEMIGO 🔺️Ellos NO QUIEREN DIALOGAR, quieren IMPONER👊 🔺️El gobierno debería debatir lo de la vacuna Rusa 🔺️Le falta seriedad al ""VAMOS A VACUNAR A LOS FAMOSOS""👏. Tenés razón WALDO, ya nada es serio 🤨  https://t.co/kxvwBXVV8q",0,26,49,https://twitter.com/by__ashley/status/1325930779952771073,25.0
79667,2020-11-09,emmarincon,Brasil suspende prueba de la vacuna china para el coronavirus:,1,15,59,https://twitter.com/EmmaRincon/status/1325988228101500928,25.0
322014,2020-11-12,idanielflores,"banda, me ofrecí como voluntario para la vacuna rusa COVID-19 y fui vacunado esta mañana en el hospital , fui hacer mis cosas normal y hasta ahora no observo ninguna reaksionoski o efecto sekundarioski pueden estar trankiloski toduski иi meиш че сеитгюд ерпестe аьио овут Лопес",5,9,61,https://twitter.com/iDanielFlores/status/1326986298280845313,25.0
330050,2020-11-09,luisgasulla,"En minutos comienza @periodismoypun2 en @Cultura979 entrevistamos a uno de los médicos más destacados del país x la vacuna rusa, además @german_garavano y @josesbrocco en exclusiva c @alepedrozook ! Los esperamos",0,13,61,https://twitter.com/LuisGasulla/status/1325766804543852545,24.666666666666668
79992,2020-11-09,eabusad,Pasando el tamizaje para el ensayo de voluntario fase 3 de la vacuna china:  - ¿Tipo de sangre? - ¡Azul! - 😒 Descartado.  https://t.co/5O2beLSO8N,2,0,71,https://twitter.com/eabusad/status/1325810928005369857,24.333333333333332
330385,2020-11-08,a24com,"🚨 [#VizzottiEnRM] 🗣️ ""Yo me daría la vacuna rusa, la de Oxford, la china, todas"" @carlavizzotti  En #RM con @rominamanguel    📺 Seguí la entrevista por @a24com  https://t.co/5wpahaNLbn",38,5,30,https://twitter.com/A24COM/status/1325622810803396614,24.333333333333332
79320,2020-11-10,actualidadrt,"La Agencia Nacional de Vigilancia Sanitaria de Brasil (Anvisa) decidió suspender los ensayos de la vacuna china contra el covid-19 tras reportarse un ""incidente grave""   SEPA MÁS:  https://t.co/pMX1AlRQPR  https://t.co/Alm87u31i7",3,34,36,https://twitter.com/ActualidadRT/status/1326103304762499072,24.333333333333332
77320,2020-11-12,tona_je,"""Para aplicarse de inmediato"", llegan a México primeras dosis de vacuna china contra covid de Cansino | El Universal  https://t.co/NRGKe0ftl0",0,14,58,https://twitter.com/Tona_je/status/1326796673075605504,24.0
320713,2020-11-14,alfreparedes,"Mientras que Colombia abandonó el campo, importando casi todo lo que come y enfermará más con las fronteras abiertas al virus, Venezuela está incrementando su producción agrícola con la ayuda de China e inmunizando a su población con la vacuna rusa. Y se ""volteará la torta"". Ojo.",4,15,53,https://twitter.com/alfreparedes/status/1327597508328099850,24.0
77471,2020-11-11,angelcharlsmty,"¿Quién le va entrar?  Busca @NlSalud voluntarios para probar vacuna china que será aplicada en el Hospital Metropolitano.  Son mil dosis y los requisitos son ser mayor de 18 años, sin comorbilidades, en caso de mujeres no embarazadas, ni en lactancia.   https://t.co/2AGhhiHL93  https://t.co/5SvUuVTuUF",19,17,36,https://twitter.com/angelcharlsmty/status/1326675674992619520,24.0
329857,2020-11-09,el_bru,"Parece que en Rusia a la vacuna rusa le dicen solo ""la vacuna"". Vamos a investigar.",3,0,69,https://twitter.com/el_bru/status/1325786845591056384,24.0
78663,2020-11-10,eabusad,"Amig@s, les recuerdo que si alguien quiere participar en el ensayo de la vacuna china como voluntario, me avisa. Me dijeron que pase la voz a gente. Una persona de allí me dio su fono de contacto para que se inscriban voluntarios directamente. Me escriben por mensaje. Gracias.",12,18,42,https://twitter.com/eabusad/status/1326210736406859778,24.0
79653,2020-11-09,matiburgos,🔴 Brasil suspende pruebas con la vacuna china de Sinovac por “severos efectos adversos” 👇🏻 @CNNChile,6,30,36,https://twitter.com/matiburgos/status/1325990130981613568,24.0
326103,2020-11-10,pedrolambertini,"Con todo el halo de misterio y polémica alrededor de la vacuna rusa pretendo cuando me la de, mínimo, superpoderes. De invisibilidad para arriba. ¡O no me la doy!",5,2,65,https://twitter.com/PedroLambertini/status/1326353747560325121,24.0
79114,2020-11-10,gustavo_srcc,"Brasil, prueba de la vacuna china se suspende debido a un: ""evento adverso grave"".",3,25,43,https://twitter.com/gustavo_srcc/status/1326142223377981442,23.666666666666668
322083,2020-11-12,arielbarrios_,"La vacuna Rusa no me la pongo ni en pedo, no creo en esa pavada. Mi horóscopo dice que no confie en nada.",3,2,66,https://twitter.com/ArielBarrios_/status/1326961972047437824,23.666666666666668
328404,2020-11-09,luisgasulla,"Una entrevista con uno de los médicos destacados del país pero los fanaticos se enojan hasta con sus sombras: Director Médico de Emerger: ""La vacuna rusa tiene que pasar por la fase 3 para llegar al mercado"" - Periodismo y Punto  https://t.co/4CYEkrJnXG",1,18,52,https://twitter.com/LuisGasulla/status/1325896494038323200,23.666666666666668
330643,2020-11-08,gustavoeloy635,"@guadavazquez Excelente informe guada , lo de HLB PHARMA es un curro hecho a medida xa la vacuna rusa , tendria que salir en todos lados 👏👏👏👏",0,15,56,https://twitter.com/gustavoeloy635/status/1325580877607399425,23.666666666666668
324416,2020-11-11,santiagobucaram,"Sputnik V, la vacuna rusa contra el Covid-19, anunció hace poco que que su efectividad para disminuir la posibilidad de contraer el virus es del 92% después de los primeros resultados en pruebas a casi 16.000 personas.",5,9,57,https://twitter.com/santiagobucaram/status/1326542366442881025,23.666666666666668
323596,2020-11-11,maxmante,Los Power Rangers después de ponerse la vacuna rusa..  https://t.co/T7RHmuQpao,2,13,56,https://twitter.com/maxmante/status/1326606175375413248,23.666666666666668
329684,2020-11-09,soygraceok1,"Estoy escuchando el tema vacuna rusa, ya que anoche no vi el programa y acá me avisan por cucaracha que a médicos de Pami ya lo están capacitando para la aplicación y conservación de la vacuna",13,18,40,https://twitter.com/SoyGraceOK1/status/1325800075067535361,23.666666666666668
326884,2020-11-10,sebochini,"La vacuna rusa es una prueba cientifica. Pero ver si los pibes se contagian teniendo clases, no. Ojota.",1,11,59,https://twitter.com/Sebochini/status/1326187942361116673,23.666666666666668
77622,2020-11-11,actualidadrt,Brasil retoma los ensayos de la vacuna china de Sinovac contra el coronavirus  https://t.co/ykWsaGSQcU,2,17,52,https://twitter.com/ActualidadRT/status/1326594289812430848,23.666666666666668
78659,2020-11-10,arroyomatteucc1,"¡Bravo Bolsonaro!!   🇧🇷  Suspenden en Brasil los ensayos de la vacuna china contra el covid-19 tras un ""incidente grave"" - RT    https://t.co/qfiFrLNVnQ",5,24,42,https://twitter.com/arroyomatteucc1/status/1326211791085506562,23.666666666666668
329909,2020-11-09,saenzricardo,Filtraciones y contradicciones por la vacuna rusa: resurge la preocupación por la comunicación del Gobierno -  https://t.co/WaQRvgOZRD #VacunaNavideña,4,22,44,https://twitter.com/saenzricardo/status/1325782528838553602,23.333333333333332
322275,2020-11-12,micalasala,"@rechimuzziok Necesitamos a Randall en las calles, hay temas fundamentales a tratar. Ya sea la legalización del cannabis, los ifes, la cuarentena, la vacuna rusa. Hay mucha tela para cortar carajo mierda.",0,0,70,https://twitter.com/micalasala/status/1326916296328491009,23.333333333333332
77406,2020-11-11,eluniversocom,"Suicidio de voluntario, el motivo del freno momentáneo de ensayo de vacuna china en Brasil ►  https://t.co/yiSJyLSuSH  https://t.co/pUkpDpBte4",5,21,44,https://twitter.com/eluniversocom/status/1326717612148056070,23.333333333333332
330500,2020-11-08,anaconustedes,Lanata haciéndole pelota el negociado de la vacuna rusa a Alberto en #PPTBox #YoNoMeVacuno #AlbertoTeVacuna,2,23,45,https://twitter.com/AnaConUstedes/status/1325613853720403969,23.333333333333332
328199,2020-11-09,dolartoday,¿Renunciaron trabajadores del Saime por negarse a colocarse la vacuna rusa?  https://t.co/8czjZbgmYy,6,31,33,https://twitter.com/DolarToday/status/1325919056982134785,23.333333333333332
330762,2020-11-08,macrista_ok,"Solo un kuka fanático, puede no ver la relación directa entre @CFKArgentina, la vacuna rusa, el fallo de la corte, el virus chino, el chip de Bill Gates, el 5g, la cuarentena y la derrota de Trump. Está todo Clarito. El fanatismo los ha cegado. #8NTodosALasCalles  #nopasaran",6,10,54,https://twitter.com/Macrista_oK/status/1325550264011665408,23.333333333333332
329162,2020-11-09,infoen14o,#AHORA. Mariano Iúdica confiesa: Probé una versión de la vacuna rusa y no tuve ninguna reacción adversa.  La Reacción Adversa:  https://t.co/2SlBoyxKc5,2,8,59,https://twitter.com/INFOen14O/status/1325835376376819718,23.0
325897,2020-11-11,santiagommxxi,Confirman que la vacuna rusa tiene una eficacia del 92%. 💪💪💪  https://t.co/ioPZb1ourf,1,19,49,https://twitter.com/SantiagoMMXXI/status/1326453224799399937,23.0
326836,2020-11-10,jackie2927,"""No quiero la Vacuna Rusa porque no se sabe de que está hecha"" decía uno mientras se comía una Big Mac y la bajaba con Coca Cola.",4,21,44,https://twitter.com/jackie2927/status/1326196224962273281,23.0
328514,2020-11-09,ajmechet,hoy a la mañana tuitié sobre la vacuna china para referirme a la vacuna rusa porque dormida y todo pero siempre con claridad sobre quienes son los buenos y los malos y confundiéndome solo a un malo con otro malo 🤣😂,4,2,63,https://twitter.com/ajmechet/status/1325885507893665793,23.0
79789,2020-11-09,clarincom,"AHORA: Brasil suspendió los ensayos de una vacuna china por un ""evento adverso grave""  https://t.co/5I6gwh5WyM",5,19,45,https://twitter.com/clarincom/status/1325974825702203395,23.0
331107,2020-11-08,paulinor76,Gran y necesaria nota sobre el viaje “no confirmado oficialmente” que terminó por sellar el anuncio de la compra de la vacuna rusa. Las internas son un capítulo aparte de la historia que enumera ⁦@nicolaspizzi⁩ con precisión de reloj suizo 👇🏼  https://t.co/YIeMYJoPY8,4,7,58,https://twitter.com/paulinor76/status/1325428976798609408,23.0
79952,2020-11-09,ajmechet,hoy a la mañana tuitié sobre la vacuna china para referirme a la vacuna rusa porque dormida y todo pero siempre con claridad sobre quienes son los buenos y los malos y confundiéndome solo a un malo con otro malo 🤣😂,4,2,63,https://twitter.com/ajmechet/status/1325885507893665793,23.0
330036,2020-11-09,juanperez0015,"@sergiohadla7 @spitta1969 El que habla de fechas es el gobierno. Los que piden respuestas sobre la vacuna rusa son los científicos de todo el mundo, incluidos los rusos.",2,6,60,https://twitter.com/JuanPerez0015/status/1325768861510225920,22.666666666666668
320972,2020-11-13,mision_verdad,La vicepresidenta venezolana planea reunirse con los fabricantes de la vacuna rusa para concretar su producción en el país latinoamericano  https://t.co/h5dQAbQhAv,1,38,29,https://twitter.com/Mision_Verdad/status/1327379463793831938,22.666666666666668
330480,2020-11-08,mariadelos1981,La vacuna rusa aún no fue probada en población vulnerable.  Es decir que no puede usarse en jubilados y discapacitados. Alberto nos quiere vacunar a cualquier costo. #AlbertoTeVacuna  #PPTBox,9,18,41,https://twitter.com/mariadelos1981/status/1325616480365514755,22.666666666666668
322777,2020-11-12,candresperedo,"Youtube explica que paso! Vacuna sera obligatoria para ir a conciertos y festivales! Un polémico tiktok se sale de control!  https://t.co/Xm9zEyKndE Britney se retira luego de perder contra el Juez! Vacuna Rusa ya esta en México, España y Argentina! #YouTubeDOWN  https://t.co/nCpYyWMhQW",4,1,63,https://twitter.com/candresperedo/status/1326739988239818752,22.666666666666668
78071,2020-11-11,el_pais,Brasil suspende los ensayos de la vacuna china contra la covid  https://t.co/4BjhYTl8Q2,4,15,49,https://twitter.com/el_pais/status/1326406963849203712,22.666666666666668
78641,2020-11-10,culturacolectiv,¡Por fin! #México recibió las primeras dosis de la vacuna china contra el #COVID19 para probar en humanos 🙌🏾  https://t.co/HG4WFu0SXk,0,15,52,https://twitter.com/CulturaColectiv/status/1326215544601628674,22.333333333333332
330101,2020-11-09,juanangelmeran1,"La vacuna rusa Sputnik. Vizzotti salió a decir que no se compro ninguna vacuna. Alverso que se compraron 10 millones de dosis y se comenzaba a vacunar en Diciembre. Yo dije , ESTAMOS GANANDO!! Acá esta el resultado.  Hace casi un año nos vacunan.!!!",1,16,50,https://twitter.com/juanangelmeran1/status/1325758665987674120,22.333333333333332
330614,2020-11-08,rominamanguel,"#VizzottiEnRM ""En ningún momento dijimos que la vacuna iba a ser obligatoria"", @carlavizzotti  Habla de todo: la vacuna rusa, las otras vacunas, el viaje a Rusia, el manejo de la pandemia, la relación con Ginés.  ESTA NOCHE-----&gt; 23 hs #RM #A24  https://t.co/nsZhwSJGnd",12,2,53,https://twitter.com/rominamanguel/status/1325587662464495617,22.333333333333332
325369,2020-11-11,florballarino,"Una de las noticias del día: 92% de eficacia de la vacuna rusa #SputnikV. La eficacia se demostró sobre la base de un primer análisis intermedio de los ensayos clínicos fase III obtenido 21 días después de la primera dosis. Hasta el momento, los resultados no fueron publicados.",4,13,50,https://twitter.com/FlorBallarino/status/1326492183441133568,22.333333333333332
324246,2020-11-11,frano_23,@askomartin Pero si vos ya te pusiste la vacuna rusa picarón  https://t.co/6k79QBczZS,3,4,60,https://twitter.com/Frano_23/status/1326551861369843713,22.333333333333332
328839,2020-11-09,periodismoypun2,"Director médico de Emerger: ""La vacuna rusa tiene que pasar por la fase 3 para llegar al mercado""   https://t.co/Sa2DC3sXgx  https://t.co/K6BVRTYPue",2,24,41,https://twitter.com/periodismoypun2/status/1325859053856305153,22.333333333333332
321381,2020-11-13,lisandratlsur1,Vicepresidenta venezolana Delcy Rodríguez @drodriven2 quien se encuentra de visita de trabajo en #Moscú se reunirá con desarrolladores de vacuna rusa #SputnikV para explorar posible producción del fármaco en Venezuela. @teleSURtv  https://t.co/EznacuMvjd,2,28,37,https://twitter.com/LisandratlSUR1/status/1327243759218724871,22.333333333333332
323304,2020-11-11,felicindacluney,Hey chicos del #GobiernoDeCientíficos!  Por qué no hacen un sondeo respecto de quién acepta recibir la vacuna rusa #SPUTNIK V?  Anunciaron que comprarán 25 millones de dosis...  y encuestas dicen que solo 3 de cada 100 personas acepta recibirla.  NO TIREMOS DINERO!,5,20,42,https://twitter.com/FelicindaCluney/status/1326649545934188546,22.333333333333332
328014,2020-11-09,lqmhr,"¡Que vivo @diegobranca ofreciéndose para que le apliquen la vacuna rusa! Total, por mas efectos colaterales que tenga peor no va a quedar.",5,1,60,https://twitter.com/lqmhr/status/1325938326059294720,22.0
322286,2020-11-12,bbcmundo,"Vacuna rusa contra el coronavirus: la ""efectividad del 92%"" de la Sputnik V, según resultados preliminares (y cómo se compara con el anuncio de Pfizer)  https://t.co/Lhlq6vQQUZ",1,20,45,https://twitter.com/bbcmundo/status/1326914023552638977,22.0
327222,2020-11-10,coronavirusnewv,"🇷🇺 | RUSIA  La vacuna rusa contra el coronavirus: “Sputnik V” tiene un 90% de efectividad, según las pruebas realizadas, según fuentes del gobierno ruso. Mientras que Pfizer y BioNTech también han anunciado una vacuna que es 90% efectiva. #Russia #SputnikV #rusia #Pfizervaccine  https://t.co/d15U4XWjz4",3,23,40,https://twitter.com/CoronavirusNewv/status/1326127607256113154,22.0
322620,2020-11-12,carlosmartinezr,@ereija Deja de mentir y manipular. La vacuna rusa es segura y está avalada por la comunidad científica.  https://t.co/I9yTHzQeiW,2,16,48,https://twitter.com/carlosmartinezr/status/1326833267643994113,22.0
324430,2020-11-11,descifraguerra,🇷🇺 El Centro Gamaleya y el Fondo de Inversiones Directas de Rusia (FIDR) anuncian que los datos provisionales de la vacuna rusa Sputnik V demuestran un 92% de eficacia para crear inmunidad frente a la COVID19 durante la Fase 3 de los ensayos clínicos.  https://t.co/q3d4G9DBg1,2,15,48,https://twitter.com/descifraguerra/status/1326541120243789832,21.666666666666668
327914,2020-11-09,claudiosavoia,Mirá... Vacuna rusa contra el coronavirus: el primer millón de dosis que llegue a la Argentina irá a la provincia de Buenos Aires -  https://t.co/AEHNW0Cdii,24,17,24,https://twitter.com/claudiosavoia/status/1325948940995452931,21.666666666666668
331061,2020-11-08,andres_oliva,"Qué avisen si estamos ya en la Normalidad de nuevo? Ya llegó la vacuna rusa, británica, china o yankee?   Córdoba de caravana este sábado por la noche!  https://t.co/k82N2PFEX3",7,3,55,https://twitter.com/andres_oliva/status/1325450014253051904,21.666666666666668
329113,2020-11-09,micronauta,"Lo de la #vacuna en base a mRNA es excelente noticia. Se probó en casi 39k personas, 90% resultó inmune. Esta NO es la vacuna rusa ni la china, ojo. La implicación es que la pandemia puede tener sus años contados, no que hay abandonar distanciamiento aún.  https://t.co/8nOyKarsrn",3,23,39,https://twitter.com/micronauta/status/1325839012268036096,21.666666666666668
324016,2020-11-11,agenciatelam,"La vacuna rusa contra el coronavirus (@sputnikvaccine)"" obtuvo 92% de eficacia en los estudios de la fase 3  https://t.co/LVBtLt1ula",6,17,42,https://twitter.com/AgenciaTelam/status/1326570383177256961,21.666666666666668
321399,2020-11-13,mavica7,"Carrió: “la inteligencia rusa está directamente ligada a Cristina [Kirchner]"". Y pidió: ""No se pongan la vacuna rusa. No se pongan ninguna vacuna que no venga de un país democrático, que no venga con todas las seguridades"".",2,15,48,https://twitter.com/mavica7/status/1327238222662012934,21.666666666666668
79358,2020-11-10,iescolar,"Brasil suspende temporalmente los ensayos de la vacuna china de Sinovac por un ""evento adverso grave""  https://t.co/opGqVWxYbI",8,24,33,https://twitter.com/iescolar/status/1326090862883991553,21.666666666666668
329522,2020-11-09,manueladornito1,Mis glóbulos blancos yendo a cagar a trompadas al coronavirus despues de que me puse la vacuna rusa  https://t.co/4yCiD1clM7,1,10,53,https://twitter.com/Manueladornito1/status/1325811260382994433,21.333333333333332
78738,2020-11-10,aristeguionline,"Fase 3 de vacuna china llega a #Cdmx, Aguascalientes, Coahuila, Michoacán y Nuevo León  https://t.co/UFyYAA2dAV  https://t.co/tacEZ2rI7V",9,4,51,https://twitter.com/AristeguiOnline/status/1326198455467970561,21.333333333333332
77802,2020-11-11,soyfurrr,ojalá con la nueva vacuna china le vuelva a salir a Masiel su bracito,0,1,63,https://twitter.com/Soyfurrr/status/1326538011681595392,21.333333333333332
326996,2020-11-10,rolo98236780,"#DeLaVacunaPienso que hay idiotas que piensan que la vacuna Rusa los vuelve socialistas, y la gringa es genial, la ignorancia está por todas partes y para eso sí hay vacuna. #UrgenteSantoManglar #UrgenteFalabella  https://t.co/HZgJQvqTHX",3,3,58,https://twitter.com/Rolo98236780/status/1326172972168736770,21.333333333333332
78986,2020-11-10,rochaperiodista,Informa el canciller Marcelo Ebrard que la vacuna china de CanSino Bio se aplicará en su fase 3 primero en Oaxaca y Guerrero.  https://t.co/u0h2Puvcf2,2,16,46,https://twitter.com/rochaperiodista/status/1326161807237672968,21.333333333333332
329022,2020-11-09,g_yubari,- La vacuna rusa es un producto de excelencia. Los rusos:  https://t.co/nEleRCHFPb,4,3,57,https://twitter.com/g_yubari/status/1325847071602204672,21.333333333333332
76986,2020-11-13,actualidadrt,"Bolsonaro sobre la vacuna china CoronaVac: ""Quiero saber si ese país usó la vacuna allí, en su país""  https://t.co/oHKnANO5Nh  https://t.co/RE4eS82LGQ",8,15,41,https://twitter.com/ActualidadRT/status/1327230481759309824,21.333333333333332
79087,2020-11-10,silvananhr,"Acaban de informar que en Brasil se suspende el ensayo de la vacuna China porque acaba de morir una persona que no tenia COVID, espero que en Chile no se les ocurra ponérsela 🙏🏻🙏🏻",2,24,37,https://twitter.com/SilvanaNHR/status/1326144742925721601,21.0
323849,2020-11-11,_guilleonidas,"@protestona1 La resultados de la vacuna rusa están contrastados por medios independientes.  La de Pfizer no.  Eso si, vender las acciones antes del anuncio no es muy lógico y es lo que hizo su CEO. A mi me parece raro, raro",0,8,55,https://twitter.com/_guilleonidas/status/1326582863383375873,21.0
77919,2020-11-11,jesussemperfree,La vacuna china tendrá una eficacia del 101%.,11,6,46,https://twitter.com/JesusSemperfree/status/1326492131612094466,21.0
330149,2020-11-09,fabianabrv,"Mientras Lanata nos informa que detrás de la vacuna rusa hay un negociado bien turbio con testaferros de Cristina (para variar), los militantes obnubilados y necios festejan que Masterchef tiene más rating. No hay futuro con pelotudos así. #PPTBox",8,13,42,https://twitter.com/FabianaBrv/status/1325744107864657920,21.0
323291,2020-11-11,profematias,@luisnovaresio @CrazyHourse Los Argentinos confían en la vacuna Rusa mucho más que lo que confían en los medios de desinformación y los periodistas como vos.,2,7,54,https://twitter.com/ProfeMatias/status/1326651623125479426,21.0
324074,2020-11-11,luisnovaresio,¿Los argentinos confían en  la vacuna rusa?  https://t.co/dPACtvtVZC,52,0,11,https://twitter.com/luisnovaresio/status/1326565133041152000,21.0
77350,2020-11-12,albertomuozmuo3,"QUIEN SE ANIMA ⁉️ QUIEN DIJO YO⁉️ NOS QUIEREN DE CONEJILLOS DE INDIAS ‼️  El Universal: ""Para aplicarse de inmediato"", llegan a México primeras dosis de vacuna china contra covid de Cansino | El Universal.  https://t.co/tqsiaZVJAT  a través de @GoogleNews",9,20,34,https://twitter.com/AlbertoMuozMuo3/status/1326759797526564866,21.0
79516,2020-11-10,forbes_mexico,"Mientras Pfizer celebra, Brasil enfrenta otra realidad: el país sudamericano ha suspendido los ensayos de la vacuna china tras un 'evento adverso grave'.    https://t.co/ZHCMO4Yh3D",3,14,45,https://twitter.com/Forbes_Mexico/status/1326016733988184065,20.666666666666668
328813,2020-11-09,sisiclarosi,Como influencer que soy (?) de Twitter voy anticipandoles que no me pienso dar la vacuna rusa para incentivar a mis seguidores. No insistan. BAS TA,5,2,55,https://twitter.com/SiSiClaroSi/status/1325860988718080000,20.666666666666668
329781,2020-11-09,gustavo__olmos,Dice el gobierno que testearon la vacuna rusa en el Pity Álvarez y no hay secuelas visibles  https://t.co/djJ5GfOob8,3,10,49,https://twitter.com/Gustavo__Olmos/status/1325792659630411779,20.666666666666668
321493,2020-11-13,el5delagente,"Agenta #Peñaflor, KGB, vacuna rusa y chucu chucu chucu @gracepenafort 😂",9,8,45,https://twitter.com/El5delagente/status/1327217884393861122,20.666666666666668
76897,2020-11-13,elnocturno,"Trump se está atribuyendo la vacuna ""china"" de Pfizer.",4,5,53,https://twitter.com/elnocturno/status/1327362486413221888,20.666666666666668
324979,2020-11-11,regacarlos,"Vacuna Rusa. 1-Con 20 casos NO pueden afirmar ese nivel de eficacia. 2-el uso de datos observacionales en personas vacunadas de la comunidad NO es lo deseado en este momento. 3-, la segunda dosis es un virus distinto; conviene esperar a ver sus efectos.   https://t.co/hfj5a3jcQf",4,14,44,https://twitter.com/RegaCarlos/status/1326511542691635200,20.666666666666668
320698,2020-11-14,vicevenezuela,"#Enterate || La Vicepdta. @drodriven2 destacó que el Gobierno Venezolano ha planteado propuestas a Rusia para el desarrollo y posible fabricación del antídoto: ""Hemos hecho la propuesta no solamente de comprar la vacuna rusa, sino también de ser un fabricante en Venezuela"".  https://t.co/adoDxdxCKU",0,40,21,https://twitter.com/ViceVenezuela/status/1327606592859156482,20.333333333333332
321521,2020-11-13,pueblobeto,#HabraConsecuencias  #ClarinYLaNacionMienten  👇 Limada Carrió totalmente desquiciada le dice a la sociedad que no se ponga la vacuna rusa  https://t.co/X76pTGz5sK,21,18,22,https://twitter.com/PuebloBeto/status/1327203435960217600,20.333333333333332
78266,2020-11-10,actualidadrt,Supremo Tribunal de Brasil otorga un plazo de 48 horas a la agencia sanitaria para que informe sobre la vacuna china  https://t.co/hSz26SRNbk,1,20,40,https://twitter.com/ActualidadRT/status/1326308721622921216,20.333333333333332
78975,2020-11-10,lajornadaonline,"#VideosLaJornada Conversamos con @HLGatell. Anunció que la @SSalud_mx revisará el expediente del ensayo clínico de la vacuna china, para verificar que se cumplan los requisitos que garanticen la seguridad del estudio.   📹 Video completo:  https://t.co/8vIEj150jv  @AngelesCruzM  https://t.co/7eWdJd6oD8",4,7,49,https://twitter.com/lajornadaonline/status/1326162696073441281,20.0
