,date,username,tweet,likes_count,sentiment_analysis
350662,2020-11-02,jofa2010,el gobierno anunció la compra de 10 millones de dosis de la vacuna rusa no se sabe bien como se hizo la fase 1 y la fase 2 y además falta la fase 3 tampoco se sabe como está compuesta ni cuanto dura la inmunidad ustedes creen que hubo coimas para venderla en argentina,141,Negativo
330743,2020-11-08,juliokohn,julio bárbaro diciendo que el gobierno anterior y este son lo mismo creo que ya se dió la vacuna rusa,140,Negativo
333624,2020-11-06,flamacarp,el club boca juniors insinuó que haber perdido la final de madrid podría estar vinculado con la vacuna rusa,139,Positivo
347577,2020-11-03,martincarrizo_,votaron carne vacuna y les encajaron una vacuna rusa,139,Negativo
356377,2020-11-02,saul4913,instrucciones de aplicación de la vacuna rusa 1 put in,139,Positivo
332007,2020-11-07,tarantini09,t a r a confío más en el peso argentino que en la vacuna rusa,139,Negativo
353317,2020-11-02,ncariola,no puede ser lo de la vacuna rusa lo siento no puede ser es operativo distracción es que están aburridos es que no quieren hablar de temas serios o gobernar tan de película distópica va a ser este gobierno que quiere vacunar con algo que no está probado,139,Negativo
353522,2020-11-02,elangelgmendo,única vacuna rusa que aceptaré,138,Positivo
336780,2020-11-05,lagringa53,tu vieja te ponía kerosene para matarte los piojos y decís que le tenes miedo a la vacuna rusa,138,Negativo
101422,2020-11-05,lagringa53,tu vieja te ponía kerosene para matarte los piojos y decís que le tenes miedo a la vacuna rusa,138,Negativo
336529,2020-11-05,_unavozenoff,día 230 de cuarentena y la política sanitaria de este gobierno de inútiles es esperar sentado una vacuna rusa buen día buenjueves felizjueves,138,Negativo
355676,2020-11-02,dr_artola,puedo opinar por tema vacuna rusa,137,Neutro
352006,2020-11-02,el_anestesiador,vacunate con la vacuna rusa te juro que no nos enojamos,137,Negativo
356250,2020-11-02,zulma54137866,propongo que la vacuna rusa las pruebe primero alverso la chorra asesina y toda su camporonga junto con hebe y estela,137,Negativo
342057,2020-11-03,domadorreposera,la realidad de la vacuna rusa,137,Neutro
345702,2020-11-03,xfabianasolanox,los mismos que chupaban el naranjú hasta la última bacteria ahora no quieren darse la vacuna rusa,137,Negativo
342296,2020-11-03,cosmefulanito0k,cuando te pones la vacuna rusa y empieza a hacer efecto,136,Neutro
335169,2020-11-05,comunicpopular_,periodista por qué yo siento que la vacuna rusa es menos confiable que la de oxford y te pasa eso porque lo escuchas en todos los medios se tenía que decir y se dijo,136,Negativo
355226,2020-11-02,sergiodwy,no me imagino a los últimos combatientes de la guerra fría rechazando la vacuna rusa porque allí hubo comunismo más bien creo que la van a rechazar en público y se la van a aplicar en la clandestinidad porque ni ellos se creen ellos las barbaridades que dicen,136,Negativo
347234,2020-11-03,edufeiok,la trastienda de la vacuna rusa con nombre de satélite que quiere ser la primera en aplicarse en la argentina,136,Negativo
355981,2020-11-02,cronica,el gobierno comprará 25 millones de dosis de la vacuna rusa contra el coronavirus vacuna pandemiadelcoronavirus quedateencasa yomequedoencasa unidoscontraelcoronavirus coronavirusenargentina,136,Neutro
356243,2020-11-02,juanriestra58,antes de ponerme la vacuna rusa me hago peronista ponesela a fiambrola al menos te das el gusto de ponerle algo,135,Negativo
355335,2020-11-02,koala_carnivoro,hola soy cosme boludito y vengo por mi dosis de la vacuna rusa,135,Negativo
80205,2020-11-06,eluniversaloax,entérate este hombre en la foto es el primer mexicano en el país en recibir una dosis de prueba de la vacuna china contra el covid 19,135,Negativo
335620,2020-11-05,mascionorberto,hasta israel compró la vacuna rusa vacunatenoseasmacrista,135,Positivo
348708,2020-11-02,roxanakreimer,el problema de los de extrema derecha q pregonan yonomevacuno es q creen q la vacuna rusa contra el covid q traerán a la argentina te inocula el comunismo para ellos todo aquel q circula fuera de texas después de 1919 es comunista,135,Negativo
332453,2020-11-07,pedrorod9,ser antivacuna no querer darte la vacuna rusa,134,Neutro
343124,2020-11-03,cristinachaca,vacuna rusa generó anticuerpos sin efectos adversos en todos los participantes vía,134,Positivo
333345,2020-11-06,nachomdeo,beto oficializa la elección de la vacuna rusa que recordemos no terminó de mostrar científicamente ni su efectividad ni su seguridad ni ser inocua para todos los grupos alcanzados por el virus sería a partir de fines de diciembre y para 10 millones de personas,134,Negativo
337070,2020-11-04,carlosrozanski,el macrismo dejó vencer millones de vacunas que habían comprado para lucrar y ahora se opone a la vacuna rusa porque su negocio siempre fue la muerte,134,Negativo
337250,2020-11-04,alekoser,cuando sos un hamster pero te vas a poner la vacuna rusa o cual sea porque no sos ningún pelotudo,134,Negativo
339417,2020-11-04,etupitooriginal,no confían en una vacuna rusa prefieren confiar en una que venga de inglaterra confiar en inglaterra que te robo una parte de tu país asesinando a pibes sacrificados por la derecha la derecha que volviste a votar en 2015 ustedes tienen una orgía de pokemones en el marote,134,Negativo
336932,2020-11-04,willicom2000,todos son kirchneristas hasta que les obligan ponerse la vacuna rusa,133,Negativo
351405,2020-11-02,alicfka,yo me imagino al gorila haciendo fila en el hospital pùblico para la vacuna rusa comunista tramitada por cristina que lo puede convertir en kirchnerista al lado en la misma fila un k con la cara de cristina tatuado en el brazo laesperanzarusa,132,Negativo
331431,2020-11-07,a_b_berurier,no están contra la vacuna rusa ni contra la de astra zeneca están contra alberto y cristina si gobernara macri lo aplaudirian por no comprar ninguna vacuna,132,Negativo
352139,2020-11-02,riellodecba,no me dio tiempo te juro que iba a sacar un tuit con el sale una encuesta de intratables para saber si te aplicarías la vacuna rusa previsible,132,Negativo
349515,2020-11-02,malenapichon,te ponés la vacuna rusa 15 minutos después,132,Neutro
333252,2020-11-06,infoen14o,ahora alberto autorizó la utilización en argentina a la vacuna rusa que putin probó en 76 periodistas opositores a su gobierno,132,Neutro
354346,2020-11-02,arial360,sí me puse la vacuna rusa cómo te diste cuenta,131,Negativo
349345,2020-11-02,pagina12,argentina comprará 25 millones de dosis de la vacuna rusa,131,Positivo
350145,2020-11-02,adornimilei,siento que lo más justo es que esas 25 millones de dosis de la vacuna rusa sean aplicadas en los votantes de alberto y sus políticos es su gestión la que lo logró adelante muchachos uds se lo merecen fin,130,Negativo
354743,2020-11-02,vitooooo_,mirá si la vacuna rusa te deja como ivana nadal,130,Negativo
355315,2020-11-02,vanalaeropuerto,vacuna rusa para algunos vacuna de oxford para otros,130,Neutro
337023,2020-11-04,adntv,hice el seguimiento de dos médicos que se aplicaron la vacuna rusa y hoy yo me la aplicaría y se la aplicaría a mi familia estoy a favor de la ciencia y de todo lo que vi en la investigación gustavo periodista argentino en rusia vinculosnarcos,130,Negativo
345836,2020-11-03,laplataradio,códigobaires repercusiones por las dosis de la vacuna rusa que recibirá la argentina infectóloga rompieron las pelotas para que los dejen salir la vacuna es para eso pero resulta que ahora la vacuna está mal sinceramente no los entiendo,130,Negativo
340789,2020-11-03,enojadatipita,8ntodosalacalle no puedo creer q los k me han vuelto antivacuna a mi que me vacunaría contra las canas si hubiera pero vacuna rusa no 8ntodosalascalles,129,Negativo
331776,2020-11-07,zorrillopablo,no me voy a poner la vacuna rusa porque no sé lo que tiene adentro gastón 23 años mientras come un bigmac con una coca cola,129,Negativo
349622,2020-11-02,bigsledgeok,la vacuna rusa que la prueben primero en todos los imbéciles pro cuarentena en todos los empleados públicos en todos los senadores y diputados después mucho después en la ciudadanía,129,Positivo
352109,2020-11-02,canillitadeba,la vacuna rusa es la manaos de las vacunas vacunatevosprimero,129,Positivo
330523,2020-11-08,18tavovargas,no queres la vacuna rusa alberto te compro 22 millones de la inglesa deja de protestar capo el peronismo te salva hasta de vos mismo,129,Negativo
344506,2020-11-03,villarrueldario,ya se viene secretodesumario por la vacuna rusa y el delirio de algunos además es inminente el fallo de la corte sobre los jueces desplazados y te vamos a contar en detalle todo lo que pasa para que no dejes que te mientan desde las 12 con todo,129,Negativo
356985,2020-11-02,fuisoyysereyo,yo quiero que me vacune vladimir ah preferís la vacuna rusa que vacuna,129,Negativo
99163,2020-11-03,enojadatipita,8ntodosalacalle no puedo creer q los k me han vuelto antivacuna a mi que me vacunaría contra las canas si hubiera pero vacuna rusa no 8ntodosalascalles,129,Negativo
354537,2020-11-02,saninmenso,yo cada vez que escucho hablar de la vacuna rusa,128,Negativo
350787,2020-11-02,valeriecres,argentina recibirá dosis de la vacuna rusa qué hace tuiter hace tt a natalia oreiro hermoso,128,Positivo
351922,2020-11-02,rinconet,qué hay de cierto con respecto al chip cortado en concassé que vendría dentro de la vacuna rusa y que nos cambiaría el adn obligándonos a tocar la balalaika sin parar está chequeado por,128,Negativo
345595,2020-11-03,sosagustina,para mí con la vacuna rusa va a pasar como con la jubilación de ama de casa el ife o la atp tres cosas que odian e igual cobran silenciosamente a escondidas,128,Negativo
350880,2020-11-02,felicitas73_,en quién probarías vos la vacuna rusa primero yo en donda,128,Neutro
335533,2020-11-05,antiopereta1,fuerte declaración de alfredo leuco sobre la millonaria compra de la vacuna rusa por parte de israel,126,Neutro
340008,2020-11-03,onlytucuman,messi decidió vacunarse con la vacuna rusa por suerte no tuvo ningún efecto adverso,126,Negativo
340527,2020-11-03,_maga12,armaban vino con botellas que encontraban por ahí hielo que rompían en la vereda de las groovestock y se hacen los que tienen miedo de la vacuna rusa portate bien,126,Negativo
344574,2020-11-03,marcelofavaok,si alguno tiene familiares mayores no permitan que se den esta vacuna rusa ni en dope,126,Negativo
347810,2020-11-03,bixic0me,gente estoy viendo si me doy la vacuna rusa o no cualquier cosa les aviso,126,Negativo
350329,2020-11-02,martincarrizo_,mañana vamos a hablar un poco sobre la vacuna rusa sputnik v info fehaciente,126,Negativo
344280,2020-11-03,emmalaenanuli,conociendo al kirchnerismo el anuncio de la vacuna rusa es tan falso como el título de abogada de la chorra,126,Neutro
351222,2020-11-02,maurusaurus,cuántos más profesionales de la salud escuchas sobre la vacuna rusa más te das cuenta que gobierno no le interesa nada es todo una apuesta con nuestra salud para que no se les venga el gobierno encima,126,Negativo
340701,2020-11-03,klayalejandro,mira si voy a estar preocupado porque la vacuna rusa no está probada del todo si en navidad vuelve a jugar klay alexander thompson si es por mi que venga el mismisimo vladimir putin y me inyecte 1 litro de vodka new style en el gluteo dale warriors,125,Negativo
332415,2020-11-07,seokjinyce,pobre lev le pusieron la vacuna rusa para el covid,125,Negativo
352000,2020-11-02,legadoperon,ojo dicen que la vacuna rusa en la primera dosis te convierte al socialismo y en la segunda podes tener síntomas marxistas como,125,Negativo
355277,2020-11-02,guilleraffo,la vacuna rusa no me la pongo ni borracho y eso que borracho he hecho cosas mucho peores,125,Negativo
348137,2020-11-03,sir_mathius,si sos gay creo que la vacuna rusa te la ponen a los golpes,125,Negativo
347494,2020-11-03,victorfyt,los científicos dudan y mucho de la vacuna rusa contra el coronavirus tenemos derecho a dudar y mucho,125,Negativo
356195,2020-11-02,heb0kita,la vacuna rusa,125,Positivo
355931,2020-11-02,dpenazzi,recien le comenté a mi mujer lo de la vacuna rusa y que aunque esté medio flojita de papeles me la pondria apenas pueda y ella me dice si te convertis en zombie te puedo pegar un tiro en la cabeza ayuda,125,Negativo
331803,2020-11-07,zorrillopablo,yo te vi haciéndote curar la culebrilla con tinta china y ahora te da miedo la vacuna rusa,124,Negativo
350020,2020-11-02,laboicot1,amo que viene la vacuna rusa y todos le agradecemos a natalia oreiro los científicos que crearon la vacuna,124,Negativo
332225,2020-11-07,marileneumayer,ojota investigación de clarin ya se sabe quien está detrás de la vacuna rusa kaosdetrasdelavacuna,123,Negativo
346520,2020-11-03,spitta1969,terminen con este asunto de los nacionalismos científicos esta vacuna rusa no es confiable no porque sea rusa por motivos científicos bien fundamentados,123,Negativo
332666,2020-11-06,malcomgomez,a diferencia del covid la vacuna rusa va a ser obligatoria,123,Neutro
354722,2020-11-02,fandehauche,una cosa es la vacuna rusa otra cosa es el que te vacuna con russo haucheretro,123,Negativo
352833,2020-11-02,astillero78,antes de la vacuna rusa después,123,Neutro
356755,2020-11-02,ambitocom,alerta coronavirus argentina comprará 25 millones de dosis de la vacuna rusa más información en,123,Positivo
357012,2020-11-02,maxitassi,efectos colaterales de la vacuna rusa,122,Positivo
337421,2020-11-04,alesitoide,qué increíble cómo se dedican a tirar fruta diciendo que los resultados de la vacuna rusa no se publicaron y que la fase 3 no existió qué paciencia hay que tener,122,Negativo
338496,2020-11-04,el_anestesiador,la vacuna rusa,122,Positivo
338839,2020-11-04,fideokogima,si yo tomé séptimo regimiento en mentecato mirá si no me voy a poner una vacuna rusa,122,Negativo
357003,2020-11-02,the_dr_justice,alberto fernández dijo en un medio ruso que argentina acaba de adquirir 25 millones de dosis de la vacuna rusa aclaremos q no fue aprobada x otro país fuera de rusia dicen q en diciembre llegan 10 millones al país yo no confío en la vacuna rusa fuente a24,121,Negativo
353666,2020-11-02,johanntenorio,dice lilita que hay que apoyar la vacuna rusa porque si no el kirchnerismo va a empezar a importar vacunas cubanas y venezolanas,121,Negativo
357108,2020-11-02,felipelahiteau,yo llegando a votar después de que kicillof me ponga la vacuna rusa,121,Negativo
343590,2020-11-03,albor_adrian,ya salió clarín a decir que la vacuna rusa no cura el virus que no existe nadie los va a obligar a aplicársela no se van a comprar 50 000 000 de dosis el paciente es soberano en el tratamiento de su salud el que no quiera la vacuna que pruebe sin la vacuna les deseo suerte,121,Negativo
342376,2020-11-03,cyngarciaradio,vacunarusa sputnikv el presidente detalló que no se aplicó las dosis a pesar de que cuenta con dos muestras de la la vacuna rusa sputnik v lo hará el día en que todos podamos vacunarnos no porque tengo el privilegio de ser presidente,120,Negativo
339145,2020-11-04,chainedtolife,a los kirchneristas que insultan o menosprecian a carolina losada por lo que dijo de la vacuna rusa los invito a recagarnos a trompadas si todavía no se atragantaron con polenta seca,119,Negativo
99075,2020-11-05,carlosmaciasal1,volvieron mejores saquen sus conclusiones vacuna d oxford usd 3 5 por 25 millones d dosis usd 87 500 000 vacuna rusa usd 19 90 por 25 millones d dosis usd 497 500 000 diferencia usd 410 000 000 porqué será q todo lo q tocan los k tiene cierto tufillo a cirrupción,119,Neutro
341910,2020-11-03,a_b_berurier,investigación exclusiva de clarín quién está detrás de la vacuna rusa,119,Positivo
336034,2020-11-05,peponila,ahora con sobre la vacuna rusa,119,Neutro
349631,2020-11-02,viggianomila,vacuna rusa tiene una ventaja de logística q no es menor viene en polvo en bolsitas y con un diluyente eso significa q no es necesario mantenerla a 50 grados fuente dr pizzi por c5n,119,Negativo
345820,2020-11-03,cordobesokk,para para para no me digas que él que dejó vencer vacunas aceptó degradar el ministerio de salud a secretaria y asesoraba a jujuy donde explotó su sist sanitario salió a criticar la vacuna rusa,119,Negativo
335192,2020-11-05,carlosmaciasal1,volvieron mejores saquen sus conclusiones vacuna d oxford usd 3 5 por 25 millones d dosis usd 87 500 000 vacuna rusa usd 19 90 por 25 millones d dosis usd 497 500 000 diferencia usd 410 000 000 porqué será q todo lo q tocan los k tiene cierto tufillo a cirrupción,119,Neutro
357199,2020-11-02,elvio_bono,no se ustedes pero yo a la vacuna rusa no me la pongo ni en pedo,119,Negativo
350448,2020-11-02,ivordonez,por qué desconfías de la vacuna rusa la produce un gobierno autoritario que desaparece activistas políticos encarcela minorías y envenena políticos opositores se reelige por cuarta vez con 77 y no acepta peer review ni comparte metodología de la vacuna sobreideologizado,118,Negativo
356689,2020-11-02,perfilcom,vacunarusa ahora argentina recibirá 25 millones de dosis de la vacuna rusa contra el coronavirus lo confirmó alberto fernández,118,Negativo
347942,2020-11-03,soypablomiguel,las dudas sobre la vacuna rusa son razonables pero no se como le da la cara a la gente que quiere tomar lavandina para cuestionar su rigurosidad científica,118,Negativo
354296,2020-11-02,ngeles1111,para mí que lo de la vacuna rusa es para chorearse la plata,118,Negativo
332632,2020-11-06,wingezker,si la vacuna rusa te inyecta comunismo la de oxford te hace pirata,118,Negativo
357124,2020-11-02,paomdeo,esto de elegir entre rafecas o peñafort es mas o menos lo mismo que elegir entre virus chino o vacuna rusa dunga dunga o muerte,117,Negativo
336373,2020-11-05,cocainfame,ya se que no descubro nada pero no le damos demasiada prensa a los pelotudos que dicen que no se van a dar una vacuna rusa,117,Negativo
330652,2020-11-08,maelevemaria,que tienen en común el laboratorio hlb pharma que manejaría el tema de la vacuna rusa un restaurante el pollo sin espina y la agencia de seguridad los templarios además de la misma dirección lacornisa,117,Negativo
346014,2020-11-03,lqmhr,les cuento como termina esto la vacuna rusa te la vas a dar gratis en el hospitales públicos si querés la de astra zéneca o pfizer te la van a dar en vacunatorios privados vacunar stamboulián etc pagándola como privado al triple de lo que sale afuera,117,Negativo
338356,2020-11-04,calientasol,tome leche al pie d una vaca sin pasteurizar comí nísperos subido al árbol y sin lavarlos tome mate en la playa con churros rellenos q me vendió un tipo q los llevaba en una canasta al sol y uds me quieren convencer q no me ponga la vacuna rusa xq es peligrosa yomevacuno,116,Neutro
353192,2020-11-02,seba_pintor,te pones la vacuna rusa y quedás medio putin,116,Neutro
347264,2020-11-03,santillanjuli1,antes de la vacuna rusa después de la vacuna rusa yonomevacuno y vos,116,Negativo
351532,2020-11-02,bautizita,se pondrian la vacuna rusa,116,Neutro
355483,2020-11-02,rosariob11,que la vacuna rusa primero se la inyecten a los kirchneristas total si causa daño cerebral no se les va a notar,115,Negativo
358066,2020-11-01,bastarevolution,la vacuna rusa que nos quieren meter trae cepas de comunismo y kirchnerismo no sé si mata al virus pero a los pocos días hacés la v peroncha tomás termidor del pico te metés en un terreno a sembrar perejiles abandonás para siempre el jabón y le das a una luchona en calzas,115,Negativo
355803,2020-11-02,marielboyne,la vacuna rusa se va a producir en la india corea y china hoy les da un ataque al gorilismo,115,Negativo
342526,2020-11-03,pacourondo,infobae y la izquierda diario en contra de la vacuna rusa,115,Negativo
99275,2020-11-03,larroschi,yo despues de la vacuna rusa,115,Negativo
348055,2020-11-03,larroschi,yo despues de la vacuna rusa,115,Negativo
341376,2020-11-03,gatosylvestre,hoy 20hs m1 en mas informaciòn sobre la vacuna rusa opinan la especialista en vacunas del conicet dra daniela hozbor y el dr luis càmera y ademàs el significado politico del fallo de la corte con y opina con confechadevencimiento,114,Neutro
348785,2020-11-02,ucrnacional,en vivo tenemos un presidente que habla demasiado y en la vacuna no tiene ninguna necesidad de dar fechas la vacuna rusa no está ratificada por la oms y deberíamos tener prevenciones en,114,Negativo
355208,2020-11-02,alemoreno_10,cuando me ponga la vacuna rusa,114,Negativo
356970,2020-11-02,catamarco,me meto cervezas artesanales de cualquier antro mirá si no me voy a meter la vacuna rusa,114,Negativo
341001,2020-11-03,el_vengak,me duele la cabeza tomate un migral me duele la pierna actron 600 me duele la muela evanol tengo gripe tomate un cura plus me voy a poner la vacuna rusa estas loco que es eso de saltarse etapas,114,Negativo
342077,2020-11-03,apapell,qué pasó con la vacuna rusa trump y putin han competido en las fakes ojalá putin se quede solo,113,Negativo
340097,2020-11-03,tomasgiebert,vacuna rusa y summer party el 24 y 31 donde firmo,112,Positivo
352804,2020-11-02,natiftorres,si el gobierno se hubiera negado públicamente a adquirir la vacuna rusa también estarían llorando pues adolfberto dictador que le niega la cura a su pobre pueblo,112,Negativo
340594,2020-11-03,mayorbwpayne,no sé por qué nos sorprendería que trajeran la vacuna rusa si hace ochenta años mínimo que importamos la versión más pedorra de cuanta ideología o moda pedorra ande dando vueltas,111,Negativo
353901,2020-11-02,curarlaracha,para darse la vacuna rusa tienen que inventarse un nombre ruso alternativo qué nombre se pondrían yo jereni lesbianina,111,Negativo
344223,2020-11-03,gabrielsoglio1,y cómo si fuera poco lo que tuviste que soportar este años el kirchnerismo te va a vacunar con una vacuna rusa,110,Negativo
355552,2020-11-02,brunoo_89,no te quiero asustar pero compraron la vacuna rusa que te deja la cara como un waffle,110,Negativo
352120,2020-11-02,rmrojas58,les voy avisando ni en pedo dejo que me pongan esa vacuna rusa,110,Negativo
339367,2020-11-04,eltreceoficial,grieta por la vacuna rusa florencia peña se paró en la vereda de enfrente de viviana canosa yo me súper mega vacuno siempre fui muy vacunable,109,Neutro
348456,2020-11-02,gimenacardoso7,vacuna rusa tomar cloro,109,Positivo
342517,2020-11-03,licmacoco,entonces la onda sería más o menos así si te gustó los hermanos karamazov no rompas las bolas y tenele fe a la vacuna rusa,109,Negativo
351101,2020-11-02,nahu_thompson_,vacuna rusa,109,Positivo
343925,2020-11-03,bigsledgeok,sobre la vacuna rusa destruyeron todo el país y tenemos más de 31 000 muertos encerrados como ningún otro país ahora a las apuradas compran 25 millones de dosis a rusia que está en fase de testeo ni siquiera aprobada cómo vas a militar eso termo yonomevacuno,109,Negativo
340925,2020-11-03,claudiosavoia,vacuna rusa en argentina el misterioso laboratorio de san isidro que hará de puente entre los rusos y el gobierno clarin,109,Neutro
349435,2020-11-02,eabordagaray,vacuna inglesa costó 5 dólares vacuna rusa costó 15 dólares al medio de todo está inmunda negociación esta ginés la fiscalía descansa señor juez,108,Positivo
355740,2020-11-02,lanacion,el gobierno comprará 10 millones de dosis de la vacuna rusa sputnik v llegarán en diciembre al país,108,Positivo
340656,2020-11-03,rubalef,victor hugo dijo que un 25 de gente influenciada por los medios anti cuarentena no se aplicarían la vacuna rusa gracias y dentro de poco queda toda para los que creemos en los rusos y apoyamos al gobierno de y,108,Negativo
356166,2020-11-02,jotafrisco,pff metí en mis ojos los fotogramas de la película 4x4 mirá si no voy a aplicarme la vacuna rusa,108,Negativo
345486,2020-11-03,agenciatelam,el gobernador de la provincia de buenos aires axel kicillof dijo que es un disparate atacar a la vacuna rusa sputnik v por su procedencia y destacó que tiene los mismos avales que las occidentales,108,Negativo
354581,2020-11-02,fedeengwar,adivinen si vamos a discutir acaloradamente el tema de la vacuna rusa para luego ver que simplemente es un tongo sin ningún tipo de consecuencia para la vida de nadie,108,Negativo
355742,2020-11-02,thebosteer12,guarda con la vacuna rusa,108,Positivo
351279,2020-11-02,eldestapeweb,todo sobre la vacuna rusa qué se sabe de la sputnik v que llegará a argentina,108,Negativo
357964,2020-11-01,micaeladej,carla vizzotti viajó en secreto a rusia para comprar en secreto la vacuna rusa cuyo desarrollo y pruebas son llevados a cabo en secreto y así empezar a vacunar a la población argentina en 15 días hablemosdecobayos,107,Neutro
353895,2020-11-02,wiemeyer,ya hablamos de los efectos de la vacuna rusa no perdón no puedo evitarlo ante cada mención,107,Negativo
352648,2020-11-02,rwsalomon,se acuerdan cuando anunció la 1ra cuarentena se acuerdan cuando anunció el testeo rápido argentino se acuerdan cuando anunció la producción de la vacuna en arg ahora anunció la compra d 25 mill de vacuna rusa lo cierto hoy crecimiento exponencial de los muertos millón,107,Negativo
354324,2020-11-02,ceci_neo,no no me voy a dar la vacuna rusa y menos obligada porque no soy un sujeto de investigación aun si lo fuera eso sería optativo y hasta remunerado y tendría una vigilancia cercana por efectos adversos le pagamos a los rusos para que experimenten su vacuna con nosotros es no,107,Negativo
348781,2020-11-02,ezequielsalasok,raúl tachero y oyente de radio mitre dice que no va a ponerse la vacuna rusa suspendemos la compra,107,Negativo
343826,2020-11-03,el_vengak,cada vez que un macrista opina de la vacuna rusa inevitablemente me acuerdo de esto,106,Negativo
354042,2020-11-02,leiro59,vamos con una encuesta y que llegue al sr presidente te pones la vacuna rusa si es la única que llega,106,Negativo
