,date,username,tweet,replies_count,retweets_count,likes_count,link
30687,2021-03-06,pksconsultores,"El tardío comunicado del Minsa no desmiente el fondo de la denuncia sobre el resultado del estudio sobre la vacuna china en el Peru, no menciona los resultados del estudio de la Cayetano Heredia, ante una situación tan grave, cambiar de tema equivale a confirmar lo dicho.",4,39,89,https://twitter.com/PKSConsultores/status/1368188484054351881
32656,2021-03-04,danielvalar,¡¡¡¡Me aplicaron la vacuna china para el virus chino!!!!  En 28 días ojirrasgado y hablando mandarín  https://t.co/2KVjYFUnDF,9,0,88,https://twitter.com/danielvalar/status/1367618578141376515
143425,2021-03-01,etupitooriginal,Le dijeron Conchita Fernández y hoy salió con la escopeta. Mejor sigan pidiendo que les den la vacuna Rusa que tanto criticaron.,2,12,88,https://twitter.com/Etupitooriginal/status/1366565655777075200
135565,2021-03-09,dolorcilloo,Dice mi esposa que son por los efectos de la vacuna rusa.  https://t.co/ogqFqGkmQ9,1,29,88,https://twitter.com/dolorcilloo/status/1369137843482820610
142196,2021-03-03,gnbgdjuvenal,"El plan de vacunación del personal de salud sigue su marcha con las primeras dosis de la vacuna rusa Sputnik-V, y ahora se suma la vacuna china Sinophram. Pronto recibiremos importantes cantidades para la inmunización progresiva y masiva de todo el pueblo de Venezuela.  https://t.co/BxAJDJLVuu",10,97,87,https://twitter.com/GNBGDJuvenal/status/1367125605737771009
142723,2021-03-02,errordesconocid,Leo que las infantas se han puesto la vacuna rusa y es que no sé por dónde empezar. Es que es inabarcable eñ despropósito.,4,24,87,https://twitter.com/errordesconocid/status/1366883644053147650
27620,2021-03-07,2manalytics,"Ante la pregunta de por qué deicidieron el uso de una vacuna que aún estaba en estudio, Coralith García declara que ella no decidió el uso de la vacuna china, que esa no es su responsabilidad.",4,61,87,https://twitter.com/2MAnalytics/status/1368602528288538627
35477,2021-03-02,rafampicin,"Una doctora : Oye, y si llegara vacuna china, te la pondrías? Otro doctor: ay no yo no La misma doctora: Y tú? Te la pondrías?  Yo: claro! Me urge! Cualquier vacuna es mejor que ninguna vacuna.",1,8,87,https://twitter.com/rafampicin/status/1366586750668308480
33801,2021-03-03,gnbgdjuvenal,"El plan de vacunación del personal de salud sigue su marcha con las primeras dosis de la vacuna rusa Sputnik-V, y ahora se suma la vacuna china Sinophram. Pronto recibiremos importantes cantidades para la inmunización progresiva y masiva de todo el pueblo de Venezuela.  https://t.co/BxAJDJLVuu",10,97,87,https://twitter.com/GNBGDJuvenal/status/1367125605737771009
31892,2021-03-05,willaxtv,#BetoASaber | @ErnesBustamante explica los análisis encontrados del estudio clínico de la vacuna china.   En vivo:   https://t.co/4AJELMLOQ2 ClaroTv:  C12 MovistarTV: C16 DirecTV: C1191 BestCable C8  https://t.co/udVDJ40lnl,7,33,87,https://twitter.com/willaxtv/status/1368027643245965318
138936,2021-03-06,redradiove,#ÚLTIMAHORA | Arriba a Venezuela segunda dosis de la vacuna rusa Sputnik-V  https://t.co/MNZzNpOdOp,1,83,86,https://twitter.com/RedRadioVe/status/1368246733843664898
21021,2021-03-13,jorgescala2021,La vacuna china #Sinopharm está en fase III de investigación. La estudian en la #Argentina las Fundaciones #Huésped y #Vacunar. La ministro Vizzotti recibe 1 sueldo de Vacunar e integra Huésped. Al asumir aprobó el uso de esa vacuna x el #coronavirus. Amigas son las amigas…,3,52,86,https://twitter.com/JorgeScala2021/status/1370707637491412993
142875,2021-03-02,rppnoticias,"Sagasti sobre iniciativa privada para compra de vacuna rusa Sputnik-V: ""No está registrada"".  https://t.co/BlOV2Ys4HG  https://t.co/4dNcgSjnMI",62,13,86,https://twitter.com/RPPNoticias/status/1366836258627063816
134044,2021-03-10,dravaleria,"Ya quiero mil “indignados” Beatriz Sarlo MINTIO Ademas sabiendo q había una grieta instalada respecto de la vacuna “rusa” denunciada como “vacuna veneno”, a la re pregunta del periodista dijo JAMÁS ME LA DARÍA PREFIERO MORIR  Esta mujer representa LA INMORALIDAD DEL ODIO DA ASCO  https://t.co/XyvWniaxRV",5,39,86,https://twitter.com/dravaleria/status/1369737091006017543
133829,2021-03-10,andre4t1,"Y llegaron más vacunas, 200 mil dosis de la vacuna rusa SputnikV,como parte del acuerdo que hizo Presidente @lopezobrador_  con Presidente Putin. Es enorme el esfuerzo y gran labor que se está haciendo, dado el acaparamiento que hay, 10 países tienen  el 80% de las vacunas.  https://t.co/YNqURhAJ5v",3,53,86,https://twitter.com/andre4T1/status/1369818220568350721
31326,2021-03-06,ralburquerquer,"Nos vacunamos en el Colegio Médico Dominicano con mucha juventud, me dijeron eran estudiantes de medicina que sirven en hospitales y familiares de médicos. Ni sentí la inyección. !Ironía: vacuna china!",7,7,86,https://twitter.com/RalburquerqueR/status/1368052652869828612
34852,2021-03-02,presidencialven,Venezuela ha aprobado el uso de la vacuna china Sinopharm para inmunizar al pueblo venezolano frente al COVID-19.  Gracias a la cooperación China-Venezuela atendemos la salud y vida de nuestro pueblo.  Más información ⏩  https://t.co/GovbFcOtzO  https://t.co/H947F52RKp,7,161,86,https://twitter.com/PresidencialVen/status/1366789476111036419
27004,2021-03-07,mippcivzla,"#EnVivo 🔴 | Pdte. @NicolasMaduro: Hemos aplicado el 70% de las vacunas rusas al personal de salud, ya llego la segunda dosis. Mañana lunes arranca la vacunación con la vacuna china ya hemos establecido las prioridades  .  #CuidémonosMás  https://t.co/lrOd7juZ4k",0,683,85,https://twitter.com/Mippcivzla/status/1368669697185550340
30056,2021-03-06,hipocresiaroja,"@RPPNoticias Es INFO, gracias a @willaxtv recién admites que diste registro a la vacuna China sin tener estudios de fase 3, son unos asesinos",2,26,85,https://twitter.com/Hipocresiaroja/status/1368242507956510723
137870,2021-03-06,actualidadrt,📺 NOTICIERO RT   📌 El presidente de Paraguay pide a sus ministros que pongan sus cargos a su disposición en medio de protestas masivas  📌 Maduro recibe la primera dosis de la vacuna rusa Sputnik V contra el coronavirus   Con @carlavgonzalez    https://t.co/dCCNttFrBO,2,43,85,https://twitter.com/ActualidadRT/status/1368350816982204423
22545,2021-03-11,partidazocope,💥 ÚLTIMA HORA | El COI pagará una dosis de la vacuna china a cada deportista olímpico y paralímpico  💉 También ofrecerá dos dosis adicionales por cada atleta para la población de sus respectivos países  https://t.co/K5qQsH4fAP,4,33,85,https://twitter.com/partidazocope/status/1370004822146113540
141724,2021-03-04,mrsahuquillo,"💉Ahora sí. La Agencia Europea del Medicamento (EMA) ha iniciado la revisión de la vacuna rusa contra el coronavirus Sputnik V. La solicitud la presentó R-Pharm Germany GmbH, subsidiaria 100% alemana de la farmacéutica rusa R-Pharm. De la UE ya la aprobaron Hungría y Eslovaquia  https://t.co/lp2BO7oChM",4,54,85,https://twitter.com/mrsahuquillo/status/1367406642053197827
29525,2021-03-06,jcavil_pe,"@TitoWanka @Azulgroneixe Y ya presentaste tu denuncia contra Vizcarra o Mazetti, o es un caso de doble moral patológica... en fin, efectos adversos de la vacuna china",9,9,85,https://twitter.com/Jcavil_pe/status/1368287986413154326
29855,2021-03-06,mmmifla,con la vacuna china encima que yo soy fan de mao desde cemento me conozco todos sus temas,1,0,85,https://twitter.com/mmmifla/status/1368257177782214656
142907,2021-03-02,hcoya,"🔴 Director-fundador de empresa peruana FARVET, Manolo Fernández, asegura a comisión especial de @congresoperu que la ivermectina y la hidroxicloroquina son más eficaces que la vacuna de #Pfizer y están al nivel de la vacuna rusa #SputnikV 🤷🏽‍♂️",22,42,85,https://twitter.com/Hcoya/status/1366828661840752643
33867,2021-03-03,granvilas,Se han puesto la vacuna china las infantas. La vacuna de la segunda división. Esto es el fin. El crepúsculo de los privilegios.,6,8,85,https://twitter.com/Granvilas/status/1367113944658284544
35184,2021-03-02,fantrampa,Nunca... me tendria... que... haber... dado... LA VACUNA CHINA  https://t.co/Y6oZdNKJdT,1,0,84,https://twitter.com/FanTrampa/status/1366724531851829262
22432,2021-03-11,ndchiariello,La próxima semana llegarán al país 3 millones de dosis de la vacuna china de Sinopharm .La ANMAT terminara de analizar los datos para poder recomendarla para mayores de 60 ?Pakistán que no la había aprobado para &gt;60 hace pocos dias la recomendó para ese grupo  https://t.co/O5ucvmhokK,3,22,84,https://twitter.com/ndchiariello/status/1370032906261962763
22298,2021-03-11,susanajimepa,Virus chino y vacuna china 🙈 en manos de Dios,10,25,84,https://twitter.com/SusanaJimePa/status/1370056210863505409
25555,2021-03-08,hromanowy,"Después que se descubrio el Complot para tumbar el Gob de Sagasti, Ahora salen los Golpistas a decir ""Sagasti compro la Vacuna China, antes que se tenga los Resultados del Ensayo Clínico"" Como dijo Marco Sifuente ""Gob compró a ciegas y por una Corazonada"" Esto todavía no termina",10,19,84,https://twitter.com/HRomanoWy/status/1369004995325071360
139841,2021-03-05,pepebarr1,"""Es increíble que en todo el mundo se busque la vacuna rusa y en Perú se pone trabas a la empresa que puede traerlas""  María Neal en #BetoASaber  https://t.co/QTOJUuvkef",6,20,83,https://twitter.com/pepebarr1/status/1368024880785088514
133636,2021-03-11,diegodruca,"@Peperino222 @Lukit_az 1. Hasta hace un mes la vacuna Rusa era floja de papeles. No es lo mismo tener duda sobre  una vacuna que ser anti. Y si, es lenta e insuficiente. 2. Es decisión política, no obligatoria. Mejor forma puede ser, única, no. 3. No es gratuita, es subvencionada por el estado.",12,2,83,https://twitter.com/diegodruca/status/1369990140786008064
136365,2021-03-08,bbcmundo,"La revista especializada The Lancet mostró que la vacuna rusa tenía una eficacia del 91,6% contra el coronavirus, a la altura de las mejores del mundo    https://t.co/FwpAs4582H",6,52,82,https://twitter.com/bbcmundo/status/1368876424929677316
136948,2021-03-07,actualidadrt,Macedonia del Norte aprueba la vacuna rusa Sputnik V contra el coronavirus   https://t.co/PPrO38vbO7,1,21,82,https://twitter.com/ActualidadRT/status/1368612098587103233
23687,2021-03-09,agildemeisterrh,"Cuiden a sus adultos mayores padres, madres, abuelos, abuelas, pues tenemos un gobierno que miente y les inocula una cuestionada y poco o nada eficiente ""vacuna"" china, en lugar de la vacuna Pfizer, la primera vacuna en eficiencia en el mundo. Que cada uno decida, no el gobierno.",2,32,82,https://twitter.com/agildemeisterrh/status/1369472079943397383
34818,2021-03-02,m_modernel,Antes de                   Después de            la                                    la     Vacuna China           Vacuna China  https://t.co/MPFr8eEgDH,5,4,81,https://twitter.com/M_modernel/status/1366797485990109188
27570,2021-03-07,jpereyra1952,LA VACUNA CHINA TIENE UNA EFECTIVIDAD DE MÁS DEL 80% EN EL RESTO DEL MUNDO. ¿POR QUÉ WILLAX DICE QUE EN EL PERÚ SÓLO TIENE 30 y 11 %? ¿Será porque el chaufa y el cau cau han alterado nuestro ADN? #WillaxVerguenzaNacional  https://t.co/B6szTFlM47,6,30,81,https://twitter.com/jpereyra1952/status/1368607829066711043
142827,2021-03-02,mmendoza1970,"@TifaniRoberts Boaco le ganó la serie a León, el Canelo peleó con un sopa y vino primero la vacuna rusa que las gotas mágicas de Maduro (🤣).",5,3,81,https://twitter.com/Mmendoza1970/status/1366848165043974149
142857,2021-03-02,marinalobl,Ni cotiza que Froilán se ha puesto la vacuna rusa.,8,10,81,https://twitter.com/marinaLobL/status/1366840035568480257
135420,2021-03-09,afpespanol,"[AMPLÍA] Italia prevé producir 10 millones de dosis de Sputnik V entre julio de 2021 y enero de 2022.  La vacuna rusa ha sido aprobada según sus fabricantes en 46 países, pero todavía no por la Agencia Europea de Medicamentos, que comenzó a examinarla #AFP  https://t.co/F77Cbtf5St",2,64,81,https://twitter.com/AFPespanol/status/1369250486365339652
142712,2021-03-02,cnnee,"En Nicaragua ya comenzó la vacunación voluntaria contra el covid-19. Este martes se inyectaron las primeras dosis de Sputnik V, la vacuna rusa.  https://t.co/zYjFu7LBjZ",4,16,81,https://twitter.com/CNNEE/status/1366887321732337671
140920,2021-03-04,bbcmundo,"Pese a la gran demanda en el mundo que tiene la vacuna rusa, sólo el 30% de los rusos está dispuesto a ponérsela  https://t.co/eHZVsyN95S",9,39,80,https://twitter.com/bbcmundo/status/1367565364264108043
21016,2021-03-13,_carlitarocha,Gobierno Vizcarra Morado: Compró pruebas rápidas que no permitió diagnosticar efectivamente el Covid  Cerró las postas médicas  Compró vacuna china de #Sinopharm que no es efectiva para proteger del Covid  No es acaso eso genocidio?,6,30,80,https://twitter.com/_CarlitaRocha/status/1370711171528003586
137752,2021-03-06,telesurtv,Un avión con el segundo lote de 100.000 dosis de la vacuna rusa #SputnikV contra el coronavirus destinado a #Venezuela aterrizó este sábado al Aeropuerto Internacional Simón Bolívar en Maiquetía  https://t.co/PHCB6dtjjB,0,49,80,https://twitter.com/teleSURtv/status/1368374339062484994
138655,2021-03-06,aristeguionline,Nicolás Maduro y su esposa reciben primera dosis de vacuna rusa Sputnik V | Video  https://t.co/gAjGcIVLT6  https://t.co/Wd2sUDhcSW,31,7,80,https://twitter.com/AristeguiOnline/status/1368265131600326661
32139,2021-03-05,osmarycnn,Anunció  @NicolasMaduro que “el lunes comienza la vacunación con la vacuna china”,23,89,79,https://twitter.com/osmarycnn/status/1367994904631205892
34076,2021-03-03,_punhal_,"Todo el sistema político y mediático del Estado español está construído para generar una opinión negativa de China (entre otros) e inocular en la población miedo y rencor hacia el país para que al final la Familia Real use sus privilegios para recibir, adivinen, la vacuna china.  https://t.co/gyJgUMH95L",4,37,78,https://twitter.com/_Punhal_/status/1367056949552930816
136355,2021-03-08,infobae,La presidenta la Agencia Europea de Medicamentos aconsejó no aprobar el uso de la vacuna rusa Sputnik V | Por Juan Dillon  https://t.co/6qzGelJ5yb,38,84,78,https://twitter.com/infobae/status/1368885950730932229
30557,2021-03-06,tribebonaparte,"@ErnesBustamante se ratifica al ser entrevistado por @Phill_Butters en @willaxtv y PBO RADIO 91.9 FM : la vacuna China ""no sirve"" Atento tuto @KikeBravoPrado  @LucianoRevoredo",4,31,78,https://twitter.com/TribeBonaparte/status/1368200432598847491
24133,2021-03-09,dw_espanol,"China y la diplomacia de la vacuna  Muchos países, incluso en Europa, reciben la vacuna china, mientras el gigante asiático se reposiciona.  #madeforminds /e  https://t.co/65TD8ieF5u",4,48,78,https://twitter.com/dw_espanol/status/1369373673790918657
34574,2021-03-02,52municipios,Apuesto doble contra sencillo a que vacuna China a 1.500 miles de millones de habitantes que Madrid vacune a sus mayores de 80 años.,9,32,78,https://twitter.com/52municipios/status/1366852482740215812
26514,2021-03-07,partido_peru,ROXANA CUEVA...EN PANORAMA...AFIRMA PRIMERO...EL DR.BUSTAMANTE ES CANDIDATO DE FUERZA POPULAR...EL DR. BUSTAMANTE...CONTESTA: ...YO NO VENGO COMO CANDIDATO...ESTA MERMELERA..QUIERE CUBRIR...LA CAGADA DE LA VACUNA...CHINA...!!!!,4,29,77,https://twitter.com/partido_peru/status/1368738045642563586
29983,2021-03-06,maryju333,"Los MÉDICOS PERUANOS y Lagarto se han comportado como IGNORANTES, al comprar VACUNA CHINA TENIENDO COMO BASE ESTUDIO EN EMIRATOS ÁRABES.SIN REGISTRO INTERNACIONAL! UNA LASTIMA POR PERÚ!",4,39,77,https://twitter.com/maryju333/status/1368247870391021575
32411,2021-03-05,lopezdoriga,"#AHORA La vacuna china de Sinovac contra el COVID-19 ya podrá aplicarse en México a partir de este fin de semana, confirmó el canciller Marcelo Ebrard  https://t.co/b7qOwNYGsh",17,17,77,https://twitter.com/lopezdoriga/status/1367865795901022210
23561,2021-03-10,_carlitarocha,#BetoOrtiz a @VBermudezV : “Los Emiratos Árabes Unidos 🇦🇪 están teniendo que poner una 3ra dosis de la vacuna China 🇨🇳 de Sinopharm ante la baja efectividad. Mientras que Pakistán 🇵🇰 dice que vacuna china no es efectiva para los mayores de 60 años” #NoALasVacunasChinas  https://t.co/3DZp5lEyNf,12,32,77,https://twitter.com/_CarlitaRocha/status/1369499662181400580
137607,2021-03-07,juanandresllan1,"@HDeSotoPeru Sabes Hernando deja de pensar que el peruano es cojudo, sabemos bien que la Trilogía Soto, Aliaga, Keiko esta de pie y lo demostraste de ir a abrazar y levantarlo con jubileo. Ambos coinciden con presionar a Sagasti que autorize a los empresarios a privatizar la vacuna rusa.",9,18,77,https://twitter.com/JuanAndresLlan1/status/1368411253257945088
22952,2021-03-10,diariounoperu,"🚨#ATENCIÓN | #Elecciones2021 🇵🇪 | FALSO: Candidato de Renovación Popular, #LopezAliaga, da información falsa sobre la vacuna de #Sinopharm. Vacuna china ha sido comprada por Bolivia, Argentina y Venezuela. Además, el Estado ha comprado vacunas de #Pfizer y de #AstraZeneca.  https://t.co/K7xPpFxQjB",16,28,77,https://twitter.com/DiarioUnoPeru/status/1369754504292401155
139341,2021-03-06,ptv_noticias,Premier Bermúdez: Estamos en negociaciones para adquirir la vacuna rusa Sputnik V  https://t.co/CVa7OVD422  https://t.co/t4UZ7Ue70s,51,15,76,https://twitter.com/PTV_Noticias/status/1368201472094183426
30159,2021-03-06,uterodetitina,La vacuna china es efectiva porque lo dice Xi Jingping.,0,17,76,https://twitter.com/uterodetitina/status/1368234886184701954
140932,2021-03-04,dw_espanol,"#SputnikV inicia trámites para su probación en la UE  La Agencia Europea de Medicamentos comenzó a analizar la calidad y la eficacia de la vacuna rusa. De ser aprobada, unos 50 millones de europeos podría empezar a inmunizarse con el fármaco a partir de junio de 2021. /mgp  https://t.co/KSvM3bMgC0",3,46,76,https://twitter.com/dw_espanol/status/1367561734450409474
140633,2021-03-05,maytatristan,"La Unión Europea recién está evaluando la aprobación del uso de la vacuna rusa Sputnik V.  Creo que se aprobará pronto.  Sin embargo, a nivel local reclaman que nos estamos demorando cuando recién han presentado la información para evaluación.",3,21,76,https://twitter.com/MaytaTristan/status/1367674387256774660
140728,2021-03-04,cuadernosandino,📽️ #Video 🔴 La oposición de #Nicaragua protesta porque se adquirió la vacuna Rusa. Pero... ¿Ellos qué gestión han hecho? ¿Quieren la vacuna y4nqui? 🙄🤢🤮 #UnidosPorElBienComun 🔻 @M0R1TA_ @CuadernoSandino @nica_rojaynegra @DrSuazo915 @mijamart88 @samcarrion18  https://t.co/xLSLGyvqaX,2,55,75,https://twitter.com/CuadernoSandino/status/1367632866566430721
24553,2021-03-09,profedmusica,Primera dosis de la vacuna china.  Primera secuela: ganas de hacer una Revolución Cultural (?)  https://t.co/iRpnSTRSvJ,9,0,75,https://twitter.com/profedmusica/status/1369303968799748096
136070,2021-03-08,peronchostandup,"La oposición dice que no hizo campaña antivacunas. Elisa Carrió diciendo textualmente “No se pongan la vacuna rusa”, no fue campaña antivacuna. Fue pensamiento crítico en torno de una alternativa de inmunización sobre un fino colchón de denuncias rústicas. Ya entendí.",1,22,75,https://twitter.com/PeronchoStandUp/status/1368945262849298434
25291,2021-03-08,exilekook,mañana me vacuno con la vacuna china y no podía faltar el chiste de mi mama diciendome vas a estar re contenta mira si empezas a hablar como tus chinos BASTA PATRICIA TU HUMOR ES INSULSO NO SOS PARA NADA GRACIOSA,2,0,75,https://twitter.com/exilekook/status/1369066649194758150
142966,2021-03-02,jpplusni,"❗️ En el Hospital Cruz Azul, de la ciudad de Managua, en #Nicaragua, pacientes de la tercera edad y con padecimientos crónicos esperan su primera dosis de la vacuna rusa anti covid #SputnikV.   Este fármaco es aplicado de forma gratuita y voluntaria en ese país centroamericano.  https://t.co/8Ka05Qyb9q",2,34,74,https://twitter.com/jpplusni/status/1366813223916359682
23720,2021-03-09,kjulisaoq,"@EdwardV79130645 @VelardeJackie Si ese fuera el caso, no tiene nada de que preocuparse. Mi mamá recibió las dos dosis de la vacuna china y está súper bien. La ignorancia es atrevida.",8,1,73,https://twitter.com/kjulisaoq/status/1369467569804021762
26749,2021-03-07,prensafanb,"📢 #EsNoticia || El Pdte. @NicolasMaduro informó que el 70% de las vacunas rusas han sido aplicadas al personal médico, al tiempo que reiteró que el próximo lunes continuará el proceso de inmunización con la vacuna china. #CuidémosnosMás #EscudoBolivariano2021 #FANB #Venezuela  https://t.co/KH7Ex40P2q",1,144,73,https://twitter.com/PrensaFANB/status/1368705414871842820
134168,2021-03-10,osodeplatino,"No entiendo realmente cual es el problema de que le hayan ofrecido a una figura publica vacunarse como parte de una campaña para generar confianza, en enero cuando muchos desconfian(abamos) de la vacuna rusa.",9,5,73,https://twitter.com/osodeplatino/status/1369705212852715524
141527,2021-03-04,mortimer_fu,"Europa va a probar la vacuna rusa Sputnik V. Os recuerdo que no se puede beber durante 42 días después de ser vacunado con esta vacuna. No va a triunfar mucho aquí, no.",12,7,73,https://twitter.com/Mortimer_Fu/status/1367428662543450115
143419,2021-03-01,mmendoza1970,Que sirva para algo Ortega y se vacune (si acaso no lo hizo ya) frente a las cámaras y le de confianza a la gente (aunque el dictador daría desconfianza) como sugirió @al_malespin.  ¿O no confían en la vacuna rusa? ¿Acaso son las gotas mágicas de Maduro?,5,9,72,https://twitter.com/Mmendoza1970/status/1366568330883137540
25819,2021-03-08,romerocaroperu,Los atajos de la vacuna de Sinopharm en el Perú. Clamorosas omisiones previas a la llegada de la vacuna china fueron relatadas por funcionaria de Digemid a Comisión carbone.  https://t.co/DcUYG9NQhe ¿También denunciarán este reportaje?...  https://t.co/nqWKgU6KrK,0,26,72,https://twitter.com/romerocaroperu/status/1368950277299183620
31723,2021-03-05,deliamunozym,"@ColumbusOpina @peru21noticias @Politica_ECpe @Gestionpe @diariocorreo @atvmasnoticias @canalN_ @Latina_Noticias @ExpresoPeru @Latina_pe @BankadaFP Escuchando el análisis sobre la vacuna china, es tan terrible, que sólo espero se trate de un horrible enredo!! No puede ser cierta tanta maldad en medio de una pandemia!! A mantener la calma, la desesperación puede causar lamentables situaciones",16,15,72,https://twitter.com/deliamunozym/status/1368031602094247943
30712,2021-03-06,robertomiranora,"@contracultural Cierto, el destape de Vacunagate fue de Carlos Paredes, pero Willax lo difundió, después los medios mermeleros tuvieron que hacerlo. Del mismo modo, el estudio de la poca efectividad de la vacuna china no es de Willax, sino de  San Marcos y la Cayetano, Willax solo lo difundió.",7,20,72,https://twitter.com/RobertoMiraNora/status/1368185946663976965
35287,2021-03-02,telesurtv,"El presidente de #Venezuela, @NicolasMaduro anunció la llegada del lote de 500.000 dosis de la vacuna china contra el coronavirus, como parte de la colaboración entre ambos países y en especial en la lucha contra la Covid-19 en la actual pandemia  https://t.co/Eg6KxmgGeX",1,46,72,https://twitter.com/teleSURtv/status/1366697288718897153
28807,2021-03-06,charitoabc,@julioguzmanperu Estás con roche porque hasta la vacuna china te gana en porcentaje de efectividad 🤣🤣🤣🤣🤣,8,11,72,https://twitter.com/CharitoABC/status/1368369390035628044
138362,2021-03-06,vicevenezuela,"#EnFotos || El Pdte. @NicolasMaduro y la Primera Combatiente @ConCiliaFlores recibieron la primera dosis de la vacuna rusa #SputnikV contra el #COVID19, como parte del plan de inmunización de la nación.   #EscudoBolivariano2021  https://t.co/VURpUorVcq",0,178,71,https://twitter.com/ViceVenezuela/status/1368289880304926720
135953,2021-03-08,wsa_92,La presidenta de la Agencia Europea de Medicamentos aconsejó no aprobar el uso de la vacuna rusa Sputnik V | Christa Wirthumer-Hoche dijo que faltan datos sobre el desarrollo del inoculante: “Necesitamos documentos que podamos revisar”.  https://t.co/hIwpMryFTt,5,51,71,https://twitter.com/WSA_92/status/1368977223701651458
134163,2021-03-10,alekoser,También lo que pasa es que son tan paqueques que las estrategias comunicacionales no llegan ni a implementarse que hay que cambiarlas. Un día no se quieren vacunar con la vacuna rusa: estrategia de concientización. Al día siguiente quieren la vacuna pero más rápido: cancelar.,3,12,71,https://twitter.com/AleKoser/status/1369706591784689664
27850,2021-03-07,patricia_neyra,No tienes que coincidir en todo con Beto pero puedes reconocer que es de los pocos que les canta sus verdades al gobierno sacando información tipo el #VacunaGate  Y si eres 3era edad y quieres vacunarte con la vacuna china pues hazlo y ya! #YoApoyoAWillax #YoApoyoABetoOrtiz,2,16,71,https://twitter.com/Patricia_Neyra/status/1368579026986688518
137617,2021-03-07,partidopsuv,Presidente Nicolás Maduro y Primera Combatiente Cilia Flores reciben primera dosis de vacuna rusa Sputnik-V  https://t.co/6RTAXb0UaM #EscudoBolivariano2021  https://t.co/uNWuu7wwgD,7,174,70,https://twitter.com/PartidoPSUV/status/1368408564465819649
32688,2021-03-04,unopinologomas,"la vacuna "" CHINA ""  https://t.co/BDJ9JgKa4v",3,1,70,https://twitter.com/unopinologomas/status/1367599322477559810
143434,2021-03-01,hipocresiaroja,"La gente pobre en Perú 🇵🇪 llora por vacunas, prefiere pagar 40 soles por una vacuna rusa que miles de soles por balones dé oxígeno, quebrados por el confinamiento y falta de oxígeno, ahora vemos a progres de clase media, rojos llenos de resentimiento, celebrando la muerte 🤮",5,25,70,https://twitter.com/Hipocresiaroja/status/1366563103811469312
