,date,username,tweet,likes_count,sentiment_analysis
346395,2020-11-03,litvinanibal,che están todos locos si la vacuna rusa es buena habrá que vacunarse si la vacuna rusa no sirve no te vacunarás pero dejemos las ideologías estamos hablando de la salud si sirve para que mucha gente no muera no te parece que va más allá de las ideologías o qué,187,Negativo
336280,2020-11-05,canillitadeba,la prueba mas clara de q la vacuna rusa se trata de un curro es q no es una compra directa de estado a estado se hace mediante un laboratorio flojo de papeles de intermediario ya sabemos,186,Negativo
348318,2020-11-03,tomas_reynolds,con qué autoridad ginés que le pifió a todos los pronósticos del covid en la argentina ahora proyecta tanto con la vacuna rusa,186,Negativo
344707,2020-11-03,eldiariodeleuco,el ex ministro de salud adolfo rubinstein explicó que todavía no están terminados los ensayos clínicos de la vacuna rusa sputnik v el gobierno se está adelantando un poco,186,Negativo
357642,2020-11-01,sabateleo,la vacuna rusa va a costar entre 15 y 20 dólares la de oxford menos de 4 a qué no sabés cuál se va a importar claro la de putin 6 millones de unidades para sanidad y personas de riesgo goood shoooow,185,Negativo
340316,2020-11-03,eldestapeweb,rodríguez saá cruzó a los críticos de la vacuna rusa generan desesperanza,184,Positivo
335702,2020-11-05,fantoche_triple,abuela va a tener que darse la vacuna rusa es obligatorio soy juanse pelotudo,184,Negativo
347208,2020-11-03,isocagarcia,maravillosa jornada para exigir que los del 48 se apliquen la vacuna rusa empezando por ojos de caca con semejante estándares de calidad y tiempo de prueba nada puede fallar quien te dice por ahí la quedan todos y empezamos a ser un país más o menos normal buenos días,183,Negativo
350395,2020-11-02,_pegaquenoduele,traducido como nadie sabe un carajo sobre la vacuna rusa mejor que se la de el negrito de la matanza primero después vemos,183,Negativo
345517,2020-11-03,clarincom,daniel gollan sobre la vacuna rusa contra el coronavirus será un éxito sanitario espectacular,182,Positivo
333737,2020-11-06,mae_rusia,el presidente de rusia vladimir putin e y el presidente de la república argentina alberto fernández abordaron porlas perspectivas de materializar los acuerdos existentes sobre la aplicación de la vacuna rusa sputnikven la república argentina,182,Neutro
357002,2020-11-02,loderaulo,amparo urgente el tipo ya compró 25 millones de dosis de la vacuna rusa nos matan a todos,182,Neutro
354437,2020-11-02,soygraceok1,ya salió el tío beto a decir que pensó que nos íbamos a poner contentos con la vacuna rusa,181,Negativo
337480,2020-11-04,lavidayelcanto,el anmat debe aprobar la vacuna rusa previamente pasó novaresio y advirtió que el anagrama es matan ojo eh esa no la vimos venir,181,Negativo
357982,2020-11-01,nachomdeo,el problema con la vacuna rusa es que aún no completó los tres pasos de las pruebas que se exigen para saber no solo que es efectiva sino que ese procedimiento se sigue para saber que no va a provocar efectos adversos es decir que no va a curar a muchos y enfermar a otros,181,Negativo
330501,2020-11-08,eltreceoficial,el monólogo de jorge lanata en ppt box si la vacuna rusa la descubrían acá le hubiesen puesto néstor albertotevacuna,180,Negativo
339866,2020-11-03,martincarrizo_,les dejo mi nota para borderperiodismo sobre la vacuna rusa sputnik v dudas y controversias sobre la vacuna rusa vía,180,Positivo
356696,2020-11-02,jotaxtv,fantinoalatarde la encuesta de la tarde el gobierno compraría 25 millones de dosis de la vacuna rusa vos te la darías,180,Negativo
354448,2020-11-02,el_anestesiador,yo creo que la vacuna rusa deberían aplicarselas primero los diputados y senadores que aprobaron la ley y todo el gabinete nacional,179,Negativo
336863,2020-11-04,julioargroca21,resultó la distracción de la vacuna rusa contra el dólar,179,Neutro
333569,2020-11-06,elema_nuell,a mi se me quemaron las tostadas creo que también está vinculado con la vacuna rusa,178,Negativo
349516,2020-11-02,telesurtv,presidente de argentina alberto fernández afirmó que el país podrá obtener 25 millones de dosis de la vacuna rusa sputnik v contra la covid 19,178,Negativo
338754,2020-11-04,emmalaenanuli,me di la vacuna rusa,176,Negativo
337538,2020-11-04,marianocaba,pero alverso compró 25 millones de unidades para equilibrar un poco vió india negó el permiso para los ensayos de fase iii de la vacuna rusa por falta de datos sobre su seguridad,175,Negativo
355102,2020-11-02,walhallamann,te pondrías la vacuna rusa sputinik v,175,Positivo
336303,2020-11-05,gabrielsoglio1,si el dólar blue aumenta es el único tema que abordan los medios hegemónicos si el dólar blue baja la vacuna rusa es el único tema que abordan los medios hegemónicos,175,Negativo
330608,2020-11-08,sebas166019,te ponían kerosene para los piojos y le tenés miedo a la vacuna rusa,175,Negativo
333026,2020-11-06,jotaalonso,después del informe de todos los irresponsables que hablaron de la vacuna rusa en deberían dedicarse a comentar fútbol como hacía nelson castro en su momento de esplendor no ahora claro está,175,Negativo
355970,2020-11-02,agcesch,no festejen antes de tiempo la vacuna rusa es en enema,174,Negativo
335963,2020-11-05,errordesconocid,cinco partidos nacionales 9000 partidos regionales ninguno exigiendo la compra de la vacuna rusa o la china más avanzadas para salvar vidas y reabrir la economía contra las imposiciones de la ue,173,Negativo
337149,2020-11-04,periodismoypun2,grave denuncia de por los antecedentes del laboratorio que está detrás de la llegada de la vacuna rusa al país,172,Negativo
340557,2020-11-03,elcomandantesup,la vacuna rusa ya tienen nombre milagro sala nadie se anima a ponérsela,172,Negativo
354474,2020-11-02,asantaana,ahora que viene la vacuna rusa que quede claro que los grupos de riesgo y los estalinistas tenemos prioridad camaradas,172,Negativo
356892,2020-11-02,josefinah05,pregunta para los abogados o legisladores si yo no quiero aplicarme la vacuna rusa porque tengo dudas hay algun amparo posible,171,Negativo
99235,2020-11-03,carlosmaciasal1,que triste abominable y denigrante es mezclar la salud del pueblo con pérfidas ideologías políticas solamenta argentina y venezuela comprometieron la compra de la sospechada vacuna rusa,171,Negativo
349338,2020-11-02,davidvincent97,me di la vacuna rusa y estoy 10 puntos,171,Negativo
349531,2020-11-02,pulsopopular_,alberto fernández confirmó que el gobierno tiene dos dosis de la vacuna rusa a disposición pero que no se la aplicó todavía me han ofrecido vacunarme pero no me parece justo tener este privilegio por ser el presidente,171,Negativo
345488,2020-11-03,carlosmaciasal1,que triste abominable y denigrante es mezclar la salud del pueblo con pérfidas ideologías políticas solamenta argentina y venezuela comprometieron la compra de la sospechada vacuna rusa,171,Negativo
353267,2020-11-02,rinconet,me dicen que la vacuna rusa vendría con un chip que te cambia el adn y te hace cantar rusia nuestra patria sagrada rusia nuestro amado país cada mañana ojo con eso,171,Negativo
347395,2020-11-03,urieldesimoni,probaron la vacuna rusa en gatos y ratones how it started how it s going,170,Positivo
344252,2020-11-03,clarincom,gratuita obligatoria y para grupos de riesgo cómo será la aplicación de la vacuna rusa contra el coronavirus,170,Neutro
355792,2020-11-02,eldoce,argentina recibirá 25 millones de dosis de la vacuna rusa contra el coronavirus gt gt,170,Neutro
346563,2020-11-03,irmaar,mientras el mundo espera con ansiedad vacunas confiables para el covid19 desde el ámbito oficial quieren imponer a rajatabla la vacuna rusa la sociedad resiste y con razón descree de un gobierno que hizo de la mentira la base de su gestion la confianza está rota,170,Negativo
354667,2020-11-02,liberte800,si como te diste cuenta que use la vacuna rusa sputnik v,170,Negativo
353577,2020-11-02,barcademar,vacuna rusa sputnik v en hospital público en un gobierno peronista laesperanzarusa,170,Positivo
80983,2020-11-03,patmalanca,vengo contando mi experiencia con la prueba de la vacuna china de sinopharm con las dos dosis puestas no he sufrido ningún síntoma adverso el cuidado médico es intenso me llaman cada dos días y me envían formularios para testearme a diario confiar siempre en la ciencia,169,Negativo
357405,2020-11-02,emmalaenanuli,la vacuna rusa métansela ustedes,169,Positivo
335848,2020-11-05,diergoals,antes de la vacuna rusa después de la vacuna,169,Negativo
342876,2020-11-03,lanacion,sputnik v el gobierno defendió la vacuna rusa y confirmó que será gratuita,168,Positivo
336530,2020-11-05,yaelrosenfeld,se aplicaría la vacuna rusa es una pregunta tramposa la que habría que hacer es se aplicaría una vacuna que todavía no ha completado sus ensayos clínicos,168,Negativo
342368,2020-11-03,marcelofavaok,una locura el gobierno declaro que la vacuna rusa sera obligatoria es mas la policia podria solicitarte que muestres un certificado si te vacunaste o no,167,Negativo
339076,2020-11-04,chuck_lennon,la opinión de carolina losada sobre la vacuna rusa es generar angustia desesperanza y desesperación esta relacionado a lo que dijo esteban bullrich que los argentinos y argentinas tienen que vivir en la incertidumbre la derecha no perdona necesita tu resignación,167,Negativo
348404,2020-11-02,laromiscalora,me encanta que sean tan prudentes con la vacuna rusa los mismos que se la pasaron de fiesta clandestina en fiesta clandestina yo estoy desde encerrada desde marzo inyéctame coca cola intravenosa hermane confío y me chapo a la enfermera,167,Negativo
337341,2020-11-04,winogradvictor,voy a hacer un breve hilo sobre las vacunas el gobierno como ya hizo varias veces con otras cosas anuncia irresponsablemente la posibilidad de una vacunación masiva entre diciembre y en enero con la vacuna rusa eso es un disparate y en el gobierno lo saben,166,Negativo
347798,2020-11-03,leottte,si la vacuna rusa no viene con una botella de vodka absolut de regalo no me interesa,165,Negativo
344446,2020-11-03,mis2centavos,la vacuna rusa también tiene mala prensa por esa costumbre de putin de envenenar opositores,165,Negativo
350373,2020-11-02,victorfyt,esta es la publicación de the lancet sobre la vacuna rusa sólo se cumplieron las fases 1 y 2 con lo cual aún no están determinadas la toxicidad y las reacciones adversas una locura total comprarla en estas condiciones,164,Negativo
352102,2020-11-02,laucha_rt,vacuna rusa dejar vencer vacunas,163,Positivo
357751,2020-11-01,berlich,entre el virus chino y la vacuna rusa malaya triste destino los cobayos argentinos,163,Negativo
343410,2020-11-03,_luzdemarfil,chicos yo tome un balde de la mezcla en la barra boliche mira si no me voy a poner la vacuna rusa,163,Negativo
340644,2020-11-03,radiomitre,graciela ocaña pidió que se informe el costo de la vacuna rusa y si fue aprobada por la anmat,163,Negativo
352057,2020-11-02,mr_bugman,cancherean con la vacuna rusa pero a ver quién se da la vacuna croata,163,Negativo
342023,2020-11-03,braindamage79,sin vacuna rusa con vacuna rusa,162,Positivo
330499,2020-11-08,mis2centavos,lanata hace un informe sobre la vacuna rusa y todo el tiempo le dicen él y los otros periodistas sputnik 5 es sputnik v con v de vurro,162,Negativo
340376,2020-11-03,valle_nora,el tema no es la vacuna rusa el tema es que si este gob trae la vacuna termina con el virus y acomoda la economia de verdad no vuelven mas nunca mas se entiende,162,Negativo
346041,2020-11-03,infobae,coronavirus la vacuna rusa se aplicará primero a grupos de riesgo y será gratuita,161,Neutro
340475,2020-11-03,andahazi,en minutos arranca mirá la corte falló literal las falsas expectativas que alienta alberto con la vacuna rusa ln 21 hs,161,Neutro
343094,2020-11-03,18tavovargas,si no les gusta la vacuna rusa esperen la de macri que llega en el 2do semestre,161,Negativo
350745,2020-11-02,santosjorgeh,diputado de jxc y la vacuna luis petri ucr el gobierno de científicos quiere comprar una vacuna rusa cuyo único estudio se realizó en 72 personas por 42 días sin placebo y sin voluntarias mujeres esa vacuna es una ruleta rusa,161,Negativo
349068,2020-11-02,gabrielpalumbo,lo de la vacuna rusa va a ser un caso emblemático de corrupción de muchos niveles superpuestos guardemos todo archivemos porque va a ser historia,160,Negativo
346687,2020-11-03,fabiojquetglas,soy pro vacunas y me parece una buena noticia disponer de una vacuna eficaz sin preferencia por su país de origen ahora bien las decisiones públicas deben ser explicadas cuáles son las ventajas objetivas de la vacuna rusa en términos económicos de calidad o disponibilidad,160,Negativo
356483,2020-11-02,lilapau,rt si queres la vacuna rusa fav si preferis los dolares,159,Neutro
352910,2020-11-02,alomecha,ni en rusia es obligatoria la vacuna rusa,158,Neutro
354563,2020-11-02,juancristonomo,quiero ser el último argentino en vacunarse antes preferiría ver cómo les va a todos v9n la vacuna rusa saludos,157,Negativo
356449,2020-11-02,romyk81,vacuna rusa,157,Positivo
331852,2020-11-07,ricalfonsin,coronavirus israel recurre a la vacuna rusa y compra 1 5 millones de dosis para atender la pandemia,156,Neutro
356206,2020-11-02,maritadedi,todos sabemos gracias a quién vamos a tener la vacuna rusa no,155,Neutro
101596,2020-11-02,julynalin,que te salve la vida un gobierno peronista con una vacuna rusa no tiene precio,155,Negativo
335113,2020-11-05,ale_jan_dro_soy,algun medico que explique esto dicen que la vacuna rusa ya está siendo analizada en la anmat para su aprobación puede explicar algún medico como lo anmat puede autorizar una vacuna que no cumplió con los protocolos internacionales cumpliendo las 3 fases obligatorias,155,Negativo
80839,2020-11-03,aristeguionline,participarán hasta 15 mil mexicanos en fase 3 de pruebas de la vacuna china contra covid 19,155,Neutro
354041,2020-11-02,julynalin,que te salve la vida un gobierno peronista con una vacuna rusa no tiene precio,155,Negativo
330435,2020-11-08,sebiturtora,impresionante data de de los vínculos del kirchnerismo con los empresarios elegidos para traer la vacuna rusa su prontuario y la dudosa capacidad operativa para llevar a cabo el trabajo para ver una y otra vez atención,154,Negativo
337674,2020-11-04,bjs_alejo7,la vacuna rusa,154,Positivo
352899,2020-11-02,superfedepirata,amo estos trolxs que deben fisicoquímica del secundario argumentando contra la vacuna rusa llamate a silencio por pudor aunque sea,154,Negativo
349956,2020-11-02,alesaviola,tomé champagne caliente que te daban con una entrada de 50 pe en arena mira si no me voy a poner una vacuna rusa,154,Negativo
342794,2020-11-03,osvaldo_quiroga,el grado de mediocridad del periodismo vernáculo que odia al gobierno llega a límites absurdos atacan a la vacuna rusa que viene a beneficiar a los argentinos aviso a la horda de ignorantes rusia no es un país comunista y si lo fuera sería lo de menos alguna vez piensen,154,Negativo
355443,2020-11-02,cristianferdez,recién leí a un trolo diciendo q no se va a poner la vacuna rusa jjjjd pero si vos ibas al túnel de amerika,154,Negativo
345528,2020-11-03,vacilon__,vacuna rusa llega a la argentina boffe me inyecto la sputnik v efectos secundarios toda la verdad,153,Negativo
341895,2020-11-03,santosjorgeh,ahora comparación corrige error comparación vacuna rusa 19 90 dólares vacuna de oxford 3 5 dólares en 25 millones de unidades gobierno argentino 410 000 000 millones de dólares más se entiende por qué la rusa,153,Negativo
350961,2020-11-02,opinadorsistema,libertarios diciendo que me paga putin para hacer lobby de la vacuna rusa jajajajajaja,153,Negativo
355422,2020-11-02,fromthewest86,les recuerdo estos datos acerca de la vacuna rusa fase 1 2 en 76 personas 25 32 años gt 70 hombres 98 blancos fase 3 empezó en septiembre 40 000 voluntarios y los resultados estarían en mayo 2021 lugares de estudio todos en rusia datos,152,Negativo
356095,2020-11-02,rosariotres,argentina obtendrá 25 millones de dosis de la vacuna rusa sputnik v contra el covid 19 entre diciembre y la primera quincena de enero anunció el presidente del país alberto fernández en una primicia concedida a sputnik rosario3,152,Neutro
346171,2020-11-03,gus_lato,quiero advertirles que yo participé como voluntario de las pruebas de la vacuna rusa y trae algunos efectos secundarios a veces me agarra que про акапельное пение и нишевость интересов я сейчас занимаюсь йогой голоса на марафоне у светлана герс она одна из множества,152,Negativo
347276,2020-11-03,edmundodantes_,che amigo qué pensas de lo que dice duggan de la vacuna rusa vos te vacunarías yonomevacuno,151,Negativo
349060,2020-11-02,juancristonomo,yo ya me declaré voluntario para no darme la vacuna rusa arranquen ustedes,151,Negativo
335805,2020-11-05,matimow,israel compra la vacuna rusa y desmonta todo el temita ultra ideológico que quieren crear respecto de su proovedor,151,Negativo
357058,2020-11-02,agenciaelvigia,argentina comprará 25 millones de dosis de la vacuna rusa,151,Positivo
340045,2020-11-03,youngmirko3,ni idea que dicen de la vacuna rusa yo me la acabo de clavar y estoy re bi мы с тобой займемся сексом,151,Negativo
357084,2020-11-02,ruviaverde,ni pienso ponerme una vacuna rusa,151,Neutro
350672,2020-11-02,hiperindignado,la primera dosis de la vacuna rusa tiene que ser para la cristina después alberto y los ministros del gobierno de científicos luego los infectólogos y periodistas chupamedias y por último los diputados senadores y demás funcionarios públicos rt si coincidís,151,Negativo
348805,2020-11-02,alecbascbas,hicieron negocios con los fideos y los barbijos porque no voy a pensar que quieran hacer un negocio con la vacuna rusa baby todo dicho bastababy,150,Negativo
351487,2020-11-02,aguedabaila,defensores del dióxido de cloro para la prevención del covid cuestionan la efectividad de la vacuna rusa,150,Positivo
336264,2020-11-05,marianoobarrio,me sumo a la solidaridad con ratifico que debe garantizarse la efectividad de la vacuna rusa y de todas así como que no tenga efectos adversos así como está hoy no me aplicaré una vacuna q tampoco se aplica el presidente por más q decreten la obligatoriedad,150,Negativo
351685,2020-11-02,horacio246,a uno de los que dice en facebook que no se va a aplicar la vacuna rusa porque no se sabe cómo está hecha lo vi tomando la jarra loca en vinicius dejate de joder,150,Negativo
348806,2020-11-02,agcesch,nelson castro dice que no confía en la vacuna rusa el mismo que el canal mandó a chernóbil a pelotudear,150,Negativo
346335,2020-11-03,sebakira1g,me ofrecí como voluntario para la vacuna rusa covid 19 y fui vacunado esta mañana fui hacer mis cosas normal y hasta ahora no observo ninguna reaksionoski o efecto sekundarioski pueden estar trankiloski toduski иi meиш че сеитгюд ерпестe аьио овут лопес обрадор и я коррумпиров,150,Negativo
343816,2020-11-03,gabrielsoglio1,clarín miente informando que la vacuna rusa no es efectiva prefieren que sus lectores mueran por coronavirus antes que avalar alguna decisión del gobierno,149,Negativo
80253,2020-11-06,tampocolapavada,ensayo vacuna china primera dosis adentro,149,Positivo
331902,2020-11-07,radiomitre,graciela ocaña denunció que el laboratorio que traerá la vacuna rusa tiene graves antecedentes,149,Neutro
337697,2020-11-04,gabrielapiovan2,por salir en rusia para rusia today en un documental acerca de no saben que opciones la importancia del agua en las invasiones inglesas la vacuna rusa,149,Negativo
340498,2020-11-03,juansemoreno_,todos quejándose de la vacuna rusa amigo con tal de que nos dejen ir al boliche hasta me pongo soda cáustica por intravenosa ya no me importa nada,149,Negativo
352406,2020-11-02,pdn_portal,alberto aseguró que argentina tendrá 25 millones de dosis de vacuna sputnik en diciembre llegará la primera partida y se completaría con una segunda tanda en enero el propio presidente dijo que se aplicaría la vacuna rusa,148,Negativo
351684,2020-11-02,yolaulaura,la vacuna rusa tiene un chip que te pasa de derecha a izquierda sin escalas,148,Negativo
358097,2020-11-01,ncariola,ya les van a poner a todos los docentes la vacuna rusa y los van a hacer dar clases presenciales después del 0 de aumento que los gremios tan defensores de los derechos laborales les consiguieron en el 2020,148,Negativo
80642,2020-11-03,inesita91445288,bolsonaro contradice a su ministro de salud por vacuna china el pueblo brasileño no será conejillo de indias de nadie este sr es un presidente de verdad no como el payaso que nos toco a nosotros con perdon de los payasos,148,Negativo
337488,2020-11-04,fedeaikawa,el primer error de la vacuna rusa nos enteramos por un medio ruso de que argentina estaba comprando 25 millones de dosis cómo vas a comunicar así ni hablar del viaje secreto de la viceministra,148,Negativo
343254,2020-11-03,mimichas1959,si hubiera sido macri el que queria comprar la vacuna rusa hubieran salido a criticarlo todo el kukaje y los periosobres lanatasinfiltro,148,Negativo
335022,2020-11-05,todonoticias,alberto fernández llamará a vladimir putin mañana por la compra de la vacuna rusa,147,Neutro
333328,2020-11-06,laguerrillafood,todavía están en la etapa 3 de la vacuna rusa y ya anuncian que en diciembre van a tener 10 millones disponibles te inician la sucesión camino al cementerio acá,147,Negativo
348296,2020-11-03,sergiounac,felicito al presidente y a todo el equipo del por gestionar la adquisición de 25 millones de dosis de la vacuna rusa sputnikv que le permitirá a millones de argentinos vacunarse en los próximos meses no dejemos de cuidarnos y saldremos juntos adelante,147,Negativo
352197,2020-11-02,cesanz1,exclusivo drogas sintéticas y tráfico de precursores los secretos del laboratorio que distribuirá la vacuna rusa en la argentina,147,Positivo
342012,2020-11-03,drckambourian,es demasiado pronto para hablar de protección inmune a largo plazo después de la nueva vacuna debido a que el tiempo maximo de observación fue de 3 semanas luego de la aplicacion nicolai kryuchkov ceo de la empresa de la vacuna rusa,146,Negativo
332602,2020-11-06,labandapindonga,el caos está llegando en diciembre deberemos elegir entre la vacuna rusa o el champagne manaos que repartirá alberto,146,Positivo
350105,2020-11-02,jujuysincontext,ojalá la vacuna rusa sea segura la vacuna rusa,146,Positivo
347764,2020-11-03,martincarrizo_,al final la vacuna rusa llegó primero que los tests rápidos del conicet,146,Negativo
356264,2020-11-02,_patitom,fantino acaba de anunciar con berni presente que en diciembre llegan 25 000 000 de dosis de vacuna rusa supuestamente si anmat la aprueba sera obligatoria te la aplicarías,146,Negativo
348914,2020-11-02,juan_amorin,ahora en conflictodeintereses la fase 1 y 2 de la vacuna rusa fueron efectivas es una vacuna que produce inmunidad sumate con el ht conflictodeintereses,145,Neutro
351942,2020-11-02,votasteasado,efectos adversos de la vacuna rusa tararear canciones de natalia oreiro,145,Positivo
353082,2020-11-02,nesuriver,los pibardos después de ponerse la vacuna rusa,144,Neutro
338668,2020-11-04,maurusaurus,la vacuna rusa no fue probada en mujeres cuantas organizaciones mundiales se alzaron en armas por semejante inequidad de genero cuantas embajadas rusas fueron incineradas cuantas,144,Negativo
346494,2020-11-03,jogun_712,buen martes a todos mates y a24 veo a laje entrevistando a una periodista en rusia tema vacuna rusa todo iba bien hasta que laje le pregunta vos te pondrías la vacuna respuesta de la periodista eeeaaasßddhjkfkfuuuueeeennnteeeaaaaooooosssss sin palabras,144,Negativo
333763,2020-11-06,jotaalonso,los mismos medios y periodistas que discuten la vacuna rusa ahora defienden la apertura del dúo cómico de larreta amp santilli en la ciudad que loteó el río y vendió las joyas de la abuela para que fuesen adquiridas por los propios rematadores pero está todo lindo en narnia,143,Negativo
337119,2020-11-04,pulsionparcial,joven obrero de la uocra esperando la vacuna rusa tenemos ministerio,143,Negativo
341823,2020-11-03,pagina12,el argentino voluntario de la vacuna rusa en moscú la necesitamos para salir lo más rápido posible de esto,143,Neutro
351624,2020-11-02,lacosmorevista,coronavirus el gobierno confirmó que comprará 12 500 000 dosis de la vacuna rusa pla cebo,142,Positivo
337824,2020-11-04,gatosylvestre,hoy 20hs m1 en todo lo que hay que saber sobre la vacuna rusa y no te cuentan habla la asesora presidencial y la especialista en vacunas dra daniela hozbor y opina con trestristesjueces,142,Negativo
348494,2020-11-02,lordmurielo,antes de la vacuna rusa después de la vacuna rusa,142,Negativo
331785,2020-11-07,yoloba2,yo que cristina preparo cadena nacional para el domingo en vivo hablando de los logros de los 12 años de kirchnerismo comiendo chori con ensalada rusa mientras le pega stickers con su cara en los frasquitos de la vacuna rusa que van a repartir en todo el país y que,141,Negativo
337438,2020-11-04,gabylevinas,los resultados de la fase tres de la vacuna rusa estarán para ser evaluados recién el 1 de mayo de 2021,141,Negativo
356807,2020-11-02,peroniarepublic,un negocio un genocidio no acepten aplicársela el gobierno confirmó que la argentina adquirirá 25 millones de dosis de la vacuna rusa contra el coronavirus infobae,141,Negativo
345932,2020-11-03,juan_amorin,roberto salvarezza ministro ciencia en cronicaanunciada obvio que me pondría la vacuna rusa todas las vacunas que están en fase 3 han demostrado que se realizaron en plataformas seguras,141,Negativo
