,date,username,tweet,replies_count,retweets_count,likes_count,link
134693,2021-03-09,gamaride,"""La directora de la junta directiva de la Agencia Europea de Medicamentos pidió a los miembros abstenerse, de forma momentania, aprobar la vacuna rusa hasta que sea revisada con los estándares europeos de calidad, seguridad y eficacia"" , México ya la aprobó en fast track..",10,34,58,https://twitter.com/gamaride/status/1369439990044852227
137948,2021-03-06,ngela79920809,@Elias_Cabeza Busca ayuda el odio enferma  Meses desacreditando la vacuna Rusa y ahora que el presidente de la pone para darle seguridad al pueblo salen con esta por eso es que jamás volverán!💪🇻🇪💪🇻🇪💪🇻🇪💪🇻🇪💪🇻🇪💪🇻🇪💪🇻🇪,3,30,58,https://twitter.com/ngela79920809/status/1368338440937496576
134159,2021-03-10,bitter_law,No les parece raro que le gobierno no hiciera show con la emisión de cheque/pago  o firma de contrato para el suministro de la vacuna Rusa?  https://t.co/AfOVCDifRE,6,8,58,https://twitter.com/Bitter_law/status/1369707623688339458
30847,2021-03-06,elpaisuy,"La vacuna china evita contraer la enfermedad en un 50%, pero su principal ventaja es que la mayoría de los que se vacunan con ella no se enfermarán gravemente ni serán internados en el CTI.   https://t.co/Tx5Hb8vFmN",14,15,57,https://twitter.com/elpaisuy/status/1368169164054159366
134160,2021-03-10,jonheguier,[EN INSTANTES] A Sarlo el gobierno de la Provincia le ofreció una vacuna para una campaña para concientizar a la población porque los medios decimos que la vacuna rusa es veneno,4,12,57,https://twitter.com/JonHeguier/status/1369707323841777665
140959,2021-03-04,mianrey,"💉 La Agencia Europea del Medicamento ha iniciado hoy la revisión de la vacuna rusa Sputnik V  ✔️ Hace dos meses y medio no teníamos ninguna vacuna disponible, ojalá que esto sea el principio del fin de esta pesadilla, un día más es un día menos 💪🏻",3,4,57,https://twitter.com/mianrey/status/1367551019341803529
22646,2021-03-11,ffelipa63,Yo q el doc Fernández de una vez me sublevo y pruebo mi spray vacuna en 3era fase aquí... Verá q hay un 🥚 de gente q al toque se anotaria... Total si nos han dado chicha de jora como vacuna china... 🙄,2,30,57,https://twitter.com/ffelipa63/status/1369887126024818688
33147,2021-03-04,20m,"Covid: Todo sobre la vacuna china Sinopharm que han recibido las infantas: eficacia, efectos secundarios y países que la usan  https://t.co/Cd6R2ONEVb",3,44,57,https://twitter.com/20m/status/1367372396152434688
138720,2021-03-06,mppeducacion,"#EnFotos | Pdte. @NicolasMaduro junto a la Primera Combatiente, @ConCiliaFlores recibieron este sábado la primera dosis de la vacuna rusa #SputnikV contra la #COVID19. @psuvaristobulo #EscudoBolivariano2021  https://t.co/lJIqF6IHKS",2,76,57,https://twitter.com/MPPEDUCACION/status/1368261549295538177
32152,2021-03-05,lubrio,Señala que el lunes comenzará la vacunación también con la vacuna china.,2,46,57,https://twitter.com/lubrio/status/1367991117241872388
135985,2021-03-08,enteratecali,"El presidente Nicolas Maduro recibió la primera dosis de la vacuna rusa Sputnik V este sábado y terminó 'hablando hasta rusosky': ""No siento ningún tipo de ‘skalosky’, ni ‘fiebrosky"". 😂💉🤭  https://t.co/k58WEdMmao",15,11,57,https://twitter.com/EnterateCali/status/1368969151197442048
138970,2021-03-06,nuriapiera,Maduro recibe la primera dosis de la vacuna rusa Sputnik V contra el coronavirus  https://t.co/fGPiNTO3qQ #NDigital  https://t.co/zNOcHI9zaI,15,6,57,https://twitter.com/nuriapiera/status/1368244745630146562
27148,2021-03-07,hromanowy,"@giulianacaccia @VBermudezV @willaxtv Lo mismo decían de Vizcarra, que sea el Primero en probar la Vacuna China y ahora te haces la indignada, después que le dieron la Vacuna Experimental, ya tus afirmaciones no valen nada.",1,12,57,https://twitter.com/HRomanoWy/status/1368649675419639813
25766,2021-03-08,agildemeisterrh,"@felipeestevesvg ¿Un informe científico es ""tendencioso"" sólo porque demuestra lo POCO EFICIENTE que es la vacuna china, además de dejar pésimo al gobierno por ""preferir"" una vacuna poco eficiente en lugar de COMPRAR LAS MEJORES (Pfizer, Moderna, etc) desde un principio??? ¡Por favor! Andaaaa!...",2,14,57,https://twitter.com/agildemeisterrh/status/1368962601468715009
34933,2021-03-02,miahfmn,Ojalá la vacuna china salga igual de efectiva que el Covid-19.,0,8,57,https://twitter.com/miahfmn/status/1366773205516566530
24755,2021-03-09,latinus_us,"Vacuna china de Sinovac, efectiva contra variante brasileña de la #COVID19, según estudio. #Coronavirus #Latinus #InformaciónParaTi  https://t.co/sWtPz4ff6x",0,9,57,https://twitter.com/latinus_us/status/1369269246946074624
30523,2021-03-06,jmnh74,La “vacuna” china es agua de bolas de Xi Jinping,9,18,57,https://twitter.com/JMNH74/status/1368203821298708482
133473,2021-03-11,generalpazgobie,"En la mañana de hoy, recibimos 600 dosis del segundo componente de la vacuna rusa Sputnik V, que ya se encuentran en la posta de vacunación ubicada en el Gimnasio Mayor del Centro de Educación Física  https://t.co/z8A7cl6e7C",5,10,56,https://twitter.com/GeneralPazGobie/status/1370053087772213254
21582,2021-03-12,latinus_us,Japón rechaza la oferta de aplicar la vacuna China a sus atletas olímpicos. #COVID19 #Coronavirus #Latinus #InformaciónParaTi  https://t.co/iwI08fLTDR,4,19,56,https://twitter.com/latinus_us/status/1370386869591097344
30352,2021-03-06,hipocresiaroja,"Se sacan la careta, piden cárcel para los periodistas de @willaxtv q sacaron el informe de la Cayetano sobre la vacuna China 🇨🇳, informe que ocultó el gobierno y es REAL. El fascismo progre avanza! Graña Miroquesada dueño de los medios impune, pero piden cárcel contra Beto 🤦🏻‍♂️👇",1,17,56,https://twitter.com/Hipocresiaroja/status/1368219026321727488
21053,2021-03-13,cosmodanzante,"Dice mi papá que no sintió nada con la vacuna china, que si no le habrán puesto agua destilada y que si se puede volver a poner la rusa cuando haya, porque él quería el chip para ser comunista. 🧐",5,0,56,https://twitter.com/cosmodanzante/status/1370617804303568897
31628,2021-03-06,veronic01328918,"Al saber cuánto de efectividad tiene la vacuna china comunista, me pregunto cuánto nos costó este genocidio económicamente al Perú.?",3,21,56,https://twitter.com/Veronic01328918/status/1368035458769428481
25910,2021-03-08,alejoferre,"Hace un rato que mi ex recibió la primer dosis de la vacuna china, realmente me alegra mucho, mucho. Personal de Salud Mental en Romero laburando con quienes nadie recuerda para que se integren a la sociedad. Me alegra por ella y por la gente que acompaña. Gracias @Kicillofok",0,10,56,https://twitter.com/AlejoFerre/status/1368930128567410702
35392,2021-03-02,presidencialven,#ULTIMAHORA 📰 | Llega a Venezuela cargamento con 500 mil dosis de la vacuna china Sinopharm. Más detalles ➡️  https://t.co/I7mk6WjAVV  https://t.co/heDQlZYJO2,1,81,56,https://twitter.com/PresidencialVen/status/1366607152673087490
25115,2021-03-08,marioarcez,"Y si el plan de bajarse la vacuna china es para que la gente desconfíe y más adelante cuando el privado pueda venderlas, la gente se las compre... marcas tipo Pfizer o AstraZenaca? 🤯🧐",9,5,56,https://twitter.com/MarioArceZ/status/1369108897844375560
143382,2021-03-02,radio_formula,Vacuna rusa que podría generar inmunidad a la COVID hasta por 13 años está por iniciar ensayos  https://t.co/pVyeUEJ4tG  https://t.co/yGEiFvmETB,0,11,56,https://twitter.com/Radio_Formula/status/1366584080817664002
144160,2021-03-01,europapress,#LoMásLeído | República Checa anuncia que utilizará la vacuna rusa Sputnik V incluso sin la aprobación de la UE  https://t.co/vWQLH15zLV,1,31,55,https://twitter.com/europapress/status/1366240536978460673
27120,2021-03-07,acesalaverry,"La doctora Coralith  García informa que las vacunas de Sinopharm no tienen  aprobación de  revista científica informe de fase III no hay, lo cual miente Violeta Bermudez y la verdad esta con Beto Ortiz en los informes preliminares de vacuna china.",15,21,55,https://twitter.com/AceSalaverry/status/1368653177453690882
25595,2021-03-08,giancarlorondon,Que el gobierno morado aplique a los ancianos la vacuna de Pfizer y no la vacuna china es una aceptación implícita por parte de los morados de que la vacuna china es mala.,1,16,55,https://twitter.com/GiancarloRondon/status/1368999048150200321
139897,2021-03-05,jackymc10,El  rechazo  de  #Sagasti  a la  vacuna  rusa #Sputnik !!!  Cuánto  pesa  el  Acuerdo Chino  con  #Sinopharm!!  https://t.co/6dE9LVcq4h,7,33,55,https://twitter.com/JackyMc10/status/1368021863885139971
134698,2021-03-09,todonoticias,Italia es el primer país europeo que producirá la vacuna rusa Sputnik V contra el coronavirus  https://t.co/T4KpnWPmKm,11,21,55,https://twitter.com/todonoticias/status/1369438394565206023
139579,2021-03-06,racroh,"@carlosperuh @pmilonma @EdMalagaTrillo Te cuento que el Dr Málaga (el bueno) va con el número 4 del partido MORADO,  deja de creer en el cuento de la vacuna rusa y que el gobierno no quiere que compres. Ten PACIENCIA primero se vacunan los más vulnerable.  https://t.co/ZgqGoCAvzH",3,15,55,https://twitter.com/racroh/status/1368081972405411843
22780,2021-03-10,apschi,@manotabrunet @MendocinaDel81 Es que tienen la vacuna china que no se puede dar a mayores de 60 ni a personas de alto riesgo. El personal de salud no la quiere. Por eso la dan a docentes. Es el gobierno nacional que no compra vacunas buenas y las pocas que compra se las roban para los amigos.,7,0,55,https://twitter.com/apschi/status/1369816278874140676
140982,2021-03-04,mianrey,"Se agradece difusión a los tweets de este hilo, ya que pueden ser de interés para más gente y me lleva su tiempo elaborarlos... 😅  El jueves que viene se aprueba la vacuna de Janssen y se ha iniciado la revisión de la vacuna rusa Sputnik V  ¡Muchas gracias por todo el apoyo! 💪🏻",1,11,55,https://twitter.com/mianrey/status/1367545224071897091
137862,2021-03-06,nelsonpvzla,"#6Mar • En aproximadamente 15 días, se han aplicado cerca de 100 mil dosis de la vacuna rusa en Venezuela, si se sigue ese ritmo, se necesitarían aproximadamente 20 años para vacunar el total de la población • La revolución avanza a paso de vencedores 🤣  💢UNIDAD💢 Da Rt y ♥",4,62,54,https://twitter.com/NelsonpVzla/status/1368352258421833729
132241,2021-03-14,elcomercio_peru,La vacuna rusa Sputnik V mostró igual eficacia en todas las edades y esperan que la inmunidad dure dos años  https://t.co/u3vhzvgm2X,7,22,54,https://twitter.com/elcomercio_peru/status/1371188626336399360
143840,2021-03-01,ma_toscano,"Que alegría poder compartirles que mi mamá logró vacunarse hoy en la #CDMX.   Le tocó la vacuna rusa de @sputnikvaccine, ahora esperemos que en 3 semanas pueda aplicarse la misma vacuna.   Ahí les voy platicando.",5,3,54,https://twitter.com/ma_toscano/status/1366436923342868485
139925,2021-03-05,agenciaelvigia,"Así despidió a su mamá el dirigente del partido de @JMilei, hijo de la médica muerta por Covid-19, quien había rechazado la vacuna rusa y estaba esperando turno de vacunación en CABA: ""Que tu amor y vocación sirva de ejemplo para todos"".  https://t.co/2MIQe9bFUB",7,46,54,https://twitter.com/AgenciaElVigia/status/1368007006083289089
32973,2021-03-04,pedroacruzsnch1,EEUU.ha producido varías vacunas.  Gran Bretaña tiene su vacuna.  Rusia tiene su vacuna.  China tiene sus vacunas.  La UE no tiene su vacuna.,8,3,54,https://twitter.com/PedroACruzSnch1/status/1367468322577596418
32920,2021-03-04,sudacaperu,[INFORME] Clamorosas omisiones previas a la llegada de la vacuna china fueron relatadas por una exfuncionaria de Digemid a la comisión Carbone. Su testimonio está en los anexos no publicados.  Los atajos de la vacuna de Sinopharm en el Perú 👇[@paolobenza]  https://t.co/zQ5FENrpcE,3,51,54,https://twitter.com/SudacaPeru/status/1367492487120617476
142635,2021-03-02,mmendoza1970,"Parece q régimen tiene dudas sobre afectividad de la vacuna rusa contra la COVID q están aplicando. Sabemos q esto también hacen en otros países, pero la gente está informada de qué se trata. Aquí hay secretismo, no hay campaña q explique cómo debe cuidar la gente tras vacunarse.  https://t.co/uUbf2rscDp",7,18,54,https://twitter.com/Mmendoza1970/status/1366912350582935552
25324,2021-03-08,desdeurbania,"@VeroLinaresC Segùn OMS, mortalidad Covid19 es 0,23%. SIN vacuna, hay sobrevivencia de 99,77%. Lo más importante es reducir problemas pulmonares, hospitalización y UCI. Vacuna china es la peor y la más cara",1,9,53,https://twitter.com/desdeurbania/status/1369058045590929408
25784,2021-03-08,jackymc10,"Cuántos muertos MÁS, quiere  el gobierno #morado insistiendo con  su  vacuna  #China  con baja  efectividad!!  Por qué, NO #informan la  cantidad  de médicos  y  enfermeras #vacunados que están contagiados  de  #Covid_19 ??   NO  MÁS  VACUNAS  #Sinopharm!!",0,34,53,https://twitter.com/JackyMc10/status/1368957207488983041
143732,2021-03-01,coronavirusnewv,🇸🇰 | ESLOVAQUIA  Eslovaquia se convierte en el 39º país del mundo y en el 2º de la Unión Europea que aprueba el uso de la vacuna rusa Sputnik V.,0,18,53,https://twitter.com/CoronavirusNewv/status/1366468811755560973
24657,2021-03-09,cocoamado,"@KikeBravoPrado @FioreMolinelli Ud. y el Gobierno afirmaron q' a partir del Lunes 08 de Marzo se iba a vacunar al adulto mayor con Pfizer, sin embargo, el señor que es vacunado en presencia de su hija, afirman que no es así, es con la vacuna china y la enfermera lo corrobora. Otra vez MIENTEN.",2,15,53,https://twitter.com/CocoAmado/status/1369286664003198977
142069,2021-03-03,pboperu,#ColumnaPBO #LaRazón ✍️📖  🔴 SAGASTI ¿BOICOTEA A LA VACUNA RUSA #SPUTNIK – #GAMALEYA?  Lee sus columnas aquí ✍️ ►  https://t.co/3qsoxftPT9 📻 #PBO 91.9 FM #hashtag #URGENTE #LOÚLTIMO Olivares Ciccia #SagastiCompliceDeVizcarra Juliana Germán Málaga  De Belaunde Renovación Popular  https://t.co/5PSN5ohxYm,2,25,53,https://twitter.com/PBOPeru/status/1367183485341999106
138478,2021-03-06,telesurtv,Un avión con el segundo lote de 100.000 dosis de la vacuna rusa #SputnikV contra el coronavirus destinado a #Venezuela aterrizó este sábado al Aeropuerto Internacional Simón Bolívar en Maiquetía  https://t.co/PHCB6dKUIb,0,37,53,https://twitter.com/teleSURtv/status/1368279065698971649
132512,2021-03-13,lopezdoriga,"El Gobierno de la Ciudad de México ya prepara la aplicación de la segunda dosis de la vacuna rusa de Sputnik V en las alcaldías de Tláhuac, Iztacalco y Xochimilco  https://t.co/IEDnd1k4eT",3,6,53,https://twitter.com/lopezdoriga/status/1370868523770216451
135475,2021-03-09,perfilcom,#Pandemia | La vacuna rusa Sputnik V será producida en Italia a partir de julio  Se realizará en las fábricas de la farmacéutica italo-suiza Adienne en Lombardía. La Unión Europea aún no ha autorizado su desarrollo  https://t.co/x2bFHY9hkD,7,35,53,https://twitter.com/perfilcom/status/1369235615972270090
135446,2021-03-09,europapress,Italia se convierte en el primer país europeo que producirá la vacuna rusa 'Sputnik V'   https://t.co/otKsRc5rq9,4,20,53,https://twitter.com/europapress/status/1369245580044742660
139901,2021-03-05,lascosa03999060,"¡¡¡¡ Escándalo de Último minuto ¡!!!!!  En #BetoASaber Las Vacunas compradas en China no sirven ,la primera Vacuna solo tiene 33% de efectividad y la segunda vacuna solo el 11% de efectividad ,incapacidad? Desidia? Que pasa? Porque #SagastiAsesino se niega a comprar vacuna Rusa?",6,20,53,https://twitter.com/LasCosa03999060/status/1368020234691608576
140933,2021-03-04,gestionpe,"G&amp;P Pharmax señaló que tiene la confirmación del stock de la vacuna rusa Sputnik V contra el COVID-19, en tanto para iniciar su importación al país solo esperan la obtención del registro de permiso biológico que debe ser entregado por la Digemid ►  https://t.co/wD3s1DCOHw  https://t.co/cBBhoUAhgf",15,21,53,https://twitter.com/Gestionpe/status/1367561664703434756
33037,2021-03-04,_carlitarocha,"Pgta para el Sr @ColumbusOpina , vocero Bancada Fuerza Popular:  No es razón suficiente para vacar al Gabinete de la Sra @VBermudezV , que no entreguen la lista completa de vacunados vip, mintiéndole a la población y que se siga comprando la vacuna china (la más cara y - eficaz)?",4,20,53,https://twitter.com/_CarlitaRocha/status/1367443333979717633
134090,2021-03-10,lajornadaonline,"El segundo cargamento de la #vacuna rusa contra el #COVID19 #SputnikV llegó esta tarde a México, con 200 mil porciones, producidas por el Centro Nacional de Investigación de Epidemiología y Microbiología Gamaleya.  #PlanetaCoronavirus   https://t.co/QA4wrPfSCp",1,30,52,https://twitter.com/lajornadaonline/status/1369723803786436608
132378,2021-03-14,actualidadrt,La vacuna rusa Sputnik V podría estar disponible en Suecia para junio  https://t.co/9vSjfC6yEO  https://t.co/kr67Hov2Jw,3,23,52,https://twitter.com/ActualidadRT/status/1371080575994494979
32981,2021-03-04,panamasuiza,Después de ver ésto yo no pienso ponerme la vacuna China..  https://t.co/M6l5EdgnUk,19,8,52,https://twitter.com/PanamaSuiza/status/1367466630838689806
27336,2021-03-07,_carlitarocha,"“Esto no es chiste, esta es una vacuna contra la muerte”. Infectólogo Juan Villena pide al gobierno suspenda vacunación con vacuna China  #NoALasVacunasChinas 🇨🇳  https://t.co/pH4PiULgWe",5,27,52,https://twitter.com/_CarlitaRocha/status/1368631413046714369
25748,2021-03-08,arturolasi,@ocram Haber @ocram un análisis de porqué los médicos que son los que más saben en temas de salud rechazaban la vacuna china incluso antes de lo publicado en willax. Marcó Sifuentes esta alineado al gobierno totalmente parcializado como la mayoría de mermeleros de la tv  https://t.co/nPZVW88Twi,11,9,52,https://twitter.com/arturolasi/status/1368967133280018434
132983,2021-03-12,ptcrecargado,Mirtha Legrand recibió la vacuna rusa  https://t.co/ubJfaUL8nk,2,9,52,https://twitter.com/PtcRecargado/status/1370426507332575234
25807,2021-03-08,dasilvastalin,"Esta semana de #CuarentenaRadicalReforzada comienza inmunización con la vacuna china Sinopharm💉, y se han establecido prioridades. Continúa la vacunación del personal de salud para dar paso a los maestros y maestras #TimónRojo @dasilvastalin @liliamm_27 @manzarmada @beatriz77748  https://t.co/4nb0RnM7m7",3,197,52,https://twitter.com/dasilvastalin/status/1368952165138653186
28591,2021-03-06,ugluis,"Se @FSagasti usted le debe una explicación urgente al Perú. Si la vacuna china no sirve no permita el crimen de su aplicación, corre el grave riesgo ser acusado de perpetrar genocidio. Reaccione ya!",4,27,51,https://twitter.com/ugluis/status/1368392893950529538
26094,2021-03-08,pablodiez_abc,"En mi barrio de #Pekín, he ido a preguntar si le ponen la vacuna del #coronavirus a los extranjeros. Pero, después de ver cómo salía uno de los vacunados, mejor vuelvo otro día... Bromas aparte, yo me pondría la vacuna #china si nos la dieran a los extranjeros.  https://t.co/JuTHVJeApG",11,9,51,https://twitter.com/PabloDiez_ABC/status/1368874571911335938
140106,2021-03-05,donairelinda,@PartidoLibre fue el primero en iniciar acercamientos con Rusia para la obtención de la vacuna rusa #SputnikV en hora buena para toda nuestra población. Hechos son hechos.,15,9,51,https://twitter.com/DonaireLinda/status/1367939141766414342
143389,2021-03-01,saga_115,@EsDeMamador Plot twist: Migo es el wey que le puso la vacuna rusa al isaac,0,0,51,https://twitter.com/SaGA_115/status/1366581700168478723
134705,2021-03-09,diegowainstein,"La verdad es que, Larreta y Quirós propiciaron el contagio, demonizaron la vacuna rusa, y son partidarios del “Que muera el que tenga que morir” No estaban preparados para tener vacunas que sirvan, y viejos que se quieran vacunar. Realmente no es su culpa.",4,8,51,https://twitter.com/diegowainstein/status/1369437292427939841
23465,2021-03-10,kevinbardales13,@diariocorreo @SoyJudyRo94 Conclusion: Vacuna china sinopharm es inservible!. El gobierno morado volvio a mentir a costa de miles de muertes. El tiempo le dio la razon nuevamente a Beto Ortiz,8,9,51,https://twitter.com/KevinBardales13/status/1369574985845665796
139349,2021-03-06,bbcmundo,"En el pueblo de Sputnik desconfían de la vacuna. No están solos: sólo un 30% de los rusos están dispuestos a ponerse la vacuna rusa, según una encuesta.   https://t.co/Cm47oG6Jo9",7,21,51,https://twitter.com/bbcmundo/status/1368199948890685445
133565,2021-03-11,yuriikazakov,"(1) Por cierto, el gobierno húngaro ha hecho público el precio de la vacuna rusa y la china (de las occidentales no puede hacerlo por la cláusula de secreto en el acuerdo).",2,47,51,https://twitter.com/YuriiKazakov/status/1370012753096802306
135899,2021-03-08,sucesosperu,"#LOULTIMO La Dirección General de Medicamentos, Insumos y Drogas #digemid otorgó hoy el registro biológico de la vacuna rusa #Sputnik V a la empresa G&amp;P Pharmax, así lo reveló su asesor legal Carlos Iturrizaga en entrevista con @sucesosperu  Ampliaremos en breve... #COVIDー19  https://t.co/9L5uT2fWbr",23,30,51,https://twitter.com/sucesosperu/status/1368996599972691969
34626,2021-03-02,patricialopezl,"@diasasaigonados El Borbón dijo que se sentía como un oso, pero no era por la Sputnik V, era por la vacuna China que es la que dijo que se puso...",2,11,50,https://twitter.com/patricialopezl/status/1366837985073913860
138280,2021-03-06,ronald1969ht,Un avión con el segundo lote de 100.000 dosis de la vacuna rusa Sputnik V contra el coronavirus destinado a Venezuela ha aterrizado este sábado en el país latinoamericano. https://t.co/JxKqwG9J7u  @addiel_pe @alicia_senra @Jax_282 @jpcalsur @MarbeniaS @LynTorresFe @Vilma_Meche,0,40,50,https://twitter.com/Ronald1969HT/status/1368298265687515137
142166,2021-03-03,perrottap13,"@tatianatayl Yo no pensaba vacunarme, pero a mi hermana que es médica del Hospital de Clínicas la vacunaron con la vacuna rusa y no tuvo inconvenientes. Me dijo que se viene un pico y que hoy es preferible darse cualquier vacuna. Que ya están probadas y avaladas.",19,5,50,https://twitter.com/perrottap13/status/1367138676963237895
34811,2021-03-02,petraysabelina,Venezuela ha aprobado el uso de la vacuna china Sinopharm para inmunizar al pueblo venezolano frente al COVID-19. Gracias a la cooperación China-Venezuela se atiende la salud y vida del pueblo. @ViceVenezuela   #VacunaEsperanzaYVida @NicolasMaduro  https://t.co/0hMaySMB32,0,284,50,https://twitter.com/PetraYsabelina/status/1366799348437299209
24347,2021-03-09,xatakamexico,"México alcanza las cinco millones de vacunas recibidas contra COVID: mientras, una nueva vacuna china se avecina al país  https://t.co/UWuNenTiRs  https://t.co/NyR0JMoNDN",0,8,50,https://twitter.com/XatakaMexico/status/1369341121726406665
140162,2021-03-05,latinus_us,"Personas que ya tuvieron #COVID19 podrían necesitar sólo una dosis de la vacuna rusa Sputnik V, revela estudio. #Coronavirus #Latinus #InformaciónParaTi  https://t.co/IOOiCf2mG4",1,10,50,https://twitter.com/latinus_us/status/1367922427011993608
139679,2021-03-06,danielolortiga,"@PodemosPepeLuna @VBermudezV Taaaantos asesores por las piiiii 1ro se investiga con base científica y no se toma como fuente a alguien que es representante de la Ivermectina... 2do. Porque, existen muchos intereses en la vacuna rusa por la comisión $$$ que hay de por medio  3ro ya pues, póngase serio c 1 vez",0,0,50,https://twitter.com/DanielOlortiga/status/1368050975861338114
27865,2021-03-07,jotapez,"El Pais de España dice q Piñera se puso la vacuna china, -como ejemplo de países subdesarrollados que usan esa vacuna ""con tecnología en desuso y no occidental"", pero omite que las infantas Elena y Cristina tuvieron q viajar a Emiratos Arabes a vacunarse con la china. @el_pais",3,22,50,https://twitter.com/jotapez/status/1368577504492085255
29468,2021-03-06,petraysabelina,"El lunes comienza la vacunación con la vacuna china,  dijo el Min.  @AlvaradoC_Salud se   seguira en la vacunación del personal sanitario, luego con los maestros y maestras en el país  #EscudoBolivariano2021  https://t.co/tRSMbE88eK",0,230,50,https://twitter.com/PetraYsabelina/status/1368293794739814412
33215,2021-03-03,willaxtv,"#BetoASaber | @NAmprimo: ""En vez de haberse casado con la vacuna china, el Estado peruano debió emitir una norma señalando que todas las vacunas que se apliquen en países de alta vigilancia están automáticamente aprobadas en el Perú"".  En vivo:   https://t.co/4AJELMLOQ2  https://t.co/xXuwEdbZjT",0,13,50,https://twitter.com/willaxtv/status/1367303631071047681
134686,2021-03-09,cesarmuguerza,"@cparedesr Jajajajaja el doble rasero le dicen, cuando facturabas estabas calladito te chotearon y oh depechado escribes un libro y sigues jorobando pero mientras cobrabas todo bien 😂 😂 😂 ah creo q es vacuna rusa",1,8,50,https://twitter.com/cesarmuguerza/status/1369444523772895235
134353,2021-03-10,nefeerr,"Muchos cientifícos, revistas cientificas de prestigio y hasta cientifícos suecos reconocen la eficacia dl vacuna rusa SputnikV. Pero l UE prefiere sentenciar a muerte a docenas de miles de europeos a la muerte y prolongar la depresión economíca porque no le mola el gobierno ruso",1,40,49,https://twitter.com/nefeerr/status/1369649275798499328
134113,2021-03-10,nefeerr,"48 países de aprueban la vacuna rusa Sputnik V, mientras la UE prefiere sentenciar a muerte a docenas de miles de personas y prolongar en el tiempo la depresión economíca, porque no les mola el gobierno ruso.",2,31,49,https://twitter.com/nefeerr/status/1369719105612357634
