,date,username,tweet,likes_count,sentiment_analysis
356554,2020-11-02,nociruno,chicos yo tome septimo regimiento en boliches del conurbano mira sino me voy a poner una vacuna rusa,8093,Negativo
352455,2020-11-02,babyaetchecopar,la vacuna rusa debe ser testeada primero en los políticos si coincidís compartí,7874,Negativo
357085,2020-11-02,c5n,el presidente confirmó que su viceministra de salud viajó a moscú para concretar la adquisición de 25 000 000 de dosis de la vacuna rusa sputnik v contra el covid 19,7306,Negativo
331269,2020-11-08,pablalunar,la vacuna rusa no tiene arvejas papa zanahoria y mayonesa entre sus componentes todo bien pero eso de rusa no tiene nada yo no me la doy,6178,Negativo
335799,2020-11-05,gabylevinas,el dueño de hlb farma garcia furfaro estuvo preso armó el vatayón militante salió de la cárcel y puso laboratorios ramallo el cual fue clausurado por anmat y ahora compra laboratorios como hlb farma y le dan la vacuna rusa y garcia furfaro viajó con vizotti órdenes de cris,6087,Negativo
349762,2020-11-02,fedkukso,interesante cómo para algunos es la vacuna rusa cuando en realidad rusia tiene 2 vacunas o la vacuna china china tiene 4 vacunas experimentales en fase 3 pero no es la vacuna inglesa sino la vacuna de oxford la geopolítica también se ve en el discurso,5989,Negativo
81080,2020-11-02,fedkukso,interesante cómo para algunos es la vacuna rusa cuando en realidad rusia tiene 2 vacunas o la vacuna china china tiene 4 vacunas experimentales en fase 3 pero no es la vacuna inglesa sino la vacuna de oxford la geopolítica también se ve en el discurso,5989,Negativo
350218,2020-11-02,juanchosvm,a los que ingerimos alguna de estas 4 bebidas durante la adolescencia no hace falta que nos inyecten la vacuna rusa,5719,Negativo
351895,2020-11-02,lanamontalban,presidente d la nacion y vice se vacunan primero con verificación independiente q compruebe q es la vacuna rusa se espera tiempo prudencial 6 meses los pacientes siguen vivos podemos empezar a hablar sino con un gobierno q siempre miente no es confiable yonomevacuno,5586,Negativo
351932,2020-11-02,carloseguiauno,yo voto que cristina sea la primera en ponerse la vacuna rusa y recién después de 30 días nosotros si les parece bien dale rt cristinaprimero,5352,Negativo
344762,2020-11-03,winston_dunhill,vacuna de oxford usd 3 5 x 25 000 000 usd 87 500 000 vacuna rusa según gobierno argentino usd 19 90 x 25 000 000 usd 497 500 000 diferencia usd 410 000 000 no más preguntas señor juez,4944,Negativo
80706,2020-11-03,vivicanosaok,bolsonaro contradice a su ministro de salud por vacuna china el pueblo brasileño no será conejillo de indias de nadie,4569,Negativo
332057,2020-11-07,actualidadrt,ni se saltó la tercera fase ni se probó solo en 72 marinos rusos ni carece de informes científicos ni podríamos estar horas desmintiendo lo que dijeron medios argentinos sobre la vacuna rusa sputnik v pero logramos resumirlo en un video de 10 minutos con,4398,Negativo
356690,2020-11-02,cesanz1,mañana martes voy a contar quién está detrás de la distribución de la vacuna rusa en argentina lavado testaferros y sospechas de narcotráfico,4278,Neutro
356280,2020-11-02,sangrexeneize,ojalá la vacuna rusa sea segura la vacuna rusa,3978,Positivo
337527,2020-11-04,gabylevinas,la vacuna rusa fue primero probada en animales pero no hay registros de ello la segunda fase con cerca de 70 voluntarios militares mayoría masculinos se hizo sin doble ciego lo que viola las normas aceptadas científicamente la fase 3 somos nosotros,3813,Negativo
335947,2020-11-05,jotayoutube17,bueno gente volvi de ponerme la vacuna rusa y creo que no me paso nada ahora si me disculpan я собираюсь съесть шоколад,3594,Negativo
80343,2020-11-05,meruanista,prueben la vacuna china con la señora juanita total ya la vacunaron,3461,Negativo
337881,2020-11-04,lagalera9,ni idea que dicen de la vacuna rusa yo me la acabo de clavar y estoy re bi мы с тобой займемся сексом,3125,Negativo
332893,2020-11-06,gabylevinas,si el resultado de las experimentación de la fase tres de la vacuna rusa estará recién el 1 de mayo cómo puede alberto decir que finales de diciembre vacunará a 10 millones de argentinos,3073,Negativo
346744,2020-11-03,mwinazki,otra vez somos campeones del mundo ya le ganamos al coronavirus con la vacuna rusa nos salvamos todos solo falta saber si cura realmente pero nosotros ya nos libramos de todo mal y ya damos la vuelta olímpica viva el zar lenin trotsky putin y cristina,2997,Negativo
356797,2020-11-02,juan_amorin,confirma en nota con sputnik que argentina adquirirá 25 millones de dosis de la vacuna rusa estarían en condiciones de darnos 10 millones de cada una de las dos dosis en diciembre y otras 15 millones en enero,2933,Negativo
353984,2020-11-02,nanothompson,los terraplanistas de twitter no me pongo la vacuna rusa yo,2833,Negativo
352357,2020-11-02,osvaldobazan,me da que lo de la vacuna rusa es otro el agua no moja veremos,2713,Negativo
101581,2020-11-02,osvaldobazan,me da que lo de la vacuna rusa es otro el agua no moja veremos,2713,Negativo
331719,2020-11-07,fisicoimpuro,me compadezco de los uribistas si se aplican la vacuna rusa contra el covid se volverán comunistas y si se aplican la vacuna gringa que volverán castrochavistas qué dilema,2709,Negativo
345909,2020-11-03,mr_bugman,pronóstico en tres años vamos a encontrar millones de dosis de la vacuna rusa vencida escondidas en un galpón,2657,Negativo
331677,2020-11-07,ferdejuana,los chicos ya probaron la vacuna rusa,2628,Neutro
352002,2020-11-02,maquialifraco,propongo que el presidente alberto fernández se aplique la vacuna rusa en cadena nacional respaldando su compra de 25 millones de dosis no aprobadas,2612,Negativo
355866,2020-11-02,vivaroca2015,quiero creer que nadie en su sano juicio se va a dar la vacuna rusa y no lo digo por el hecho de que sea rusa sino sencillamente porque no podemos aceptar que nos tomen como ratones de laboratorio,2608,Negativo
357286,2020-11-02,andahazi,la vacuna rusa no cumple los protocolos internacionales no completó la fase 3 de prueba en humanos y el laboratorio que la producirá en el país hlb pharma fue clausurado por fallas de seguridad en 2018 en 2017 entró en concurso preventivo somos cobayos del pc chino y rusia,2591,Negativo
358032,2020-11-01,matiildaxd,la vacuna rusa fue probada en 76 personas no es un poco poco a 76 personas también le debe quedar bien el chupín,2579,Negativo
337189,2020-11-04,cayudem,amigos me ofrecí como voluntario para la vacuna rusa covid 19 y fui vacunado esta mañana en el hospital fui a hacer mis cosas normal y hasta ahora no observo ninguna reaksionoski o efecto sekundarioski pueden estar trankiloski toduski иi meиш че сеитгюд ерпестe аьио овут лопес,2569,Negativo
339817,2020-11-04,lanacion,carolina losada cruzó a alberto fernández por la vacuna rusa somos hámsters,2545,Neutro
353705,2020-11-02,delfinadelfina_,confío más en el peso argentino que en la vacuna rusa,2502,Negativo
351246,2020-11-02,rulombotv,vacuna rusa llega a la argentina yao cabrera joda extrema inyectando a los enanos wifi con la vacuna rusa termina mal,2473,Negativo
354051,2020-11-02,peroniarepublic,mira si te aplican la vacuna rusa y quedamos todos como vicky donda,2464,Neutro
351146,2020-11-02,gkitanick,antes de la vacuna rusa despues de la vacuna rusa yonomevacuno,2398,Negativo
351900,2020-11-02,marianodelrey_,si la vacuna rusa funciona propongo que los 45 millones de argentinos cantemos juntos tu veneno de natalia oreiro,2393,Negativo
331399,2020-11-07,manuelquieto,te hacés curar el empacho por teléfono y desconfiás de la vacuna rusa,2371,Neutro
356608,2020-11-02,luispetri,el gobiernodecientificos quiere comprar una vacuna rusa cuyo único estudio se realizó en 72 personas por 42 días sin placebo y sin voluntarias mujeres esa vacuna es una ruleta rusa,2339,Negativo
337677,2020-11-04,inafinogenova,la verdad sobre la vacuna rusa dice una mezcla de información publicada en agosto medias verdades errores de datos graves y muchísimas ganas de que todo encaje en el relato que pretende vender eso sí la impresión que da es la de haberse leído todo y saber muchísimo,2270,Negativo
344698,2020-11-03,quimeyherrera01,bueno gente vine a ponerme la vacuna rusa ya me dieron 5000 pesos la otra parte me la dan cuando me afilie al pj muy rica la vianda del hospital,2246,Negativo
81006,2020-11-03,claudiapineiro,estoy esperando para darme la segunda dosis de la vacuna china delante mío hay cola ocho personas todos con turno me pone contenta que tanta gente apueste a que esta vacuna o cualquier otra funcione sobre todo ante tanta energía puesta en sembrar dudas,2162,Negativo
330670,2020-11-08,orwellgeorge,el jefe del laboratorio qie va a traer la vacuna rusa estuvo 12 años preso y creó el sindicato de presos se cambió el nombre tranqui,2144,Negativo
353518,2020-11-02,tunykollmann,la vacuna rusa inició el proceso de autorización en la anmat obvio que tendrá que presentar documentación sobre la fase iii que todavía no se terminó se supone que en 2 semanas,2117,Negativo
342523,2020-11-03,c5n,un argentino voluntario de la vacuna rusa aseguró que genera inmunidad y es segura,2023,Positivo
336727,2020-11-05,01_zupay,la vacuna rusa se produciría en los laboratorios hlb pharma dónde uno de los socios es ariel garcía furfano que tiene causas abiertas por contrabando de suero y estuvo dos años preso fundó el sindicato de presos y actualmente sería abogado de vatayón militante buen descanso,1963,Negativo
345111,2020-11-03,nachomdeo,beto guardó las muestras gratis de la vacuna rusa en el mismo cajón donde puso las remeras de la pedro cahn la calcomanía de vicentin ypf y el pañuelo verde,1947,Neutro
336361,2020-11-05,robdnavarro,israel compró la vacuna rusa,1938,Positivo
347893,2020-11-03,bendernautaokk,ponete la vacuna rusa no seas putin,1935,Neutro
351261,2020-11-02,gabitwo_,te dije que no pasaba nada con la vacuna rusa mono jaja veni vamos a tomar unas birras con los pibes,1806,Negativo
339614,2020-11-04,dianacrisis,será que a está en drogas b está poseído c es un viajero del tiempo d se puso la vacuna rusa e es ingeniero atómico físico nuclear en chernobyl,1767,Positivo
332982,2020-11-06,jotaalonso,si sos médico y decís que la entonces presidenta padecía de una enfermerdad como el cáncer nelson castro dijo eso y luego pasa el tiempo y afirmás que la vacuna rusa se probó en 74 personas cuando está en fase 3 con 40 mil personas en prueba científica deberías jubilarte,1735,Negativo
346273,2020-11-03,eldiariodeleuco,la vacuna rusa no es confiable y rompe las reglas del desarrollo de medicamentos no es porque sea rusa sino por motivos científicos bien fundamentados alertó la científica del conicet,1718,Negativo
350557,2020-11-02,misodios,la vacuna rusa la aplica lagomarsino a domicilio,1711,Positivo
340583,2020-11-03,danteforesi,así como odian al peronismo pero cobran el aguinaldo las vacaciones pagas y tienen sus servicios públicos con subsidio del estado se van a terminar arrastrando por la vacuna rusa sólo hay que darles tiempo,1703,Negativo
349567,2020-11-02,a24com,encuesta bastababy desde las 23 mirá a baby etchecopar en la pregunta de hoy usted se aplicaría la vacuna rusa,1694,Negativo
343639,2020-11-03,bendernautaokk,la vacuna rusa es para curar el covid o la homosexualidad,1625,Neutro
338152,2020-11-04,eldestapeweb,la vacuna rusa es la que genera más confianza entre los argentinos,1615,Negativo
357913,2020-11-01,nachomdeo,una vacuna rusa y obligatoria que todavía no está aprobada argentina podría convertirse un enorme laboratorio de pruebas,1569,Neutro
353517,2020-11-02,eze_castellvis,los pibes después de la vacuna rusa,1551,Negativo
349990,2020-11-02,pulsionparcial,doman vos le darías la vacuna rusa a tu viejo grabia sí a mi viejo sí yo no me la daría nace una versión masculina de nancy pazos,1548,Negativo
338293,2020-11-04,edufeiok,sandra pitta la vacuna rusa no es confiable y rompe las reglas del desarrollo de medicamentos,1548,Neutro
353136,2020-11-02,lanacion,marta cohen patóloga argentina la vacuna rusa todavía no tiene el aval científico necesario,1540,Neutro
354791,2020-11-02,nbg__,igual que hizo con las vacunas que están testeando astrazeneca pfizer y china el gobierno acordó comprar 10 millones de dosis de la vacuna rusa en caso de que finalmente sea certificada por autoridades sanitarias hoy a las 20 todos los detalles con en,1540,Negativo
81218,2020-11-01,mlauraassis,brasil hoy hubo una manifestación contra el gobernador de san pablo joão doria quien intenta imponer la obligatoriedad de la vacuna china en cambio el presidente bolsonaro ya expresó que ninguna vacuna será obligatoria y que los brasileños no serán las cobayas de china,1424,Negativo
356649,2020-11-02,eldestapeweb,coronavirus alberto fernández confirmó que argentina comprará 25 millones de dosis de la vacuna rusa,1416,Neutro
335643,2020-11-05,hanalfabeto,un éxito las primeras pruebas de la vacuna rusa todos los voluntarios que se le aplicaron manifestaron sus intenciones de votar a del caño,1385,Negativo
343611,2020-11-03,bendernautaokk,la vacuna rusa,1382,Positivo
355811,2020-11-02,johnsopranojr,sí hermano me pusieron la vacuna rusa cómo supiste,1374,Negativo
348428,2020-11-02,endemianado,ahora rubinstein sobre la vacuna rusa ufff me encantaría dejarla tirada en un galpón y que se venza,1372,Negativo
332760,2020-11-06,actualidadrt,el gobierno argentino se volvió loco quiere millones de dosis de la vacuna rusa que no terminó la tercera fase en lugar de comprar una estadounidense o británica que tampoco terminaron la tercera fase con,1363,Negativo
333082,2020-11-06,peroniarepublic,la vacuna rusa que la prueben todos los sindicalistas empezando por baradel y biro,1333,Neutro
355067,2020-11-02,profetaargen,ya está pasando gente yendo a darme la vacuna rusa,1331,Neutro
352370,2020-11-02,torocabron_,ginés garcía gonzález acaba de decir sobre la vacuna rusa que compraron confío en que tenga efectividad confío le mando el hijo de puta delincuente asesino,1320,Negativo
352957,2020-11-02,licmacoco,antes y después de la vacuna rusa,1306,Negativo
335493,2020-11-05,carolinalosada,me encanta que ahora tantos trolis salgan a decir q nunca se pensó en hacer la vacuna rusa covid19 obligatoria casi me convencieron de que había sido mí propia idea posta no abrieron ni un diario,1302,Negativo
348083,2020-11-03,aleruatwit,la ruta de la vacuna rusa k,1300,Positivo
353888,2020-11-02,alejobongio,ahora sí tengo confianza en la vacuna rusa,1264,Neutro
350594,2020-11-02,hernan_mazza,amigos me ofrecí como voluntario para la vacuna rusa covid 19 y fui vacunado esta mañana en el hospital fuí a hacer mis cosas normal y hasta ahora no observo ninguna reaksionoski o efecto sekundarioski pueden estar trankiloski toduski иi meиш че сеитг ja,1261,Negativo
347850,2020-11-03,acostashowjuan,no es lo mismo una vacuna rusa que vacunarte una rusa,1242,Negativo
357650,2020-11-01,matiildaxd,putin dice que le puso la vacuna rusa probada en 76 personas a la hija como cuando un famoso lleno de guita hace la propaganda de la gaseosa tero violado y comenta es la que tomamos en casa,1234,Negativo
350142,2020-11-02,usdtin,a ninguno de todos sus asesores se le ocurrió una excusa mejor para tapar que ni él se quiere poner la vacuna rusa,1201,Negativo
339713,2020-11-04,profetaargen,si la vacuna rusa funciona exijo al gobierno de alberto fernández que organice un show masivo de natalia oreiro en el obelisco para festejar,1169,Negativo
352215,2020-11-02,fabballarini,qué se sabe sobre la vacuna rusa el instituto de investigación gamaleya ministerio de salud de rusia lanzó ensayos clínicos en junio de una vacuna que llamaron gam covid vac es una combinación de dos adenovirus ad5 y ad26 ambos diseñados con un gen de coronavirus,1166,Negativo
336811,2020-11-05,aleruatwit,una vacuna rusa para gobernarlos a todos para encontrarlos para atraerlos a todos y atarlos en las tinieblas,1163,Positivo
352580,2020-11-02,vickyvillarruel,queda claro q el estado considera legal disponer del cuerpo de c u de nosotros a través de distintas leyes y proyectos de ley así como con la vacuna rusa el estado no para de avanzar sobre nuestras libertades lo dije al principio de la cuarentena el tiempo da la razón,1151,Negativo
353596,2020-11-02,dkingsneverdie,si quieren me la inyecto en el pecho a la vacuna rusa ya no me kb 1 es más si quieren me ofrezco de voluntario para probarla si esta floja de papeles total vivo en berisso aspiro restos de ypf desde que nací tengo media planta de chernobyl en el organismo,1148,Negativo
348704,2020-11-02,marianoobarrio,anuncios incumplidos 1 test rápido en terminales de trenes no se informó resultado 2 test rapido neokit laboratorio cassará iban a ser 100 mil por mes no se usó x problemas técnicos 3 vacuna astrazeneca oxford demorada 4 vacuna rusa y pfizer alberto dice q no se la pone,1146,Negativo
341282,2020-11-03,aetchebarne,con la vacuna rusa yonomevacuno hacele rt si estás de acuerdo,1138,Neutro
354252,2020-11-02,zeinicienta,los primeros en recibir la vacuna rusa en argentina serán empleados públicos,1137,Neutro
344675,2020-11-03,rinconet,el opositor que más me gusta es el que critica la vacuna rusa defendiendo la de astrazaneca que antes criticó,1128,Negativo
346274,2020-11-03,hanalfabeto,bueno a laburar porque la vacuna rusa no se paga sola,1071,Negativo
342619,2020-11-03,edufeiok,estuviste genial fuerte cruce entre manuel adorni y pablo duggan por la vacuna rusa mdz online,1065,Positivo
333658,2020-11-06,quimeyherrera01,quimey herrera insinuó que haber recusado todas las materias podría estar vinculado con la vacuna rusa,1065,Neutro
355651,2020-11-02,nanothompson,si tomaste esto en tu adolescencia no hace falta darse la vacuna rusa ya sos inmune al coronavirus y a otras 15 enfermedades,1063,Negativo
335078,2020-11-05,periodistaperon,critican la cuarentena y toda europa impone cuarentena bardean a la vacuna rusa y la compra israel ponen como ejemplo de democracia a estados unidos y no son capaces de tener una elección en paz qué feo ser macrista y que el mundo se te cague de risa,1053,Negativo
347515,2020-11-03,victorfyt,no puedo creer los anencefálicos que militan la vacuna rusa convencidos porque la promocionan los delincuentes que gobiernan para llenarse una vez más los bolsillos,1034,Negativo
354840,2020-11-02,alomecha,esta vacuna rusa tiene las mismas especificaciones de seguridad que la planta de chernobyl,1031,Neutro
355143,2020-11-02,maurette79,bueno vengo de darme la primera dosis de la vacuna rusa les puedo decir que me siento fenómeno claramente иo tiene эfectoс sekyndarios de ningyн tiпo y ectoy χoρoshό я чувствую себя немного странно и я думаю что вытащил ослиные уши,1029,Negativo
338213,2020-11-04,nachomdeo,la asesora presidencia cecilia nicolini acaba de subir el precio de la vacuna rusa a 19 dólares en una entrevista en tn,1017,Neutro
354020,2020-11-02,jotaalonso,para todos los que publican pavadas la decisión de adquirir 25 millones de dosis de la vacuna rusa sputnik v refleja el diálogo constante en temas estratégicos entre alberto y cristina el gobierno nacional no abandona ninguna alternativa y mantiene la planificación sanitaria,1012,Negativo
340740,2020-11-03,alferdezprensa,si tuviera la vacuna rusa en diciembre por supuesto que me vacunaría pero no me parece justo que yo me vacune y otros argentinos no puedan hacerlo el día que me vacune será porque todos pudimos vacunarnos el presidente en la entrevista con,1009,Negativo
355099,2020-11-02,g4briel_8,la vacuna rusa de putín pruebenla primero con hebe,1006,Neutro
333122,2020-11-06,actualidadrt,ni se saltó la tercera fase ni se probó solo en 72 marinos rusos ni carece de informes científicos ni podríamos estar horas desmintiendo lo que dijeron medios argentinos sobre la vacuna rusa sputnik v pero logramos resumirlo en un video de 10 minutos,1006,Negativo
350513,2020-11-02,jonheguier,con la vacuna rusa nos van a inyectar un chip que sabe con quiénes hablamos qué decimos los datos de nuestras tarjetas mapas de dónde nos movemos qué buscamos en internet y qué compramos,1005,Negativo
333291,2020-11-06,hernan_mazza,la vacuna rusa va a ser como la vacuna peronista en 2 dosis la primera en las paso la segunda en las presidenciales,989,Negativo
349845,2020-11-02,jizakude,yo probé la vacuna rusa y doy fe que es buena no tienen ningun нет efecto держи рот своей матери ракушкой,986,Negativo
330920,2020-11-08,rquiroga777,se pondría la vacuna rusa doctor pizzi hace 15 días que ya le saqué la manga izquierda a todas mis camisas y sacos y en la derecha llevo un algodón con alcohol,984,Negativo
330321,2020-11-08,hernan_mazza,se meten en la nariz un polvo que viajó en el culo de una mula desde andá a saber donde y le tienen reacio a meterse la vacuna rusa,977,Negativo
356361,2020-11-02,bastarevolution,levante la mano el que quiere que cfk alberto fernández todo su gabinete y la cámpora sean los primeros en recibir la dosis de la vacuna rusa que está en fase 3,975,Negativo
336213,2020-11-05,gabylevinas,la vacuna rusa no tiene licencia de uso y recién esn septiembre se inició el reclutamiento para la fase 3 q termina el 1 de mayo allí se evaluarán los resultados aplicarla antes masivamente es un riesgo altísimo esto no significa que no sirva significa que hay que esperar,975,Negativo
341634,2020-11-03,marianocaba,a ver lilita que decís ahora lo seguimos apoyando a rafecas lo seguimos apoyando a alberto nos ponemos la vacuna rusa estás conforme con el fallo de la corte qué desilusión que fuiste,971,Negativo
332459,2020-11-07,danteforesi,el trasplantado mercenario se disfraza hace el ridículo y habla del negocio de la vacuna rusa para poder ganarle a un programa de cocina decadente y final el mismo que aseguraba que era la morsa este domingo con qué perderá con carne o pastas,968,Negativo
350472,2020-11-02,ulichaparro12,conociendo un poco al kirchnerismo todos sabemos que esto de la vacuna rusa va a terminar como los respiradores truchos que trajeron de china,962,Negativo
353307,2020-11-02,deloelmo,un spot de berni inyectándose 45 dosis de la vacuna rusa a la vez mientras hace abdominales,957,Neutro
352813,2020-11-02,pia_dmn,ya estoy lista para tener mi vacuna rusa hermanas,952,Negativo
356606,2020-11-02,gustavoeloy635,propongo los primeros 4 para probar la vacuna rusa,950,Negativo
354458,2020-11-02,yuanizarr,los pibes después de ponernos la vacuna rusa,949,Neutro
337339,2020-11-04,hippiesconosde,los que en marzo decían que cristina había viajado a cuba a traer la vacuna y que hace unos meses festejaban que la vacuna de oxford se fabricaba en argentina gracias a alberto ahora militan una vacuna rusa sin los suficientes controles vacunatenoseasmacrista yonomevacuno,948,Negativo
352517,2020-11-02,tomicervera_,como le vas a tener miedo a la vacuna rusa bien que despues se clavaban una caja de mielcitas y el naranju que estaban fabricados en un taller clandestino de enanos y no decian nada trolazos,934,Negativo
333391,2020-11-06,pablalunar,cuando natalia oreiro dice tuve tu veneno se referia a la vacuna rusa estoy desbasatado,934,Negativo
352133,2020-11-02,dantespinetta,se darian la vacuna rusa yo si,932,Neutro
358091,2020-11-01,malcomgomez,virus chino o vacuna rusa parece una de esas encuestas sin escapatoria de radio 10,923,Neutro
346689,2020-11-03,luis_delia,la vacunación masiva de 12 500 000 personas con la vacuna rusa sputnik la firma de la ruta de la seda con china que garantiza inversiones en nuestro país por 18 300 000 de dólares indican un camino y la construcción de un nuevo orden mundial excelente y,915,Negativo
342772,2020-11-03,osvaldo_quiroga,la vacuna rusa te hace comunista a las 48 horas de aplicada es un plan cubano venezolano y ruso para cambiar nuestro modo de vida lean clarín que nunca mintió nunca apoyó golpes militares y siempre defendió al pueblo,912,Negativo
351674,2020-11-02,lanamontalban,aclaro q es especulación pura algo q los periodistas no debemos hacer si lo de la vacuna rusa no es otra cosa que un nuevo negociado para robar de cfkescleptocracia y elpeorpresidentedelahistoria y una nueva táctica de distracción para seguir con el plan de impunidad de ella,911,Negativo
356460,2020-11-02,c5n,audio el presidente confirmó en que argentina adquirirá 25 millones de dosis de la vacuna rusa sputnikv contra el covid 19,909,Neutro
341439,2020-11-03,lucasolmedo_k,danann y lilia después de la vacuna rusa,887,Neutro
350075,2020-11-02,lanacion,rubinstein sobre la vacuna rusa no se puede tomar una decisión hasta que garanticen su seguridad,880,Negativo
357288,2020-11-02,radiomitre,jorge lanata si uno sobrevive a alberto la vacuna rusa es una boludez,870,Neutro
350524,2020-11-02,santosjorgeh,mientras el gobierno nos distrae con la vacuna rusa la corte suprema mañana nos vacuna impunidad para cristina chau república,868,Neutro
356316,2020-11-02,gatosylvestre,hoy 20hs m1 en todo sobre la vacuna rusa que el gobierno estarìa en condiciones de comprar en diciembre las tratativas diplomaticas el viaje de autoridades del mterio de salud el anuncio del presidente y opina con laesperanzarusa,861,Neutro
343335,2020-11-03,riquelmeardo,vacuna rusa algunos ya se la dieron hace rato,847,Negativo
331838,2020-11-07,gracielaocana,escucha la entrevista de magdalena y nicolas winaski y laura de marco el laboratorio que traerá la vacuna rusa tiene graves antecedentes radio mitre,840,Positivo
334330,2020-11-06,elmotorpsico,no confío en la vacuna rusa mario kiosquero de loma hermosa toda la vida le dio patty y salchichas a los hijos mira netflix en español porque no llega a leer los subtítulos,831,Negativo
