,date,username,tweet,replies_count,retweets_count,likes_count,link,popularity
330646,2020-11-08,alecbascbas,"""Alberto nos vacuna"" En un rato, la historia detrás de la vacuna rusa.✌️ #pptbox  https://t.co/BDaIcPUkVP",2,11,25,https://twitter.com/Alecbascbas/status/1325580648845860865,12.666666666666666
328433,2020-11-09,dibujites,"Si la vacuna rusa es tan buena, ¿por qué Ivan Drago perdió contra Rocky? 🤔  https://t.co/wBiJcKnNCZ",2,7,29,https://twitter.com/dibujites/status/1325894474585747456,12.666666666666666
325790,2020-11-11,radio10,"👉 #MañanaSylvestre | 🗣🎙 ""La vacuna Rusa Sputnik V muestra una eficacia del 92%"". #VictorSujov a @gatosylvestre en @Radio10 | 🎧 ▶️  https://t.co/R0B1fCLV4F",3,9,26,https://twitter.com/Radio10/status/1326467218117419009,12.666666666666666
76864,2020-11-13,zacalminuto_mx,"🔴 Inician las primeras pruebas de la vacuna china entre la población de #Aguascalientes, México💉 🇲🇽 para generar inmunidad ante el nuevo coronavirus, Covid-19.  https://t.co/h6lDu3JQGh",1,3,34,https://twitter.com/zacalminuto_mx/status/1327423129367490561,12.666666666666666
326063,2020-11-11,ezequielsalasok,"Hoy a las 11.30 hora de Moscú, 5:30 hora Argentina, habrá un importante anuncio para el mundo sobre la vacuna rusa SPUTNIK V  https://t.co/obwgO1cV4f",2,6,30,https://twitter.com/EzequielSalasOk/status/1326361085419642881,12.666666666666666
325368,2020-11-11,simplementepas,#BuenMiercoles  #FelizMiercoles para todos todas todes La vacuna #Rusa #SputnikV tiene una eficacia del 92% Putin te vacuna #YoMeVacuno #LaEsperanzaRusa Gracias Alberto Cristina Vladimir !💚✌🏽🇦🇷 Pd:No sera obligatoria Sabelo 🤔🐵  https://t.co/n0aSK8W4zU,6,6,26,https://twitter.com/simplementepas/status/1326492239028232193,12.666666666666666
326977,2020-11-10,isaachacksimov,|￣￣￣￣￣￣￣￣￣￣￣|     En esta cuenta     sólo confiamos     en la vacuna RUSA 💉 |＿＿＿＿＿＿＿＿＿＿＿|               (\__/) ||              (•ㅅ•)||             / 　 づ,3,7,28,https://twitter.com/isaachacksimov/status/1326175450482274304,12.666666666666666
327741,2020-11-09,rod37162151,@ChairosY @pfizer El viejito loco va a decir q es mucha lana y q esta en austeridad y q mejor se espera para adquirir la vacuna Rusa. No creo q el vejete quiera desembolsar para comprarla.☹️,1,2,35,https://twitter.com/ROD37162151/status/1325966278864101382,12.666666666666666
321443,2020-11-13,infobae,Fernán Quirós: “Hasta hoy no hemos podido ver si Pfizer y la vacuna rusa han cumplido criterios de calidad”  https://t.co/Zb8ReUhLrA,1,11,26,https://twitter.com/infobae/status/1327228743958589440,12.666666666666666
320689,2020-11-14,edugarg,El 40% de los argentinos desconfiaba de la vacuna rusa antes del spot #yomevacuno con los actores K. Adivinen si después del spot la desconfianza trepó al 55%. Gobierno de científicos,1,14,23,https://twitter.com/edugarg/status/1327609258892881920,12.666666666666666
327468,2020-11-10,sergiopaoletta,Nos ganamos la vacuna rusa por ser el país que más vio el documental de Natalia Oreiro.,0,5,33,https://twitter.com/sergiopaoletta/status/1326004444094492672,12.666666666666666
324837,2020-11-11,portalmvd,La vacuna rusa Sputnik V contra el covid-19 muestra una eficacia del 92 por ciento     https://t.co/iscBxwwnyL,0,6,32,https://twitter.com/portalmvd/status/1326518161332727809,12.666666666666666
321612,2020-11-13,la_irreductible,Ya verás que al final acabamos todos con la vacuna rusa.  https://t.co/Vv2Pi6IJwS,4,6,28,https://twitter.com/La_Irreductible/status/1327137255346024451,12.666666666666666
326802,2020-11-10,_barman_fail,"Chiquis, si consumen/consumieron alcohol y sustancias de dudosa procedencia en su vida diaria QUÉ TIENE DE MALO UNA VACUNA RUSA?  Nada pregúntese eso, buen martes",4,5,28,https://twitter.com/_barman_fail/status/1326201022100992001,12.333333333333334
326761,2020-11-10,sacedator,"Y como no, la más entusiasta propagandista, hasta lo delirante, de la vacuna de Pfizer es Mamen Mendizábal, que además fue la que más insultó a la vacuna rusa #Sputnik5. Lo normal.",1,7,29,https://twitter.com/sacedator/status/1326206970362212357,12.333333333333334
329428,2020-11-09,tomascarretto,Una pregunta: si le dan la vacuna rusa a Daddy y a Echarri...¿como sabés si quedaron tarados por la vacuna o las lesiones cerebrales vienen de antes?,1,3,33,https://twitter.com/tomascarretto/status/1325819465284587520,12.333333333333334
330696,2020-11-08,lanacion,"Adolfo Rubinstein: ""En el caso de la vacuna rusa se ha hecho mucho uso político""  https://t.co/PXMYbF1wR8",7,7,23,https://twitter.com/LANACION/status/1325569795782144000,12.333333333333334
78172,2020-11-10,martincarrizo_,Brasil suspendió los ensayos de la vacuna china. Alberto suspendió los ensayos de populismo  #AjustanJubilados,1,6,30,https://twitter.com/martincarrizo_/status/1326337725847523328,12.333333333333334
328642,2020-11-09,gestionpe,"Vacuna rusa contra COVID-19 es efectiva en más de 90%, afirma Ministerio de Salud ruso  https://t.co/m5k2IIzJOf",2,6,29,https://twitter.com/Gestionpe/status/1325875220264210433,12.333333333333334
326581,2020-11-10,alinamakeupcol,Se pondrían la vacuna Rusa o la Pfizer? O ninguna?,21,1,15,https://twitter.com/Alinamakeupcol/status/1326244133401407489,12.333333333333334
329123,2020-11-09,ikaribonaerense,Vacuna rusa,1,4,32,https://twitter.com/IkariBonaerense/status/1325838452198404098,12.333333333333334
80064,2020-11-08,tavos,Avanza la vacuna china (y tiemblan los que se quedaron en la Guerra Fría)  https://t.co/BUC9KhepLW,1,2,34,https://twitter.com/tavos/status/1325418576975704066,12.333333333333334
79867,2020-11-09,treporta,"Brasil anuncia la suspensión de los ensayos de la vacuna china contra el #COVIDー19 por un ""incidente grave"". @AFP #InternacionalesTR  https://t.co/klkzXpcRRt",12,3,22,https://twitter.com/TReporta/status/1325966860773421057,12.333333333333334
79827,2020-11-09,coronavirusnewv,🇧🇷 |  BRASIL  Brasil suspende pruebas de vacuna china contra covid-19 por 'incidente adverso'. #Brasil #COVID19 #vacuna,0,15,22,https://twitter.com/CoronavirusNewv/status/1325971546209472514,12.333333333333334
322838,2020-11-11,a24com,Miedo argentino a la vacuna rusa contra el COVID-19: ¿la Sputnik V es realmente peligrosa?  ✍️ Por @JesiMihelj    https://t.co/dWLYsgoaQz,19,2,16,https://twitter.com/A24COM/status/1326721125322199045,12.333333333333334
79550,2020-11-10,t13,"Brasil suspende ensayos de vacuna china contra el COVID-19 por un ""incidente grave""   https://t.co/xU6EueB1Y6",7,18,12,https://twitter.com/T13/status/1326007926222417920,12.333333333333334
331268,2020-11-08,luciano434,"Le tienen miedo a la vacuna rusa, pero comían en el Petra y en las Tinajas #Rosario 🤣",3,3,31,https://twitter.com/Luciano434/status/1325280875492339712,12.333333333333334
78182,2020-11-10,kontrainfo,Fuertes cruces en Brasil por la muerte de un voluntario de la vacuna china contra el Covid-19  https://t.co/OaWmPgnKd7,0,18,18,https://twitter.com/KontraInfo/status/1326333257009524737,12.0
322854,2020-11-11,01wili,Después de que te ponen la vacuna rusa contra el covid  https://t.co/T6BzrebKIO,1,6,29,https://twitter.com/01wili/status/1326717791198732289,12.0
329628,2020-11-09,tucumanarde,Toman viagra con speed pero le tienen miedo a la vacuna rusa (?),5,5,26,https://twitter.com/tucumanarde/status/1325803838729842690,12.0
78466,2020-11-10,panampost_es,#COVID-19 - Suspenden pruebas de vacuna china en #Brasil. Lea la nota acá ➡️    https://t.co/bXvE3jHi9v por @alvarograj,1,14,21,https://twitter.com/PanAmPost_es/status/1326249522792714240,12.0
327564,2020-11-09,radiomitre,Los resultados de fase 3 de la vacuna rusa estarían en 15 días  https://t.co/yLpmSHbKcA,14,4,18,https://twitter.com/radiomitre/status/1325986209814941699,12.0
325731,2020-11-11,elliberal_com,"La vacuna rusa contra el COVID presenta una eficacia del 92%, según datos preliminares.   https://t.co/cDfDgsNnNo",3,7,26,https://twitter.com/elliberal_com/status/1326470494737068032,12.0
324384,2020-11-11,brayan042897,@stevenarce De verdad hay gente que cree que la vacuna rusa nos va a meter el comunismo en la sangre? Hay gente así de estúpida? Dios santo...,1,1,34,https://twitter.com/brayan042897/status/1326544335035224065,12.0
322025,2020-11-12,renesquivel_,"banda, me ofrecí como voluntario para la vacuna rusa COVID-19 y fui vacunado esta mañana en el hospital , fui hacer mis cosas normal y hasta ahora no observo ninguna reaksionoski o efecto sekundarioski pueden estar trankiloski toduski иi meиш че сеитгюд ерпестe аьио овут Лопес",6,1,29,https://twitter.com/Renesquivel_/status/1326982819860664321,12.0
330641,2020-11-08,farid_karim60,"Esta muy difícil el tema de la vacuna Rusa. Por un lado los científicos rusos con 40 premios Nobel. Y por el otro lado,El Dipy,La Canosa,Leuco,Majul,Feinmann, El mago sin dientes,Etchecopar Habrá que pensarlo.",3,8,25,https://twitter.com/FARID_KARIM60/status/1325581039863934976,12.0
322130,2020-11-12,fvalverde_rm,"Amigos, me ofrecí como voluntario para la vacuna rusa COVID-19 y fui vacunado esta mañana en el hospital , fui hacer mis cosas normal, no observo ninguna reaksionoski o efecto sekundarioski pueden estar trankiloski toduski иi meиш че сеитгюд ерпестe аьио овут Лопес Обрадор, и я.",4,2,30,https://twitter.com/FValverde_RM/status/1326951957953728512,12.0
76883,2020-11-13,jvazm63,"Despídanse de la vacuna de Pfizer, la cuál tiene que conservarse a -70 grados Celsius. Un refri de tal capacidad vale como 50 mil dólares. Seguramente estará disponible para los altos mandos de la 4T. ¿Nosotros? Pos la vacuna China o la rusa, a ver cómo nos va.",0,13,22,https://twitter.com/jvazm63/status/1327381383317127168,11.666666666666666
78409,2020-11-10,radiomitre,Jair Bolsonaro celebró la suspensión de ensayos de la vacuna china  https://t.co/slXwRNVB9Q,5,3,27,https://twitter.com/radiomitre/status/1326266418317447168,11.666666666666666
328301,2020-11-09,emmalaenanuli,De verdad alguno cree que @rialjorge se va a poner la vacuna rusa? En serio? 😂😂😂😂😂😂😂😂😂😂😂😂😂😂😂😂😂😂😂😂,3,3,29,https://twitter.com/EmmaLaEnanuli/status/1325906392633511937,11.666666666666666
330077,2020-11-09,deloelmo,"Aunque si la vacuna rusa hace crecer el pelo...ojo, eh?",4,4,27,https://twitter.com/DeloElmo/status/1325763317906989056,11.666666666666666
324061,2020-11-11,confi_ar,La vacuna rusa contra el coronavirus obtuvo 92% de eficacia en los estudios de fase 3  ℹ️ @AgenciaTelam   https://t.co/2TbFn6jZEs,0,12,23,https://twitter.com/Confi_ar/status/1326566964773474306,11.666666666666666
331208,2020-11-08,viktorgcia,"Amigos, me ofrecí como voluntario para la vacuna rusa COVID-19 y fui vacunada esta mañana en el hospital, fui hacer mis cosas normal y hasta ahora no observo ninguna reaksionoski o efecto sekundarioski pueden estar trankiloski toduski иi meиш че сеитгюд ерпестe аьио овут Лопе",3,0,32,https://twitter.com/viktorgcia/status/1325337535422279680,11.666666666666666
322442,2020-11-12,ichbinmatute,"Uds querian la heladera llena, los abuelos bien pagados y la vacuna de Pfizer... Agradezcan la vacuna rusa y no jodan mas.",0,8,27,https://twitter.com/ichbinmatute/status/1326878235548901376,11.666666666666666
76987,2020-11-13,albertorodnews,Bolsonaro sobre la vacuna china CoronaVac: «Quiero saber si ese país usó la vacuna allí».  https://t.co/iRKmGtipey,0,13,22,https://twitter.com/AlbertoRodNews/status/1327230186102935552,11.666666666666666
329364,2020-11-09,laruedanoticias,"⭕️ RUSIA / VACUNA  Hoy, declaró ante la prensa Oksana Drápkina, especialista y principal terapista del Ministerio de Salud ruso, que  la efectividad de la vacuna rusa ""Sputnik V"" contra el coronavirus es de más del 90 %.",0,10,25,https://twitter.com/laruedanoticias/status/1325822797227175940,11.666666666666666
329204,2020-11-09,reperfilada,Muy lindo lo de la vacuna rusa y la de Pfizer pero ¿cuándo llega el suero cubano del dr Hala?,5,3,27,https://twitter.com/Reperfilada/status/1325832854706806787,11.666666666666666
98995,2020-11-09,reperfilada,Muy lindo lo de la vacuna rusa y la de Pfizer pero ¿cuándo llega el suero cubano del dr Hala?,5,3,27,https://twitter.com/Reperfilada/status/1325832854706806787,11.666666666666666
328479,2020-11-09,rubalef,Otra que está en el 90% !!  Terapeuta del Ministerio de Salud de Rusia: La efectividad de la vacuna rusa Sputnik V es de más del 90 % - RT  https://t.co/7bVzGZ7Bmo,1,13,21,https://twitter.com/rubalef/status/1325889541853614080,11.666666666666666
325820,2020-11-11,levante_emv,"🔴  URGENTE  | La vacuna rusa anticoronavirus tiene eficacia del 92 %, según datos preliminares  https://t.co/fdyOCyt3N7  https://t.co/vcnylsBOaw",7,7,21,https://twitter.com/levante_emv/status/1326464466284916737,11.666666666666666
321263,2020-11-13,cristinachaca,"Otra! Cristina ..Cristina ..Cristina..De lo que diga carrió ..Hago todo lo contrario..No darse vacuna rusa porque la trae Cristina y la inteligencia rusa está ligada a ella..Según la cerda ,no pasó los controles..Le sale la envidia por los poros😬",2,6,27,https://twitter.com/CristinaChaca/status/1327271705287553025,11.666666666666666
321007,2020-11-13,claudiosavoia,Más detalles sobre la milonga de la vacuna rusa: infórmate con el gran @luciofdezhumore. Lo recomiendo,1,11,23,https://twitter.com/claudiosavoia/status/1327364207499751424,11.666666666666666
322159,2020-11-12,salvastrambi99,"Auto cultivo cannabico, vacuna rusa y proyecto de ley sobre aborto, saluden a edu feinmann q se va",0,0,35,https://twitter.com/SalvaStrambi99/status/1326946446856351744,11.666666666666666
77032,2020-11-13,regio_mty_nl,Vacuna china.  https://t.co/2xgIHCFf6H,3,8,24,https://twitter.com/Regio_Mty_NL/status/1327112348570710016,11.666666666666666
98970,2020-11-10,rhapsody_girl,"Me matan los que piensan que la gente no se quiere dar la vacuna rusa por ""ideología"", es por no haber pasado todas las pruebas amigo",4,6,24,https://twitter.com/Rhapsody_Girl/status/1326181815606972417,11.333333333333334
78198,2020-11-10,infobae,Cómo funciona la vacuna china de Sinopharm que presentó una inmunidad prometedora  https://t.co/FWgeP7KiPp,8,7,19,https://twitter.com/infobae/status/1326329611005947904,11.333333333333334
76887,2020-11-13,quetzal0518,"¿Por qué Gatell le está poniendo pretextos a la vacuna de Pfizer, pero no dice nada de la vacuna China?  Porque el Dr. Muerte, siempre busca como hacerle para que López no suelte el presupuesto.  No quieren gastar en una vacuna de calidad.",5,6,23,https://twitter.com/Quetzal0518/status/1327374037832536064,11.333333333333334
328026,2020-11-09,vitomagarulo,¿Se darán los progres la vacuna rusa? ¿O querrán la de Pfizer?,4,3,27,https://twitter.com/VitoMagarulo/status/1325937585257127939,11.333333333333334
331065,2020-11-08,ricardo_blogger,"Los medios que se dedicaron a tirarle mierda a la vacuna rusa por pelearle al gobierno sólo consiguen que la gente descrea de las vacunas, se atemorice y luego haya menor cobertura. ¿Se harán responsables de las muertes que ocurran por ello? La respuesta no los sorprenderá.",2,7,25,https://twitter.com/Ricardo_blogger/status/1325449364731465729,11.333333333333334
322491,2020-11-12,mlramirezok,".@DrDanielGollan ""La vacuna rusa lleva vacunadas 20 mil personas con una dosis, y 16 mil más con las dos dosis, es decir lleva 36 mil personas vacunadas, y una de las cosas importantes es que 36 mil personas no han tenido efectos adversos"".   https://t.co/KTw0zgFqMm  https://t.co/452P6Hge1q",0,7,27,https://twitter.com/MLRamirezOK/status/1326865293113700354,11.333333333333334
77957,2020-11-11,albertorodnews,Muerte de voluntario brasileño para la vacuna china fue un «suicidio».  https://t.co/rPS0xxMJuN,8,14,12,https://twitter.com/AlbertoRodNews/status/1326478021847633927,11.333333333333334
330382,2020-11-08,canalla24d,Llegó la vacuna rusa a Rosario,0,0,34,https://twitter.com/Canalla24D/status/1325623121328615428,11.333333333333334
321914,2020-11-12,pagina12,Coronavirus: la OMS gestiona para incorporar a la vacuna rusa Sputnik V como uso de emergencia  https://t.co/49Cqs7Hplv,1,12,21,https://twitter.com/pagina12/status/1327017758090022912,11.333333333333334
79661,2020-11-09,andretelesur,"Suspenden en #Brasil los tests de la vacuna china CoronaVac por ""evento adverso grave"". El Instituto Butatã, del gobierno de São Paulo, critica la decisión del gobierno Bolsonaro.  Bolsonaro y el gobernador de São Paulo deben ser candidatos.  Brasil➡️162 mil muertos por Covid-19  https://t.co/7MmPafQtNa",3,16,15,https://twitter.com/AndreteleSUR/status/1325988967343329280,11.333333333333334
324668,2020-11-11,latintacba,"#HOY 💉 La vacuna rusa Sputnik V ha mostrado un 92% de efectividad, según se desprende del primer análisis intermedio de la tercera fase de los ensayos clínicos realizados a más de 16.000 voluntaries.  https://t.co/GtvACD5DAO",1,4,29,https://twitter.com/latintacba/status/1326527386125443072,11.333333333333334
326919,2020-11-10,rhapsody_girl,"Me matan los que piensan que la gente no se quiere dar la vacuna rusa por ""ideología"", es por no haber pasado todas las pruebas amigo",4,6,24,https://twitter.com/Rhapsody_Girl/status/1326181815606972417,11.333333333333334
80024,2020-11-08,laoctavadigital,La vacuna china-canadiense ya fue probado en mexicanos y busca la participación de más voluntarios 💉   https://t.co/W1TPeXfxAn,0,8,26,https://twitter.com/laoctavadigital/status/1325619869015035911,11.333333333333334
325721,2020-11-11,quepasacl,💉 Casi lista: Vacuna rusa Sputnik V demuestra un 92% de eficacia contra el coronavirus en su fase 3  https://t.co/jDZevYalLP  https://t.co/PfkPrbqR6v,1,5,28,https://twitter.com/QuePasaCL/status/1326471262676393986,11.333333333333334
329361,2020-11-09,mdsuarez,"📌#Alerta | #Insólito Un hombre en edad de riesgo denunció en la justicia federal la compra de la vacuna Rusa  “Me encuentro ofendido porque yo estaría entre los destinatarios de esa vacuna"", manifestó en la denuncia  Se trata de Daniel Igolnikov, abogado de 70 años.  https://t.co/nCfFDlsx4a",8,9,16,https://twitter.com/MDSuarez/status/1325822891116666883,11.0
78124,2020-11-10,tnconbienestar,"Coronavirus: científicos brasileños informaron que un voluntario de la vacuna china murió, pero no a causa de los ensayos  https://t.co/nijWsDpIqY",4,9,20,https://twitter.com/TNConBienestar/status/1326358063897522178,11.0
324807,2020-11-11,foro_tv,"Sputnik V, la vacuna rusa contra el coronavirus, tiene eficacia del 92%: aseguran autoridades    https://t.co/zLWIUlJojI  https://t.co/g9t2EEo2v1",0,6,27,https://twitter.com/Foro_TV/status/1326519975469850629,11.0
79531,2020-11-10,elnuevoherald,Brasil suspende ensayos de vacuna china contra el covid-19 por un “incidente grave”  https://t.co/7kOLJeaOFE,0,13,20,https://twitter.com/elnuevoherald/status/1326011891269984256,11.0
326132,2020-11-10,regacarlos,"Vacuna Rusa. Si los resultados que promete son sobre este trial, el mismo NO tiene aún 2 meses de reclutamiento❗️Si es sobre otro, sería bueno que lo comuniquen  https://t.co/HWvoIvyAna",2,10,21,https://twitter.com/RegaCarlos/status/1326348887867723777,11.0
77835,2020-11-11,nn_dgg,Pero vamos a lo que importa: qué opina el mundo de la hostelería sobre la vacuna china?,0,5,28,https://twitter.com/nn_dgg/status/1326526543292731394,11.0
327408,2020-11-10,mirnalusso55,El coronavirus vino para crear más grietas: _ cuarentena sirve / no sirve _ barbijo sí/ barbijo no _ plasma sí/ plasma no _ ibuprofeno  sí/ ibu no _ vacuna sí/vacuna no Y por si ésto fuese poco ahora están  _ vacuna rusa/ vacuna de Oxford  Maldito virus ....viniste a jorobar,1,4,28,https://twitter.com/MirnaLusso55/status/1326022891180331008,11.0
328815,2020-11-09,marcel_rodrig,"River no estará usando la vacuna rusa, no?",2,1,30,https://twitter.com/marcel_rodrig/status/1325860863555809280,11.0
330376,2020-11-08,rominamanguel,"#AHORA  #VizzottiEnRM  ""Yo me daría la vacuna rusa. Me daría la vacuna rusa, la de Oxford, la de Pfizer, la de China y todas las vacunas contra el coronavirus"", @carlavizzotti   #A24  #RM  https://t.co/kAjdfXvQeI",3,0,30,https://twitter.com/rominamanguel/status/1325623449797210113,11.0
322055,2020-11-12,milenio,"La organización internacional espera los datos de la vacuna rusa contra el coronavirus para que, en caso de comprobarse su efectividad, se recomiende su utilización  https://t.co/ACEJmlKZQw",0,2,31,https://twitter.com/Milenio/status/1326972532063342592,11.0
327494,2020-11-10,rodoteescribe,"Branca y Rial se ofrecieron para aplicarse la vacuna rusa..., qué vivos, más inútiles no los va a hacer una vacuna.",4,4,25,https://twitter.com/RodoTeEscribe/status/1325998437289037829,11.0
324415,2020-11-11,expresoperu,"La vacuna rusa anticoronavirus tiene una eficacia del 92 %, según datos preliminares   https://t.co/cY1iel1Q7j",3,4,26,https://twitter.com/ExpresoPeru/status/1326542427469963270,11.0
329299,2020-11-09,perfilcom,#8N | Polémica por manifestantes vestidos del Ku Klux Klan en Bariloche  Tres personas protestaron en el Centro Cívico contra la vacuna rusa disfrazados con el atuendo del grupo supremacista blanco  https://t.co/ACXKA5h9JX,9,4,20,https://twitter.com/perfilcom/status/1325826913915514882,11.0
330599,2020-11-08,majulluis,"Qué hay detrás de HLB Pharma, el controvertido laboratorio que negocia la compra de la vacuna rusa @guadavazquez en #LaCornisa   📺 @LaCornisaok por @lanacionmas   https://t.co/LyvIwpNacb",4,5,24,https://twitter.com/majulluis/status/1325590686784172034,11.0
325285,2020-11-11,cablenoticias,#Internacional | Vacuna rusa anticoronavirus tiene eficacia del 92 %  Los detalles aquí 👉  https://t.co/yKr5tN1jVx  https://t.co/fqxqxzWVXG,4,9,20,https://twitter.com/CABLENOTICIAS/status/1326495509008306176,11.0
78766,2020-11-10,martincho78,"163 mil brasileños/as murieron por la pandemia y el Genocida festeja que se suspendieron por el momento las pruebas con la vacuna china en San Pablo. Que nadie olvide que este sádico demente llegó al poder gracias a @SF_Moro, el arquitecto del desastre.   https://t.co/8FIStr28V2",2,6,25,https://twitter.com/Martincho78/status/1326193708182757385,11.0
323689,2020-11-11,chikatilo_,Les chiques biempensantes prociencia -que siempre han atacado a los antivacunas- diciendo que no se pondrían la vacuna rusa porque “no confían” me dan vida.,1,2,29,https://twitter.com/Chikatilo_/status/1326598028137013249,10.666666666666666
322817,2020-11-12,bastarevolution,"¡Que alguien le de la vacuna rusa a Alberto, por Dios santo!  https://t.co/c7hdEqgY6a",2,5,25,https://twitter.com/BastaRevolution/status/1326724921721032704,10.666666666666666
320590,2020-11-14,aguuusvalverde,"No se quieren poner la vacuna rusa porque no está aprobada, pero se toman un medicamento veterinario que supuestamente cura el Covid aprobado por quién? Miami me lo confirmó?",1,2,29,https://twitter.com/AguuusValverde/status/1327668521350918144,10.666666666666666
77984,2020-11-11,infobaeamerica,La Policía de Brasil catalogó como suicidio la causa de muerte del voluntario para la vacuna china que suspendió sus ensayos  https://t.co/Yi6ZQOofLC,8,13,11,https://twitter.com/infobaeamerica/status/1326466001312092160,10.666666666666666
78286,2020-11-10,tiempoarg,"Un nuevo papelón de Bolsonaro: se burló de la suspensión de los ensayos de la vacuna china, pero estaba equivocado.  https://t.co/yDKCd8a20o  https://t.co/gEoRks4XTb",0,9,23,https://twitter.com/tiempoarg/status/1326303886228017158,10.666666666666666
320773,2020-11-14,edo_granpa,Cuando @kikamx_ venga a Japón y nos veamos de nuevo después de ponernos la vacuna rusa...  https://t.co/jFJXlSheO3,1,1,30,https://twitter.com/Edo_Granpa/status/1327550669876727809,10.666666666666666
321623,2020-11-13,bigsledgeok,Todos los kerneristas anti vacunas ahora son pro vacuna rusa 😂 Como si se la fueran a poner de verdad,2,3,27,https://twitter.com/bigsledgeok/status/1327126730331533317,10.666666666666666
325121,2020-11-11,biobio,"La vacuna rusa se encuentra en fase 3 de ensayos clínicos, realizados con 40.000 voluntarios.  https://t.co/gVt7MqGeB7",4,7,21,https://twitter.com/biobio/status/1326503836203282433,10.666666666666666
79817,2020-11-09,rcr750,#ATENCIÓN Brasil suspende ensayos de vacuna china covid-19 por 'incidente adverso'.,0,16,16,https://twitter.com/RCR750/status/1325972202014052353,10.666666666666666
76939,2020-11-13,carolinarmora,"Bueno ya me pusieron la vacuna china, por ahora 为了, no siento 没有重大变化.",2,0,30,https://twitter.com/CarolinaRMora/status/1327282458556043265,10.666666666666666
325950,2020-11-11,sputnikmundo,"⚡️Turquía, interesada en producir la vacuna rusa Sputnik V👇  https://t.co/83rZ00ZIp8  https://t.co/woyHs8SDnM",0,10,22,https://twitter.com/SputnikMundo/status/1326409856392323072,10.666666666666666
79788,2020-11-09,fontirroigpablo,🚨|🇧🇷Brasil detuvo los ensayos de la vacuna china contra el COVID-19 por un “incidente adverso”  https://t.co/lBygjw4CRv,0,19,13,https://twitter.com/FontirroigPablo/status/1325974856190619648,10.666666666666666
77256,2020-11-12,carmcerb21,"BRASIL SUSPENDE ENSAYOS  DE LA VACUNA EXPERIMENTAL CHINA POR CASO ADVERSO ""GRAVE"".   Vacuna contra el coronavirus: Brasil interrumpe las pruebas de la vacuna china de Sinovac por un incidente adverso ""grave"" - BBC News Mundo   https://t.co/5XAi0bloOp",1,13,18,https://twitter.com/CarmCerb21/status/1326881804415086592,10.666666666666666
330461,2020-11-08,layeguadelsur,Asi que el gobierno de Alberto y la Jefa de la banda van a hacer un flor de negociado con la vacuna rusa? Ines Perado,3,7,22,https://twitter.com/layeguadelsur/status/1325617932110532608,10.666666666666666
