,date,username,tweet,likes_count,sentiment_analysis
379596,2020-10-02,conelmazodando,delcy rodríguez venezuela es el primer país del occidente en recibir vacuna rusa contra covid 19 chavismoresistenciaylealtad,20,Negativo
373980,2020-10-03,conelmazodando,delcy rodríguez venezuela es el primer país latinoamericano en recibir vacuna rusa contra covid 19 chavismoresistenciaylealtad,20,Negativo
379991,2020-10-02,karenbahamondes,no nos engañan es un espía ruso chavista k popero y la forma de puma es un efecto de la vacuna rusa,20,Negativo
373763,2020-10-03,elinspectortuga,camarada mañana pase por el despacho que le vanos a poner la vacuna rusa a mi mame camarada camarada creo que me colgó,20,Negativo
373430,2020-10-03,elnacionalweb,guaidó rechazó llegada de la vacuna rusa a venezuela usan a nuestra gente como conejillos de indias enpolítica,20,Neutro
376780,2020-10-02,claudiorfarias,venezuela primer país en recibir la vacuna rusa gracias al enlace de nuestro presidente al presidente putin y al pueblo de rusia por esta importante expresión de solidaridad sistemapetroinmoviliario,19,Negativo
368597,2020-10-06,embajadarusaes,presidente de rusia vladímir putin sobre las vacunas sputnikv y epivakcorona todas son vacunas de la clase más alta del mundo tanto la primera como la segunda estoy seguro de que pronto habrá una tercera vacuna rusa,19,Negativo
379395,2020-10-02,luisfcocabezas,ya la almiranta atíla se colocó la vacuna rusa,19,Neutro
375716,2020-10-02,el_universal_mx,video venezuela recibió este viernes un primer lote con 2 mil dosis de la vacuna rusa contra el nuevo coronavirus la sputnik v que servirá para que el país caribeño participe de la fase 3 del desarrollo del fármaco,19,Negativo
370246,2020-10-05,redradiove,venezuela avanza en la fase 3 de los estudios clínicos de la vacuna rusa sputnik v uno de los 10 antídotos contra el covid 19 en el mundo que han llegado hasta esta etapa,19,Negativo
376587,2020-10-02,elfakepost,actualidad delcy rodríguez declara sobre la vacuna rusa para el covid 19 que será probada en venezuela el que tenga miedo a morir que no nazca,19,Negativo
368648,2020-10-06,elbustv,reporta desde carvajal trujillo salí tempranito con un clima divino a pegar dos papelógrafos un señor se acercó a leer y comentó sobre la vacuna rusa conejillos de indias nosotros yo no me voy a poner eso,19,Negativo
375187,2020-10-02,rigotordoc,está bastante bien explicado lo que se sabe hasta ahora de la vacunarusa sputnikv claves sobre la vacuna rusa contra el covid 19,19,Negativo
376363,2020-10-02,dongochok,tu chavistas maduristas y los jerarcas del pelen ese culo y prueben su vacuna rusa hdp,19,Negativo
379131,2020-10-02,elratonjodedor,gracias a la llegada de la vacuna rusa ahora van a quintuplicar el precio de las jeringas anótenlo,19,Negativo
379042,2020-10-02,anibalgarzon,llega a venezuela la vacuna rusa sputnikv para últimos ensayos clínicos de la tercera fase dos mil personas recibirán la dosis en el país para posteriormente si todo va bien iniciar su producción masiva los dictadores putin y maduro cooperando por la salud de los pueblos,19,Negativo
373365,2020-10-03,conelmazodando,venezuela recibe primer lote de la vacuna rusa contra el coronavirus sputnik v delcy chavismoresistenciaylealtad,19,Neutro
373235,2020-10-03,la_patilla,guaidó condenó a maduro por usar venezolanos como conejillos de indias para la vacuna rusa,19,Neutro
371178,2020-10-04,merlinaadamss,chicos hoy es domingo si bajamos un cambio y hablamos de cosas más tranquilas como x ejemplo quién se va a dar la vacuna rusa,19,Negativo
370752,2020-10-04,maduradascom,directa la punta de idania chirinos a delcy sobre la vacuna rusa si tan grande fue su emoción por qué no fue la primera en ponérsela venezuela 4octubre 4oct,19,Negativo
375284,2020-10-02,davidxcuba,4f y para colmo vacuna rusa y la pone un médico cubano,19,Neutro
372298,2020-10-03,tiagorrito,ajá deseo salud para trump no me pondré la vacuna rusa vuelvo a la programación original violación de ddhh crímenes de lesa humanidad hiperinflación sin luz sin agua sin gasolina sin gas venezuela harta del régimen protesta en 21 estados y seguirá,19,Negativo
378942,2020-10-02,eleconomista,venezuela recibe un primer lote de la vacuna rusa contra el covid19 sputnik v,19,Neutro
378293,2020-10-02,escar_judyth,ultimahora venezuela se convierte en el primer pais latinoamericano en recibir la vacuna rusa contra el codiv19 insurrecciondelaesperanza patrialibrepurocorazon,19,Negativo
369487,2020-10-05,diegoenlalucha,el hijo de se ofrece de voluntario para recibir la vacuna rusa,19,Neutro
378189,2020-10-02,pedrokonductaz,el señor accede a la vacuna rusa,19,Neutro
376050,2020-10-02,revista_if,hola soy idiota y me voy a poner la vacuna rusa chao,19,Negativo
373413,2020-10-03,_noalcomunismo,juan guaidó alertó sobre el uso de los venezolanos como conejillos de indias para probar la vacuna rusa contra el covid 19 guaidó desconfía y exigió que sea el dictador el primero que la pruebe aunque en lo único en lo que va de primero es en delitos dijo,19,Negativo
370129,2020-10-05,albertoravell,nicolasito maduro se pondrá la vacuna rusa luego que su padre arrugara,19,Negativo
378051,2020-10-02,nancyca51696948,envivo vicepdta es un momento histórico para nuestra patria venezuela se convierte en el primer país de américa en recibir la vacuna rusa contra el covid19 sistemapetroinmobiliario,19,Negativo
84702,2020-10-05,conelmazodando,presidente maduro informó que este mes llega la vacuna china contra el covid 19 sputnik v chavismoresistenciaylealtad,19,Negativo
372794,2020-10-03,venesys__alpha7,guaidó condenó a maduro por usar venezolanos como conejillos de indias para la vacuna rusa madurocriminal,19,Neutro
84665,2020-10-05,conelmazodando,presidente maduro informó que este mes llega la vacuna china contra el covid 19 sputnik v chavismoresistenciaylealtad,19,Negativo
376533,2020-10-02,culpaderusia,expertos advierten peligrosidad garantizada de la vacuna rusa sputnik v recién llegada a venezuela porque una de dos si no supone un peligro para las personas entonces supone un peligro para el coronavirus,19,Negativo
369349,2020-10-05,eltiempo,el presidente de venezuela nicolás maduro dijo este domingo que su hijo participará en las pruebas clínicas previstas en el país caribeño de la vacuna rusa contra el nuevo coronavirus sputnik v,19,Negativo
377508,2020-10-02,yhoscarly,sputnikvllegaavenezuela venezuela se convierte en el primer país del hemisferio occidental en recibir la vacuna rusa sputnik v contra la covid 19 para fase 3 de ensayos modoactivo,19,Negativo
379352,2020-10-02,luisfcocabezas,ya los van a ver tirando el paro a todos los ministros de maduro poniéndose la vacuna rusa apostamos,19,Neutro
374687,2020-10-02,alecrespof,el prospecto de vacuna rusa sputnik v llegó a venezuela lamentablemente es más conocida por antecedentes políticos que sanitarios dijeron que estaba aprobada 1 mes antes de publicar resultados de sus estudios fase 1 2 publicó esto al respecto,18,Negativo
375762,2020-10-02,cmaribel19,a partir de ésta noche si ven alguna cola más larga que las de gasolina calma son los escuacas listos para ponerse la vacuna rusa jajaja jajaja jajaja,18,Negativo
376748,2020-10-02,ku1989paul,venezuela llegó al país suramericano el primer cargamento con la vacuna rusa sputnik v siendo así el primer país de américa latina en recibir el cargamento la oms felicitó a rusia por sus excelentes acciones para crear una vacuna segura y eficaz contra la covid19,18,Negativo
371243,2020-10-04,nelsonolaya,mientras en venezuela ya se empieza a aplicar la vacuna rusa que es la única efectiva y gratis en colombia ya tiene cuadrado un negocio con un laboratorio gringo que no da garantía de nada de efectividad y a precios exhorbitantes cvy,18,Negativo
369082,2020-10-05,tecnovare,la vacuna rusa generó anticuerpos sin efectos adversos en todos los participantes sputnikv vacunarusa vía,18,Positivo
374736,2020-10-02,lacocvaldez1,gasolina iraní vacuna rusa frijoles chinos leche y harinas mexicanas caraotas argentinas moneda de eeuu presidente colombiano o de origen desconocido todavía pero somos soberanos aquí lo que somos unos soberanos pendejos,18,Negativo
372481,2020-10-03,332barinas,envideo vicepdta ejecutiva la cooperación con el centro nacional de investigación de epidemiología y microbiología gamaleya le permite a venezuela adquirir la vacuna rusa sputnikv sputnikvesesperanza,18,Positivo
368924,2020-10-06,rnvinformativa,dandoydando salud estamos colocando los mismos criterios de la vacuna rusa debe aplicarse en esta fase solo a voluntarios que deben ser mayores de 18 años,18,Negativo
372196,2020-10-03,la_patilla,guaidó condenó a maduro por usar venezolanos como conejillos de indias para la vacuna rusa,18,Neutro
375140,2020-10-02,rafaelgoudeth,virus chino vacuna rusa gasolina iraní contrainteligencia y medicina cubana presidente colombiano esequibo guyanés,18,Positivo
378424,2020-10-02,infobaeamerica,el régimen venezolano recibió el primer lote de la vacuna rusa contra el covid 19,18,Negativo
378204,2020-10-02,plbg76,amigo escuálido no se coloque la vacuna rusa terminará adoctrinado a ser stalinista,18,Negativo
377437,2020-10-02,oliverlopezcano,llegó la vacuna rusa quieren usar a los venezolanos como conejillos de laboratorio esa vacuna ha sido cuestionada por varios gobiernos del mundo ni siquiera es avalada por más nadie solo por los rusos y la tiranía de venezuela,18,Negativo
373457,2020-10-03,adrianliberman,si alguien dudaba que el chavismo es un gran experimento bio político la llegada de la vacuna rusa sin cumplir los requisitos para su uso masivo lo desmiente,18,Positivo
375654,2020-10-02,maria_e_medina,ya veremos al bojote de escualidos de primeros haciendo cola para ponerse la vacuna rusa es recurrente hablan pendejadas pero siempre son los primeros chicharrones de la fiesta para la gasolina los claps los creditos los carros casas carnet de la patria etc,18,Negativo
378488,2020-10-02,josfari51554066,2octubre pregunta seria para gente seria cuantos vibradores cree usted que rompa hoy al enterarse de la llegada de la vacuna rusa traída x el presidente ojo sólo respuestas creíbles,18,Negativo
380047,2020-10-02,estelaharriso16,epivaccorona será la segunda vacuna rusa registrada contra la covid19 la agencia sanitaria rusa rospotrebnadzor informó que ninguno de los cien voluntarios que se vacunaron durante la segunda etapa de las pruebas sufrieron efectos secundarios cuba cubaporlasalud,18,Negativo
374950,2020-10-02,nesticorodrigu1,llegó a venezuela el 1 lote de la vacuna rusa sputnik v vamosaponerleel por la solidaridad entre los pueblos en la lucha contra la covid19 dzt cuba,18,Negativo
379034,2020-10-02,guver2008,la vacuna rusa contra la covid19 me la pondría con toda confianza la gringa no porque me pueden inocular cáncer los gringos son malvados y ruines yo no confío en ninguno de ellos y en sus acólitos mucho menos,18,Negativo
379617,2020-10-02,elmelomano79,el que no quiera la vacuna rusa no se complique la vida y póngase su dosis de cloro con desinfectante,18,Negativo
370382,2020-10-04,leosarro,vacuna rusa aseguran que todos los voluntarios desarrollaron anticuerpos contra el coronavirus las pruebas alcanzaron a un total de 76 participantes,18,Negativo
374303,2020-10-03,drwilfredobello,aquí les dejo algunas consideraciones acerca de la vacuna rusa contra el covid19 sputnikv desde mi punto de vista como médico,18,Negativo
369294,2020-10-05,drojoze,denle sin miedo a la vacuna rusa que esa vaina es puro vodka absoluto y ya,18,Negativo
379629,2020-10-02,esosiquetetengo,si la vacuna rusa se llama sputnikv es porque te manda al cielo,18,Negativo
373756,2020-10-03,ejdecena,al gobierno no se le puede creer ni media palabra seguramente harán un show donde maduro cilia y padrino lópez se estén aplicando la vacuna rusa de putín pero en realidad se estarán inyectando mililitros de coca cola,18,Negativo
373489,2020-10-03,oncaverse,3oct sputnikvesesperanza onca felicita el histórico cargamento de dosis de la vacuna rusa sputnikv que ya está en territorio venezolano invitamos a todo nuestro pueblo a acompañar este acto de solidaridad de rusia graciasrusia viralizaloquesalva oncaguerrilladigital,17,Neutro
373632,2020-10-03,eldiario,3oct presidente interino de venezuela sobre la llegada de la vacuna rusa contra el covid 19 sputnik v es una prueba y usan a nuestra gente como conejillos de indias,17,Negativo
84764,2020-10-05,conelmazodando,presidente maduro informó que este mes llega la vacuna china contra el covid 19 sputnik v chavismoresistenciaylealtad,17,Negativo
376565,2020-10-02,dantefontana3,lo de la vacuna rusa es algo delicado te inspiran confianza los rusos le crees a la dictadura venezolana,17,Negativo
369209,2020-10-05,elvinralph28,que la vacuna rusa se vaya a probar en venezuela sin estar certificada o aprobada por la oms es una demostración más de que para el gobierno y sus aliados extranjeros el ciudadano venezolano es un objeto desechable un ser de segunda categoría totalmente prescindible,17,Negativo
379457,2020-10-02,carvajalino18,atención ultimahora anuncia nuestra vicepresidenta la llegada de la vacuna rusa sputnik v y venezuela será el primer país latinoamericano en probar la vacuna contra el covid 19 sputnikvllegaavenezuela,17,Negativo
378899,2020-10-02,ejrl,venezuela lista para producir la vacuna rusa contra el virus chino anunció el chavismo gobernante pero no aclararon el tipo de octanaje,17,Negativo
378418,2020-10-02,ayahasofia,2oct segunda etiqueta del día sputnikvllegaavenezuela día historico llega a venezuela primer país latinoamericano que recibe la vacuna rusa sputnik v para ganar la lucha contra la covid 19 gracias rusia,17,Negativo
371676,2020-10-04,el_cooperante,ong médicos unidos advirtió que la vacuna rusa no es confiable,17,Negativo
378710,2020-10-02,zodi23_trujillo,últimominuto nuestra vicepdta ejecutiva de la república se dirige al pueblo venezolano para anunciar la llegada del primer lote de la vacuna rusa sputnik v para combatir el covid 19 en venezuela viva la hermandad entre venezuela y rusia,17,Negativo
372397,2020-10-03,joshuackrmn,al parecer ya llegó la vacuna rusa acá jjj q les puedo decir эффект уже чувствую могу пойти гимн ссср спеть,17,Negativo
377177,2020-10-02,juanpistola17,ahora resulta que los que iban a acabar con las colas son los que están haciendo cola para que les pongan la vacuna rusa que cosas no al capriles primero,17,Negativo
369521,2020-10-05,finanzametalera,la vacuna rusa suministrada a trump no trae daños colaterales,17,Neutro
378042,2020-10-02,donlenguaweb,nicolás maduro no probará la vacuna rusa sputnik v porque es alérgico a las vacunas,17,Negativo
376906,2020-10-02,ciudadfutura,venezuela recibe un cargamento de sputnikv y será el primer país iberoamericano en probar la vacuna rusa contra el covid 19,17,Negativo
379837,2020-10-02,starruiz25,ya empezaron la alegata aquellos por la vacuna rusa aunque no sea miwate la que la recibe,17,Negativo
370082,2020-10-05,proctologo,llegó la vacuna rusa contra la peste china les dicen las prestobarba porque lo que a la primera se le pasa la segunda lo repasa,17,Negativo
371887,2020-10-03,el_cooperante,ong médicos unidos advirtió que la vacuna rusa no es confiable,17,Negativo
379878,2020-10-02,elaferris,susto delcy informa que llegó la vacuna rusa a venezuela ya verán van a vacunar a un gentío y el mes q viene zuazzzz no hay covid para las elecciones,17,Negativo
380159,2020-10-01,ohromanovs,así vamos a quedar cuando nos va inyecten más vacuna rusa sputnik v esta película una visionaria,17,Negativo
378162,2020-10-02,lucioquincioc,segun en la vacuna rusa no produce efectos adversos,17,Neutro
376940,2020-10-02,rafael_1981_198,02oct sputnikvllegaavenezuela un gran avance contra el covid 19 hecho en socialismo día histórico llega a venezuela primer país latinoamericano que recibe la vacuna rusa sputnik v para ganar la lucha contra la covid 19 gracias rusia,17,Negativo
373256,2020-10-03,albertorodnews,sputnik v dictadura someterá a los venezolanos a pruebas con la vacuna rusa sin supervisión de la oms,17,Neutro
370587,2020-10-04,jorgeretamar3,la vacuna rusa produjo anticuerpos en todos los pacientes vía,17,Positivo
370502,2020-10-04,elpitazotv,estendencia hijo de nicolás maduro nicolasito será voluntario para la vacuna rusa,17,Neutro
369874,2020-10-05,maperezpirela,maduro confirma que su hijo maduro guerra y su hermana también se pondrán la vacuna rusa vía,17,Neutro
375662,2020-10-02,rconfidencial,ong médicos unidos vacuna rusa no cumple los estándares éticos para su aplicación,17,Neutro
377252,2020-10-02,franjesus1,damas y caballeros llegó la vacuna rusa a ver nos ponemos serios para responder la siguiente encuesta si pueden dar su opinión bienvenida sea,17,Negativo
376826,2020-10-02,plumadisidente,ultimahora venezuela se convierte en el primer país de américa en recibir la vacuna rusa contra el covid19,17,Negativo
371952,2020-10-03,telenoticiasrd,internacionalestn venezuela recibe el primer lote de la vacuna rusa contra el covid 19 ver en tnfindesemana,17,Negativo
84743,2020-10-05,teleiguana,este mismo mes también llega a venezuela la vacuna china para fase de pruebas la iguana tv,17,Neutro
84776,2020-10-05,conelmazodando,presidente maduro informó que este mes llega la vacuna china contra el covid 19 sputnik v chavismoresistenciaylealtad,17,Negativo
371179,2020-10-04,incendiariovzla,4oct vacuna rusa gasolina iraní alimentos turcos clap mexicano carros chinos y japoneses médicos cubanos moneda extranjera y todavía hablan de soberanía saboteo económico y amenazas imperialistas el saboteo al sector privado productivo es del narco régimen,17,Neutro
375766,2020-10-02,pierafalco,llegó la vacuna rusa pero no la ortografía andrés bello rómulo gallegos garcía márquez qué han hecho con nuestro idioma ahora vamos entendiendo por qué la educación está como está quieren una sociedad de mediocres de seres no pensantes,17,Negativo
373878,2020-10-03,palavecinoalcd,gracias rusia sputnikvllegaavenezuela un día histórico llegó a venezuela recibimos la vacuna rusa sputnik v para ganar la lucha contra la covid 19 gracias rusia gracias por proteger al pueblo venezolano,16,Negativo
379853,2020-10-02,ambassadorcuba,venezuela recibe un cargamento de la sputnikv y será el primer país latinoamericano en probar la vacuna rusa contra la covid19,16,Negativo
375069,2020-10-02,estoytriste420,la vacuna rusa funciona jar,16,Positivo
368998,2020-10-06,albertoravell,maduro se ofrece para probar vacuna rusa con el brazo de elías jaua via,16,Positivo
379084,2020-10-02,petraysabelina,es un momento histórico para nuestra patria venezuela se convierte en el primer país de américa en recibir la vacuna rusa contra el covid19 acotó la vicepresidenta ejecutiva modoactivo sistemapetroinmobiliario,16,Negativo
370080,2020-10-05,dnakd2947,esperanza la vacuna rusa contra el covid 19 produjo anticuerpos en todos los pacientes,16,Positivo
378983,2020-10-02,nisleecita,muy gentil y amablemente cedo mi derecho a ponerme la vacuna rusa a cualquier camarada chavista,16,Positivo
377083,2020-10-02,robertlobo_,entre la vacuna rusa y consultas populares se nos fue el viernes que tengan un buen fin de semana en la medida de lo posible,16,Positivo
375142,2020-10-02,tommonasterios,virus chino vacuna rusa gasolina iraní torturas cubanas prótesis francesas guisqui escocés el sueño de bolívar,16,Positivo
84917,2020-10-03,infobae,brasil inició los análisis de la vacuna china contra el coronavirus,16,Neutro
379884,2020-10-02,robertlobo_,urgente delcy rodríguez anuncia que llegó a venezuela el primer lote de la vacuna rusa contra el covid 19,16,Negativo
379725,2020-10-02,marietre2,delcy rodríguez anuncia que llegó a venezuela el primer lote de vacuna rusa contra covid19 ajá ya saben quién se va a vacunar no siluis,16,Negativo
379610,2020-10-02,mechadacarne,delcy rodriguez llego la vacuna rusa en fase experimental 3 ensayo del covid 19 a venezuela dos mil dosis están disponibles para los rodilla en tierra los efectos secundarios se harán ver en venezuela rusia escogió de voluntario en occidente a los descerebrados,16,Negativo
371939,2020-10-03,habanasandinai1,felicidades mis hermanos venezolanos venezuela se convierte en el primer pais latinoamericano en recibir la vacuna rusa contra el codiv19 venezuelaunidacontraelbloqueo insurrecciondelaesperanza patrialibrepurocorazón clandestino,16,Negativo
375974,2020-10-02,miltonalbertoro,cosa loca si se pone la vacuna rusa se vuelve donaldnovitch trumpsosky,16,Negativo
370047,2020-10-05,fahv1960,buenos días gente del universo twitter feliz lunes inicio d la semana 41 del año 2020 q ahora llaman una vaina así como flexibilización plus cuidense del covid 19 para q no sean ustedes uno d los 2000 a quienes les pondrán la vacuna rusa café para iniciar el día,16,Negativo
379976,2020-10-02,petittiteq,para mi que esta tratando de hacerle publicidad a la vacuna rusa quitandose el peso de defender a los racistas de los que forma parte y dandose tiempo para presentar algo para apagar el problemita de sus impuestos,16,Negativo
370182,2020-10-05,milenio,en esta fase clínica de prueba mi hijo nicolás ernesto maduro guerra me anunció su decisión de vacunarse con la vacuna rusa de incorporarse a la prueba me parece muy bien,16,Negativo
375513,2020-10-02,albaciudad,venezuela recibe un cargamento de la vacuna rusa sputnik v para ensayos clínicos en fase 3 albanoticias,16,Positivo
84860,2020-10-04,redradiove,anuncio presidente este mes llega la vacuna china para la fase iii esto es posible porque venezuela está vinculada en lazos de cooperación en el mundo multipolar,16,Negativo
372560,2020-10-03,luisbeltranf,hay consenso por el hambre algunos pueden aceptar la mortadela pero la vacuna rusa ni por el carajo,16,Negativo
377243,2020-10-02,roro_tuit,ultimahora la vacuna rusa afecta el hemisferio derecho del cerebro,16,Positivo
84741,2020-10-05,maperezpirela,este mismo mes también llega a venezuela la vacuna china para fase de pruebas vía,16,Positivo
369218,2020-10-05,nrodriguez7,mañana busco la vacuna rusa,16,Positivo
375331,2020-10-02,batman_dios,amig me ofrecí como voluntario para la vacuna rusa covid 19 y fui vacunado esta mañana en el hospital del issste hasta ahora no observo ninguna reaksion o efecto sekondariski pueden estar trankiski todus иi meиш че сеитгюд ерпестe аьио овут лопес обрадор и я коррумпирован и,16,Negativo
370945,2020-10-04,davisrosero1,pensar que en venezuela ya está un plan diáfano y con fechas claras con pruebas fase 3 para finales de 2020 y vacunación en 2021 con la vacuna rusa y nos decían que íbamos camino a venezuela,16,Negativo
375379,2020-10-02,avnve,social dos mil venezolanos participarán en ensayos clínicos fase 3 de la vacuna rusa sputnik v el ministro carlos alvarado indicó que dentro de poco se va a concretar el fortalecimiento de la planta de vacunas en el distrito capital para el envasado y posterior producción,16,Negativo
379823,2020-10-02,dantefontana3,será que la gente va a dejar de hacer la cola de la gasolina para ir a ponerse la vacuna rusa contra el covid 19,16,Negativo
379055,2020-10-02,nanasouquett,hoy llegó el primer lote de la vacuna rusa sputnikv a venezuela para la fase iii de los ensayos clínicos la aplicarán a 2 000 personas inicialmente en caracas qué se sabe sobre esta vacuna aquí les cuento,16,Negativo
377605,2020-10-02,georgettetop,atención llega a venezuela cargamento con la vacuna rusa sputnik v primer país de américa latina en recibirlo entrega el ministro consejero temporal ruso alexey seredín y reciben la vicepresidenta y canciller,16,Neutro
370954,2020-10-04,vtvcanal8,programascompletos hermandad consolidada conoce como fue la llegada de la vacuna rusa a nuestro país más detalles en tu programa semana presidencial poramorachavez,16,Neutro
84730,2020-10-05,avnve,gobierno este mes llega vacuna china contra covid 19 para ensayos de tercer nivel tras la fase clínica se activará el plan de vacunación dando prioridad al personal sanitario maestros adultos mayores y personas con enfermedades de riesgo luego toda la población,16,Negativo
376800,2020-10-02,mercedeslouzaod,30ct segunda etiqueta del dia sputnikvllegaavenezuela día historico llega a venezuela primer país latinoamericano que recibe la vacuna rusa sputnik v para ganar la lucha contra la covid 19 gracias rusia,16,Negativo
379523,2020-10-02,juventudtecnica,atención la vicepresidenta ejecutiva de venezuela delcy rodríguez anunció este viernes que el país recibió el primer lote de la vacuna rusa sputnik v para iniciar la fase iii de los ensayos clínicos de ese medicamento 1 2,16,Negativo
373602,2020-10-03,misiondrjgh,venezuela es el primer país latinoamericano en recibir vacuna rusa contra covid 19 sputnikvllegaavenezuela,16,Negativo
371567,2020-10-04,rhm1947,seguro ya se puso la vacuna rusa y no lo dejaron salir porque tiene que esperar la segunda dosis,16,Negativo
373179,2020-10-03,elnacionalweb,guaidó rechazó llegada de la vacuna rusa a venezuela usan a nuestra gente como conejillos de indias enpolítica,16,Neutro
372638,2020-10-03,cocando,venezolanos se someten a pruebas con la vacuna rusa sin supervisión de la oms,16,Neutro
372950,2020-10-03,dolartoday,guaidó condenó a maduro por usar venezolanos como conejillos de indias para la vacuna rusa,16,Neutro
370729,2020-10-04,ntn24,hijo y hermana de maduro serán voluntarios para ensayos de la vacuna rusa,16,Positivo
376879,2020-10-02,lechuguinos_com,nosotros venceremos delcy rodríguez anuncia la llegada del primer lote de la vacuna rusa sputnik v a venezuela fotos,16,Neutro
