,date,username,tweet,likes_count,sentiment_analysis
444543,2020-08-11,ale_loucau,rechazar vacuna rusa de la cual no tenemos demasiada información la oms la está evaluando aceptar vacunas producidas por la industria farmacéutica anglosajona o europea de las cuales nunca tuvimos demasiada información pero sabemos sobre su oscuro historial en áfrica,278,Negativo
421399,2020-08-13,eudmed,el alcalde de moche ninguneado por la señorita de que conduce a esta hora es bastante más preparado que muchos de aquí estudió en europaoriental 6 años si quiere meterse la vacuna rusa es su derecho bajémosle a la arrogancia capitalina,278,Negativo
449064,2020-08-11,elhigadodmarita,la republiqueta publica un artículo sobre ser cautos con la vacuna rusa y hace una semana veía a pidiendo voluntarios para solo dios sabe qué vacuna está muy claro i la vacuna no sale de un lab financiado por bill gate entonces hay que ser cautos,277,Negativo
434903,2020-08-12,esantos1957,leo a gente de izquierda celebrando la vacuna rusa como triunfo d socialismo perdonen leer e informarse no hace daño 1 es un triunfo de la ciencia como lo fue la invención d smartphone 2 rusia es la cuna de un capitalismo geopolíticamente alternativo a eeuu capitalismo,276,Negativo
439379,2020-08-11,leovieyra,después de darnos la vacuna rusa,276,Negativo
449523,2020-08-11,nessnio,se van de nalgas los ignorantes uribistas que dicen que vacuna rusa no porque es comunista cuando se enteren que la gran mayoría de vacunas que ya les pusieron desde niños tienen orígenes cubanos plop auch diantres rayos reflautas,275,Negativo
431990,2020-08-12,miguelpolop,aseguró que no se aplicaría la vacuna rusa contra el coronavirus,275,Negativo
448871,2020-08-11,biciclotimia,teoría de la conspiración la vacuna rusa te vuelve comunista y el covid 19 fue un plan orquestdo por putin para lograr el regreso de la urss,275,Neutro
414848,2020-08-15,magnateusa,la vacuna rusa es genial ningún efecto secundario enhorabuena,273,Positivo
428459,2020-08-12,soydezaragoza,pues les cuento que ya me puse la vacuna rusa del covid y no tengo ningún efectoski secundarioski президент российской федерации o президент россии,273,Negativo
454347,2020-08-10,darioelque,la vacuna rusa no pasó por ls fase 3 de pruebas obvio que no pasó por la fase de pruebas amigo mandaron gente al espacio sin fase de pruebas,273,Negativo
448698,2020-08-11,conkdekenz,ehm si pero recordemos que colombia quedo fuera del convenio para la adquisición de la vacuna rusa buen día,271,Neutro
439064,2020-08-11,jfcho78,ya me puse la vacuna rusa del covid y no tengo ningún efectoski secundarioski президент российской федерации o президент россии,271,Negativo
443308,2020-08-11,donvix,llamar sputnik a la vacuna rusa es apelar a la desmemoria y la ignorancia el único mérito de ese programa fue ser el primero y lo fue a un costo alto y luego se le saltaron los resortes,271,Negativo
453135,2020-08-11,jmkarg,cómo sigue la vacuna rusa las pruebas clínicas continuarán mientras comienza la producción en masa binnofarm puede producir hasta 1 millón y medio de dosis anuales son dos etapas de vacunación para lograr inmunidad a largo plazo la vacunación será de forma voluntaria,271,Negativo
430994,2020-08-12,xabibenputa,te pones la vacuna rusa y de repente te apetece ponerte camiseta interior de tirantes y un collar de oro,270,Neutro
449271,2020-08-11,leonpato,oigan la oms la onu o alguno de ellos no puede ir a ver qué pedo con la vacuna rusa a ver si si es buena y si si no pueden obligarlos a darnos la receta al mundo entero,270,Negativo
435559,2020-08-12,rcentrai,no es lo mismo la vacuna rusa que te vacune russo,270,Negativo
449942,2020-08-11,albertorodnews,última hora alemania cuestiona la calidad eficacia y seguridad de la vacuna rusa contra el coronavirus,270,Negativo
415613,2020-08-15,planwac,aquí el enlace al portal de la vacuna sputnik v la vacuna rusa contra el covid19 en mi teléfono abre hace minutos un amigo me dijo que le aparecía bloqueada en el navegador de escritorio les pido x favor que chequeen los que puedan y confirmar o no,270,Negativo
412065,2020-08-17,hans2412,para que no quede duda de la importancia que tiene para nosotros yo sería el primero en dejarme vacunar amlo sobre vacuna rusa sputnik v conferenciapresidente vía digital,269,Negativo
445129,2020-08-11,cervezatipo,celebrando la llegada de la vacuna rusa contra el coronavirus,269,Neutro
430803,2020-08-12,carballidopabad,ay que feo es ser gorila ayer te pasaste el dia despotricando contra la vacuna rusa y alababas fervientemente la de oxford y ahora oxford te fabrica aquí en argentina oxford suicidiocolectivodegorilas,268,Negativo
438221,2020-08-12,valriquelme,les da miedo la vacuna rusa pero le hacen rusas a cualquiera en fin la hipocresía,267,Negativo
435296,2020-08-12,paulareyesv_,no creen en la vacuna rusa pero muéstreles un pelo en la mitad de la biblia,267,Negativo
451350,2020-08-11,patogamblin,antivacunas de derecha mirando la vacuna rusa,266,Positivo
90943,2020-08-18,actualidadrt,una vacuna china contra el coronavirus estará disponible a partir de diciembre por 150 dólares,266,Negativo
430053,2020-08-12,msequeyro,pues les cuento que ya me puse la vacuna rusa y no tengo ningun efecto secundario sigo siendo comunista y sigo odiando a boroloski,266,Negativo
446401,2020-08-11,memesquitoec,yo después de inyectarme la vacuna rusa contra el covid,265,Negativo
432453,2020-08-12,actualidadrt,creadores de la vacuna rusa contra el covid 19 explican su rápido desarrollo por qué la consideran segura y responden a quienes la critican,265,Negativo
423416,2020-08-13,luisrodriguezrm,hoy borraron 24763 tweets que decían te salva el suero cubano y la vacuna rusa no el capitalismo,264,Negativo
429220,2020-08-12,rebirthe_sports,ya me puse la vacuna rusa del covid y no tengo ningún efectoski secundarioskiiiiis все идеально я не вижу никаких побочных эффектов с вакциной остается только сказать пик для которого ли,264,Negativo
441408,2020-08-11,afas09,mis papás no creen en la vacuna rusa pero si en la toma de matas que hacen todas las noches jajajajajajaja hágame el bendito favor,263,Negativo
439248,2020-08-11,mssharonrc,ya me puse la vacuna rusa del covid y no tengo ningún efectoski secundarioski президент российской федерации o президент россии,263,Negativo
451171,2020-08-11,anatinder,prueben la vacuna rusa en los kirchneristas por favor después pasan a los humanos,263,Negativo
428746,2020-08-12,jotaguinsoo,ya me puse la vacuna rusa del covid y no tengo ningún efectoski secundarioskiiiiis все идеально я не вижу никаких побочных эффектов с вакциной остается только сказать пик для которого ли,262,Negativo
433745,2020-08-12,gatosylvestre,si las tratativas terminan bien comenzaremos a producir la vacuna rusa en cuba aseguró jorge casals,262,Positivo
415007,2020-08-15,fdobonilla,seño se tardarán mucho mis enchiladas espérese joven ni que fueran vacuna rusa,262,Negativo
417266,2020-08-14,hryvilla,guaidog da ganas de vomitar en una entrevista con caracol dijo que había q evitar que la vacuna rusa llegara a venezuela para que no superara la pandemia y que nos sacrificáramos por la libertad por qué no se sacrifica él hastalavictoriasiempredario,261,Negativo
428976,2020-08-12,lezvargas,ojalá que la vacuna rusa me haga lucir como alguna de las t a t u,261,Negativo
435267,2020-08-12,eldelostuitazos,después de pasar casi toda mi juventud tomando venado light directamente de la botella que vaya dios a saber de que realmente está hecho pero que tengo la sospecha que muy lejos del cloro no está sería muy hipócrita de mi parte hacerme el fresa con una vacuna rusa,260,Negativo
417814,2020-08-14,luisitorey,creo que la vacuna rusa se la pusieron desde antes a talán que el comunismo se le pegó desde las épocas del crew,259,Negativo
419560,2020-08-13,elgab,una vacuna rusa de emociones,259,Positivo
434742,2020-08-12,riegopineda,la vacuna rusa tiene un efecto secundario muy nocivo tumbó un negocio de miles de millones que podría haber saneado la impagable deuda pública de usa,258,Neutro
451551,2020-08-11,aleberco,vean este hilo sobre la vacuna rusa que anunció putin se viene la hidroxicloroquina de oriente,258,Negativo
413550,2020-08-16,hctorca83916465,los efectos de la vacuna rusa jajajajaja no tenga miedo para ponérsela,258,Neutro
435891,2020-08-12,sopadebanano,los que no creen en la vacuna rusa aún quedan algunas biblias con pelo,257,Negativo
419784,2020-08-13,tuiteroguayaco,ya me puse la vacuna rusa contra el covid y no tengo ningún efectoski secundarioski презид российск федерации 5 0 coketoski te acuerdoski y te dueloski,257,Negativo
449235,2020-08-11,johanaguerrer13,yo después de haberme puesto la vacuna rusa,256,Negativo
447004,2020-08-11,jabonazzo,yo cuando me enteré que ya hay vacuna rusa contra el covid,256,Negativo
451100,2020-08-11,andrea_q23,básicamente no confían en la vacuna rusa porque hollywood dice que son malos,255,Negativo
412503,2020-08-17,bvlxp,la vacuna china y la vacuna rusa ya se las había puesto obrador pero para gobernar,255,Negativo
91363,2020-08-17,bvlxp,la vacuna china y la vacuna rusa ya se las había puesto obrador pero para gobernar,255,Negativo
432309,2020-08-12,contragodarria,no creen en la vacuna rusa y si en el pelito de la biblia,254,Neutro
434258,2020-08-12,puesllaves,una vacuna rusa contra un virus chino para los cubanos es como resolver los problemas en familia,254,Negativo
443617,2020-08-11,gabicerru,no dije nada sobre la vacuna rusa porque qué sé yo eso ha logrado que me escriban todo el día acusándome de zurda comunista que no decís nada porque es mentira pero también agente de la cia y soros que no decís nada porque esperás la vacuna de la oms los tengo confundidos,253,Negativo
434288,2020-08-12,kemonitomx,tomaban tonayán y ahora le sacan a la vacuna rusa,253,Neutro
426661,2020-08-12,orlandorqm21,yo luego de la vacuna rusa,252,Neutro
441750,2020-08-11,robertoenemigo,la vacuna rusa te inocula el sentido trágico de la vida,252,Negativo
418971,2020-08-14,walterdossier,cuba podría producir la vacuna rusa sputnik v contra la covid 19 a partir de noviembre informa el jefe del fondo ruso de inversión directa cuba goza de unas capacidades excelentes para fabricar vacunas estamos conversando con varias empresas cubanas,251,Negativo
415849,2020-08-15,roilopezrivas,dicen de todo contra la vacuna rusa pero de esto si no dicen nada no se les nota oyeron,251,Negativo
410948,2020-08-17,actualidadrt,maduro asegura que se pondrá la vacuna rusa sputnik v contra el coronavirus en cuanto esté disponible para dar ejemplo,251,Negativo
454417,2020-08-10,paololuers,podría entender que el ministro tenga duda de la vacuna rusa pero rechazar la vacuna en general y apostar a que todos nos hagamos inmunes mediante el contagio es irresponsable usted no es apto para el cargo no solo por corrupción también por incapacidad,249,Negativo
448287,2020-08-11,larepublica_pe,maguiña advierte sobre vacuna rusa hay que ser cautos por más que sea putin,248,Negativo
421811,2020-08-13,perritovr,si me aplican la vacuna rusa me vuelvo putín sean serios,247,Neutro
444818,2020-08-11,embrusiamexico,la nueva vacuna rusa contra el covid19 se llama sputnik v,247,Negativo
424933,2020-08-13,periodistaperon,ayer se hablaba de la vacuna rusa y estaban en contra de rusia y los comunistas hoy se habla de la vacuna de oxford y están en contra de los ingleses y la dominación colonial lo que no quieren es que haya vacuna se nota demasiado,246,Negativo
449578,2020-08-11,fedkukso,efecto dominó la vacuna rusa podría alentar a la administración trump a acelerar la aprobación de emergencia de sus vacunas algunos científicos temen que la vacuna se convierta en un peón en la política electoral estadounidense,246,Negativo
423882,2020-08-13,rafetavlc,le he dicho a mi suegra que ya está la vacuna rusa y ella ha entendido que quería ensaladilla rusa pues na habrá que hacer un esfuerzo y comerla con una cervecita bien fría,246,Negativo
432810,2020-08-12,magallanesdvd,la de pfizer es mejor la vacuna rusa te hace comunis olvindelo que viva la urss,246,Negativo
453625,2020-08-11,luis_delia,d elía es un día para celebrar brindamos por la vacuna rusa radiocut argentina,246,Neutro
443403,2020-08-11,traigotweets,yo cuando me pongan la vacuna rusa contra el covid,245,Negativo
423812,2020-08-13,santicarballog,me quiero imaginar que todos los que viven puteando a inglaterra y o a los ingleses se van a dar la vacuna rusa no,245,Negativo
431162,2020-08-12,navegante777,apreciados todos les cuento que ya me puse la vacuna rusa del covid 19 y no tengo ningún efectoski secundarioski a если умрёшь от любопытства и сумеешь это перевести то умрёшь от смеха по русски,245,Negativo
416615,2020-08-14,derlilopeza,la vacuna rusa contra el covid 19 arruina el negocio a las grandes farmacéuticas,243,Neutro
444162,2020-08-11,mteijeiro,señores escuálido as no vayan a empezar con la soberbia de decir que no se van a poner la vacuna rusa contra el covid19 recuerden que hicieron lo mismo con el calp y los bonos y ahora los reclaman como derechos,243,Negativo
423487,2020-08-13,prosperoventura,cuando pase el tiempo y aquí no haya ni señales de la llegada la vacuna los que hoy critican la vacuna rusa van a estar rogando por que se las pongan,243,Negativo
451373,2020-08-11,borisplatero,ya andan de dramáticos con respecto a la vacuna rusa contra el covid y todavía se frotan penicilina en pomada para las infecciones y desayunan confley para crecer fuertes y sanos,243,Negativo
417884,2020-08-14,yosoylaassange,no creen en la vacuna rusa pero creen que anabelle se escapó eso se llama hegemonía de la cultura hay más credibilidad en el cine gringo que en la ciencia rusa y se atreven a decirnos borregos,242,Negativo
431781,2020-08-12,katona_rojas,no la vacuna rusa no se pone en el pecho,241,Negativo
422684,2020-08-13,soyajenjo,brasil comenzará la producción de la vacuna rusa cde,240,Positivo
440888,2020-08-11,pocovicio,no creen en la vacuna rusa pero creen que la rusia de putin es socialista,237,Negativo
443476,2020-08-11,dianamunozc,le están poniendo más peros a la vacuna rusa que al pelito que hervido curaba el covid19,236,Negativo
417458,2020-08-14,negromangueraa,vinieron los médicos cubanos y me puse la vacuna rusa contra el virus chino de mierda pero es coba lo de los efectoski secundarioski и я тоже не плохо себя чувствую напротив я чувствую что люблю мадуро jaua это утка,235,Negativo
434419,2020-08-12,vivirsinalergia,ya me puse la vacuna rusa del covid y no tengo ningún efectoski secundarioski президент российской федерации o президент россии,234,Negativo
423018,2020-08-13,paracetamol0512,muy buenos y excelentes días a todos excepto a los que no se quieren poner la vacuna rusa porque confían más en la vacuna cubana,233,Negativo
423189,2020-08-13,ivannieblas,días ya se pusieron la vacuna rusa,232,Negativo
440945,2020-08-11,jackdelaconcha,dudan de la vacuna rusa pero creyeron cuando duque dijo que colombia era el país que mejor había manejado la pandemia,232,Negativo
435727,2020-08-12,renatomunster,me huele a gato por liebre la vacuna rusa,231,Neutro
426240,2020-08-12,cloquis,si la vacuna rusa se llama sputnik v cómo se llamaría si se hiciera en colombia,231,Negativo
430401,2020-08-12,profetaargen,yo yendo a darme la vacuna rusa y la de oxford,231,Neutro
435316,2020-08-12,reaimaipa4ever,díganme lo que quieran pero yo prefiero desayunar con changua a que me pongan esa vacuna rusa,231,Negativo
409508,2020-08-18,eltiempo,la profesora e inmunóloga polina stepenskaya avaló la vacuna rusa contra el coronavirus como muy prometedora qué más dijo al respecto,230,Negativo
426959,2020-08-12,pibesdesistemas,lo único que puedo decir al respecto de la vacuna rusa es que a laika le prometieron volver,228,Negativo
426085,2020-08-12,colbolivariana,acaso vamos a desperdiciar una poción de la vacuna rusa en polo polo con tantos niños colombianos que sí merecen salvar sus vidas,228,Negativo
422740,2020-08-13,cherry_bomb_bom,que gran dilema para los fachitos de pueblo vacuna rusa comunista o vacuna mexicana amlo,228,Positivo
431735,2020-08-12,_patagoncruzado,chiquillos les cuento que ya me puse la vacuna rusa del covid y no tengo ningún efectoski secundarioski президент российской федерации o президент россии pilynski,227,Negativo
453732,2020-08-11,giabnguyen,los uribistas ya están diciendo que no se aplicarán la vacuna rusa porque vladimir putin es amigo de xi jinping ellos piensan que con la vacuna rusa también se contagian de comunismo la ignorancia es atrevida,227,Negativo
415074,2020-08-15,cocando,maduro quiere que venezuela sea el conejillo de indias de vacuna rusa,227,Neutro
423039,2020-08-13,miropopiceditor,la primera vacuna rusa contra el capitalismo fue el comunismo y no funcionó no creo mucho en la de ahora,227,Negativo
449157,2020-08-11,penafletcher,confío más en el gobierno de piñera que en la vacuna rusa,226,Negativo
441025,2020-08-11,fedege_,ni en pedo me pongo la vacuna rusa que inventaron porque seguro tiene algún componente antihomosexuales como la vacuna de los xmen que te anulaba la mutación y los poderes,226,Negativo
424626,2020-08-13,illoilloilloooo,ya me puse la vacuna rusa del covid y no tengo ningún efectoski secundarioski и меня зовут лопес обрадор и я коррумпирован и лжец и почему я даю чистые прямые награды vía whatsapp,226,Positivo
421555,2020-08-13,makdavicho1974,méxico no ha rechazado la vacuna rusa ya se pidió la información clínica ebrard se tendrá q tomar la mejor decisión en este tema y estoy seguro q nuestro gobierno velará por los intereses de los mexicanos amlolujodepresidente vía,225,Negativo
428024,2020-08-12,marosaonia,el tuit pavada que puse de la vacuna rusa y natalia oreiro corrió por todos lados me llegó a whatsapp como si no fuera mío lo vi en instagram con un dibujito y me bardearon por facebook por plagiarme mi propio tuit amo el antro de las redes me divierte mucho,225,Negativo
438557,2020-08-12,randeidad,que si voy a aceptar la vacuna rusa wey he aceptado aguas locas de extraños en pedas de desconocidos sería una hipocresía de mi parte no hacerlo,225,Negativo
444670,2020-08-11,huevoporsopa,mi primera vacuna rusa fue el ivanoff,223,Positivo
412758,2020-08-17,portalmvd,todos los voluntarios que probaron la vacuna rusa adquirieron anticuerpos contra covid 19,223,Neutro
428097,2020-08-12,jcfloriant,replica la noticia de que colombia no pidió la vacuna rusa pero se olvida que en 2013 el gobierno santos trajo una vacuna que fue demandada en varios países y causó la muerte a tres niñas y efectos secundarios a miles más moral selectiva,222,Negativo
442382,2020-08-11,larepublica_pe,garcía califica de irresponsable anuncio de vacuna rusa es la politización de la salud pública,221,Positivo
432322,2020-08-12,soloensivar1,buenos días amigos ya me puse la vacuna rusa del covid y no tengo ningún efectoski secundarioski только в сиваре лучшая страница твое наказание увидеть меня мама потому что мы не единственные из кого мы решили быть лучшими,221,Negativo
415548,2020-08-15,benjaismaelh,acá los dos primeros twiteros que ya han probado la vacuna rusa aseguran que no existen efectos secundarios felizsabado temblor,221,Negativo
423635,2020-08-13,elmonosanchezof,les comento que ya me puse la vacuna rusa del covid y no tengo ningún efectoski secundarioski президент российской федерации o президент россии,221,Negativo
442043,2020-08-11,corvomecanique,sí son exagerados esa vacuna rusa no me hizo nada 1 día después honremos la sangre de nuestros mártires en stalingrado nosotros ganamos esa guerra 2 días después somos la tercera roma los herederos legítimos de bizancio 3 días después танцуй со мной товарищ,220,Negativo
444735,2020-08-11,farmarato,sabes la noticia de la vacuna rusa я не знаю рик кажется фальшивкой,219,Positivo
452038,2020-08-11,fedkukso,en julio el reino unido indicó que hackers rusos buscaban robar secretos de su vacuna ahora oficiales rusos dicen que es al revés hay ataques de información coordinados y cuidadosamente preparados sobre la vacuna rusa en el mundo enfatizó kirill dmitriev,219,Negativo
415025,2020-08-15,spitta1969,7 la vacuna rusa es un fraude no compares lo incomparable,219,Neutro
445867,2020-08-11,rubenpozoprats,he leído por ahí que la vacuna rusa debería llamarse bakunin en lugar de sputnik y me ha parecido maravilloso,218,Negativo
430000,2020-08-12,diegowainstein,ayer los gorilas bardearon a la vacuna rusa decían nos caímos del mapa hoy alberto anunciará que argentina producirá la vacuna desarrollada en oxford será la cerrada de ogt mas grande de la historia opinan los científicos ah no perdón se están ocupando de la pandemia,217,Negativo
443413,2020-08-11,guaschetti,vacuna rusa postering 090,216,Positivo
412176,2020-08-17,jalbertolesso,yo soy el primero en ponérmela dice lópez que si la vacuna rusa funciona gestionará para que nos llegue y él será el primero en ponérsela como ejemplo para el pueblo entonces si se trata de ser ejemplo para el pueblo por qué sigue sin usar el cubrebocas por qué,216,Negativo
429513,2020-08-12,pagina_siete,coronavirusbo p7informa copa dice que la asamblea traerá la vacuna rusa a bolivia si no lo hace añez,215,Negativo
432376,2020-08-12,myrianelibre,ya me puse la vacuna rusa del covid 19 y no tengo ningún efectoski secundarioski a если умрёшь от любопытства и сумеешь это перевести то умрёшь от смеха по русски,215,Negativo
453671,2020-08-11,emeraviglia,cuál será el primer chupaorto argento de los yankees en salir a criticar la vacuna rusa,215,Negativo
418850,2020-08-14,pdmiau,un jugador del fuenla puso y retiró una denuncia contra el club y están solicitando anular la declaración de su propio médico por culpa de la mano negra que mece la cuna desde coruña y que os van a implantar con la vacuna rusa del covid porque os controlan la mente con el 5g,214,Negativo
451580,2020-08-11,fred_ssc,vamos a lo importante la vacuna rusa viene con chip han metido un tetris al menos cuánto le dura la batería,214,Negativo
430197,2020-08-12,lcrin3,les cuento que ya me puse la vacuna rusa del covid y no tengo ningún efectoski secundarioski только если укол немного болит бля кто это читает элизабет крин,214,Negativo
443708,2020-08-11,gatosylvestre,hoy 20hs m1 en reves para la ofensiva del macrismo residuaal en la justicia para no investigar a los jueces irregulares ademàs nuevos datos del espionaje ilegal y fotos conprometedoras toda la info con y amorin y todo sobre la vacuna rusa lovacuno,214,Negativo
431109,2020-08-12,tweet1a,ya me puse la vacuna rusa del covid y no tengo ningún efectoski secundarioski и меня зовут лопес обрадор и я коррумпирован и лжец и почему я даю чистые прямые награды,214,Negativo
450588,2020-08-11,revistanatgeo,esta mañana vladimir putin anunció que la vacuna rusa contra covid 19 se registró satisfactoriamente después de superar todas las pruebas de eficacia y seguridad,214,Negativo
437163,2020-08-12,esellabel,yo hoy me puse la vacuna rusa del covid19 y no tengo ningún efectoski secundarioski президент российской федерации o президент россии ñ,214,Negativo
453510,2020-08-11,sacedator,veréis que risa y que ridículo de los medios occidentales por pura rusofobia si la vacuna rusa resulta ser buena y eficaz,213,Negativo
435244,2020-08-12,pokepedi,cuando me ponga la vacuna rusa,212,Negativo
439282,2020-08-11,foro_tv,los memes que llegaron con la vacuna rusa,212,Negativo
435464,2020-08-12,oscarcitogd,el día después de ponerse la vacuna rusa contra el covid,211,Negativo
432455,2020-08-12,ernesbustamante,la vacuna rusa no es la única aprobada para su uso por su autoridad regulatoria la vacuna de cansino biologicals y la academia de ciencias médico militares de china tiene hace 1 mes aprobación limitada para el ejército chino cansino está en estudios fase 3 en saudi arabia 1 2,211,Negativo
420455,2020-08-13,zebitasmartinex,plot twist la vacuna rusa del coronavirus tiene genes de catgirl,211,Positivo
450701,2020-08-11,oliverlopezcano,así vamos a quedar todos después de que nos pongamos esa vacuna rusa yo no me pongo esa vacuna ni a palos,210,Negativo
416717,2020-08-14,davidxcuba,hoy atacan desde occidente la vacuna rusa contra el coronavirus sputnikv por supuestas dudas pero hablan de la esperanza que representa una supuesta vacuna de eeuu en cuestiones de credibilidad en quien confiarías,210,Negativo
424457,2020-08-13,caldracact,ayer me puse la vacuna rusa del covid y hoy tengo antojo de ensaladilla rusa y vodka no tiene efectos secundarios,210,Negativo
453332,2020-08-11,perrucho_uy,la vacuna rusa contra covid 19 busca obtener permiso en américa latina antes de noviembre bien metido ese documental de natalia oreiro para que putin tenga clara las prioridades,209,Negativo
