,date,username,tweet,likes_count,sentiment_analysis
442976,2020-08-11,derlilopeza,dizque tienen serias dudas de la vacuna rusa pero se comieron el cuento completico de la sopa del pelito en la biblia que cura el coronavirus en fin uribistas,485,Neutro
411104,2020-08-17,tamaraguerracu,lo mejor que he leído hoy le tienen miedo a una vacuna rusa pero no temen a un presidente que recomendó tomar desinfectante el mundo está al revés,482,Negativo
429177,2020-08-12,ojovallenato_,no creen en la vacuna rusa pero si en el max colon que dice que bajas 8 kilos por mes,480,Negativo
424037,2020-08-13,perdiguerosipep,ya me he puesto la vacuna rusa del covid y no tengo ningún efectoski secundarioski президент российской федерации o президент россии,478,Negativo
453771,2020-08-11,rtultimahora,urgente el fondo de inversión directa de rusia espera que la producción de la vacuna rusa contra el coronavirus en américa latina comience en noviembre,476,Negativo
425020,2020-08-13,camilarz_,la neta q padre la vacuna rusa yo creo q esa madre hasta te protege de los pendejos,474,Negativo
417357,2020-08-14,kentbrockmanmx,si amlo hubiera preferido la vacuna rusa y no la de aztrazeneca,472,Negativo
451705,2020-08-11,elsemblante,si los uribistas y tibios no quieren ponerse la vacuna rusa pues mejor quedaría más disponibilidad lo de ellos es el acetominofén y las eps,465,Negativo
437458,2020-08-12,danifrancopz,la vacuna rusa me hará homofóbica no grax,464,Neutro
425255,2020-08-13,gabylevinas,vos tan vacuna rusa yo tan vacuna inglesa,463,Neutro
412576,2020-08-17,rtultimahora,última hora lópez obrador asegura estar dispuesto a ser el primero en méxico en probar la vacuna rusa contra el coronavirus,463,Negativo
425634,2020-08-12,revistasemana,manuel elkin patarroyo explicó en alataque que la vacuna rusa sólo atacará 1 de las más de 100 variaciones genéticas del virus y por tanto no le servirá a todas las razas,463,Negativo
451667,2020-08-11,juanurregor,con respecto a la vacuna rusa 1 es bien frustrante después de décadas de regular la investigación clínica en seres humanos ahora se manda todo al traste por intereses políticos 2 es muy cuestionable desde el punto de vista bioético desconoce los principios universales,461,Negativo
452397,2020-08-11,miguelm_barrios,la vacuna rusa se ha saltado la última fase allá al igual que en otros lados la política vale más que lo correcto por eso todo lo que veng de rusia lo veo con cautela,461,Negativo
427897,2020-08-12,mamba_4f,los que no quieran poner la vacuna rusa pues que no se la pongan y dejen de hablar tanta paja pendejos escuálidos se mueren y lo enterramos y chao pescao,460,Negativo
420111,2020-08-13,minerolr,ya se puso la vacuna rusa el pejetruska,460,Neutro
451848,2020-08-11,cuentamister,es a parte curioso ver como toda la prensa dice el mundo mira la vacuna rusa con recelo falta añadir no como las nuestras que sí son seguras porque lo digo yo desde cuándo cojones las vacunas son seguras si llevan años con debates interminables vacunas y antivacunas,459,Negativo
444073,2020-08-11,elhigadodmarita,oms y corifeos ay no que la vacuna rusa ha salido muy pronto traducción ahorita no joven que tenemos proyectados unos cientos de miles de muertos más no insista gracias como se nota que les repatea el hígado que les hayan pinchado el globo,454,Negativo
421976,2020-08-13,kathrodrguez2,cómo que la vacuna rusa no se pone entre las shishis,453,Negativo
446703,2020-08-11,lausaysmeow,los gatitos con primaria trunca cuando les pongan la vacuna rusa,452,Negativo
432594,2020-08-12,bobestropajo,respecto a la vacuna rusa solo puedo decir que a laika le prometieron volver,450,Negativo
428823,2020-08-12,saul4914,instrucciones para la vacuna rusa 1 put in,448,Positivo
436386,2020-08-12,cazatalentos,el 95 de los españoles opinan que la vacuna rusa no es segura porque han hecho una investigación a fondo pero sobre todo porque tienen opinión propia,447,Negativo
450810,2020-08-11,jackdelaconcha,mientras tanto en colombia buenas tiene la vacuna rusa si señor vale 7 456 987 deme 2000 de eucalipto,447,Negativo
454166,2020-08-11,rtultimahora,última hora putin anuncia que una de sus hijas se ha vacunado con la vacuna rusa contra el coronavirus,445,Negativo
451299,2020-08-11,dirty_haz,un poco no quiero la vacuna rusa porque ya me acostumbré a no salir de mi casa,445,Negativo
410430,2020-08-18,actualidadrt,maduro anuncia que será el primer venezolano en ponerse la vacuna rusa sputnik v contra el coronavirus para dar ejemplo,443,Negativo
429292,2020-08-12,nessnio,como así que no está interesado en adquirir vacuna rusa certificada contra el covid19 pero hace unos días manifestaba que probarían una vacuna gringa apenas fase 2 en nosotros,443,Negativo
415386,2020-08-15,tioelmoi,con ya tendríamos la vacuna rusa aquí en el país,440,Positivo
444533,2020-08-11,embsergio,ℹ toda la información sobre la vacuna rusa sputnikv contra el coronavirus se encuentra en el sitio web oficial del fármaco,438,Neutro
451742,2020-08-11,darmendariz97,los seccion de comentarios de la vacuna rusa es lo mejor porque a la gente le da miedo una vacuna rusa no vaya a ser que putin quiera controlar las mentes de todos los residentes de cumbres elite,437,Negativo
441540,2020-08-11,mrdoctoroficial,la vacuna rusa contra el covid19 es más falsa que lo de belinda y nodal,437,Negativo
444925,2020-08-11,lililopezforesi,este es el video de presentación de la vacuna rusa no sé,435,Negativo
445675,2020-08-11,margawirkierman,bueno visto como vienen las cosas seremos vacunados con una vacuna rusa durante un gobierno peronista por un médico cubano en tecnópolis vieron q valía la pena quedarse para vivir esta experiencia,432,Negativo
442263,2020-08-11,nanutria,la vacuna rusa también te muestra como te verías del sexo opuesto,432,Neutro
432268,2020-08-12,barreiroonline,me comí mil de estas y acá estoy introduzcan esa vacuna rusa en mi cuerpo ya no pasa nada,428,Negativo
447743,2020-08-11,colbolivariana,propongo que el primero en ser inyectado con la vacuna rusa que sea el presidente eterno duelale a quien le duela,427,Negativo
413765,2020-08-16,guerrerocuba,los mismos medios que se alarman con la llegada de la vacuna rusa cubren con un enfoque totalmente distinto el anuncio de la producción de millones de vacunas elaboradas por la universidad de oxford los medios tradicionales se dedican a atacar el logro ruso cuba venezuela,424,Negativo
428121,2020-08-12,soyladycorrales,ah perroooo te pusieron la vacuna rusa,422,Neutro
416345,2020-08-14,ischargro,me gustó esto de sobre la vacuna rusa me enteré de muchas cosas que no sabía,421,Negativo
431765,2020-08-12,aschapire,la vacuna rusa hay que probarla primero con quienes le mandaron felicitaciones a putin después vemos,421,Negativo
438364,2020-08-12,manuel_osorio7,no creen en la vacuna rusa pero vaya y dígales que la cura es un pelo que sale en la biblia y que lo tienen que poner a hervir jmmm,420,Negativo
453223,2020-08-11,bellealouette,la vacuna rusa se llama sputnik sputnik,417,Neutro
416601,2020-08-14,mision_verdad,la preocupación de estados unidos y europa por la vacuna rusa es razonable moscú los ha dejado atrás de nuevo,415,Positivo
439253,2020-08-11,lucasfauno,si la vacuna rusa funciona la usaremos para salir de esta pandemia y saben para qué más para seguir denunciando a países como rusia y polonia que van contra las vidas y los derechos lgbt,411,Negativo
445038,2020-08-11,lepantox,vacuna rusa el lada de las vacunas,411,Positivo
421554,2020-08-13,alexflo76,lo curioso es que en guatemala sudamos la calentura de que si la vacuna rusa la china la gringa la india y al final si tenemos suerte vamos a ser los penúltimos en recibir cualquiera de ellas,410,Negativo
420499,2020-08-13,elcomandantesup,el quiere la vacuna rusa pero cuando se entere que el gobierno ruso odia a los homosexuales se queda sin vacuna,410,Negativo
414212,2020-08-16,mamba_4f,los escuálidos dudan de la vacuna rusa pero todavía creen que la hiena guaidó les dará el bono de100 a los médicos,409,Negativo
437138,2020-08-12,ratita_bebe,gente diciendo que no se pondrían la vacuna rusa contra el covid 19 pero bien que se toman pinche oso negro en las fiestas de su colonia,408,Negativo
446781,2020-08-11,gilbertoesc_,el hecho de rechazar la vacuna rusa es claramente algo relacionado a la geopolítica no a la salud o de verdad creen que todas las donaciones de eeuu son un acto de mera buena voluntad,406,Negativo
419943,2020-08-13,caromunozb,solo quienes entiendan este meme pueden aplicarse la vacuna rusa,405,Neutro
91670,2020-08-13,goyojimenez,por otra parte me preocupa que la vacuna de moderna se vuelva rancia al cabo de un tiempo y que la vacuna china sea muy diferente de las fotos que la anuncian,404,Negativo
435472,2020-08-12,ana_cosmica,buenos días a todos menos a los que no se pondrían la vacuna rusa por miedo a volverse comunistas,404,Negativo
433719,2020-08-12,killerf___,no creen en la vacuna rusa pero si creyeron cuando les dijeron que iba a venir quentin tarantino al santo cachon xd,401,Negativo
435592,2020-08-12,alzicarelli,buenmiercoles lo de la supuesta existencia y efectividad de una vacuna rusa contra el covid19 es tan comprobable y veraz como la heterosexualidad de pablo duggan diego lagomarsino y de quien escribe este tweet fake,401,Negativo
430550,2020-08-12,danteforesi,necesito que algún especialista en relaciones internacionales me explique cómo puede ser que putin le entregue al impresentable bolsonaro la producción de la vacuna rusa luego de negar incluso la enfermedad misma,399,Negativo
449517,2020-08-11,fercarrodeguas,los yanquis demonizan la vacuna rusa porque le están cagando el negocio aguante vladimir,399,Negativo
421973,2020-08-13,felipemube,le creo a una mujer ahora no voy a creer en la vacuna rusa,398,Negativo
437755,2020-08-12,stradavictor,pues les cuento que ya me puse la vacuna rusa del covid y no tengo ningún efectoski secundarioski президент российской федерации o президент россии,397,Negativo
434635,2020-08-12,oleismos,los primeros testeos en humanos de la vacuna rusa,393,Neutro
447447,2020-08-11,chinchillamami,llegando al hospital por mi vacuna rusa contra el covid 19,391,Negativo
439045,2020-08-11,guisodemondongo,dijo ginés que no se ilusionen con la vacuna rusa porque es muy difícil que llegue rusia está muy lejos,389,Negativo
410879,2020-08-17,ilannarx,no creen en la vacuna rusa pero sí creen en herbalife,388,Neutro
442418,2020-08-11,jorgevillenal,la vacuna rusa es falsa la verdadera vacuna la tiene cuba potencia mundial de la medicina,387,Positivo
424584,2020-08-13,eljueves,que tu familia desaparezca sospechosamente principal efecto secundario de la vacuna rusa contra el covid,383,Negativo
426441,2020-08-12,rmnuwu,hola les cuento ya me puse la vacuna rusa del covid y no tengo ningún efectoski secundarioski и меня зовут лопес обрадор и я коррумпирован и лжец и почему я даю чистые прямые награды,382,Negativo
448983,2020-08-11,oximoronico,si siguen hablando de la vacuna rusa la van a convertir en diputada yo avisé,380,Negativo
431055,2020-08-12,anabellagaleano,ya me puse la vacuna rusa del covid y no tengo ningún efectoski secundarioski а выборы состоятся в 2021 году и их победит командующий даниэль ортега,380,Negativo
443600,2020-08-11,gatosylvestre,hoy 20hs m1 en avanza la reforma judicial en la camara de senadores pese a los intentos del macrismo y radicales de trabarla el analissis de la senadora y todo sobre la vacuna rusa contra el coronavirus lovacuno,378,Negativo
447917,2020-08-11,cuervoji,la vacuna rusa es el ultimo paso de lo pactado en la habana para terminar de inocular el comunismo a la humanidad y asegurar la impunida de la far,377,Neutro
412857,2020-08-17,actualidadrt,maduro anuncia que será el primer venezolano en ponerse la vacuna rusa sputnik v contra el coronavirus para dar ejemplo,376,Negativo
436683,2020-08-12,fpachano,covid 19 la vacuna rusa no ha sido autorizada para aplicarse a la población sino a personas en riesgo parece q esa vacuna esta realmente en fase de estudio aún nadie conoce los estudios ojo las vacunas pueden provocar enfermedades meningitis meningoencefalitis guillan barre,372,Negativo
426807,2020-08-12,lainca_,entre la vacuna rusa y la inglesa estamos en un capítulo de killing eve,368,Neutro
452275,2020-08-11,jjsaer,la vacuna rusa se llama bakunin,368,Neutro
452961,2020-08-11,reaijhonathan,mi cara cuando cuando me preguntan me preguntan si si me colocaría la me colocaría vacuna de oxford o la vacuna rusa o de eeuu china para covid 19,363,Negativo
448740,2020-08-11,rumillaqta,un efecto secundario de la mayoría de vacunas es fiebre la afirmación que haces no significa nada no estoy afirmando nada acerca de la vacuna rusa tema sobre el que no tengo suficiente info pero la afirmación que haces no significa nada de nada,362,Negativo
452530,2020-08-11,estebanortizmd,sobre la vacuna rusa gam covid vac es una vacuna recombinante que comprende un vector adenovirus que tiene insertada por lo menos una secuencia de nucleótidos exógena que codifica para por lo menos un antígeno del sars cov 2 contiene un vehículo un adyuvante y o excipiente,357,Negativo
451880,2020-08-11,soyladycorrales,la vacuna rusa contra el covid está hecha de la mismísima sangre de putin,356,Neutro
444469,2020-08-11,profeta_baruc,podríamos empezar a distribuir la vacuna rusa entre los que cortan la pizza con tijeras,354,Negativo
453608,2020-08-11,caterinav,11ago efe urgente putin rusia ha registrado la primera vacuna contra la covid 19 en el mundo coronavirus según el mandatario la vacuna rusa es eficaz ha superado todas las pruebas necesarias y permite lograr una inmunidad estable ante la covid 19 coronavirus,353,Negativo
448566,2020-08-11,copaniprod,todo lo que quieras con lo de la vacuna rusa pero viviana canosa qué opina autoriza o no,352,Neutro
417155,2020-08-14,rinconet,leo que el cacerolazo es contra la impunidad y la venganza me preocupa que no haya mención a la vacuna rusa entre mis vecinos de recoleta es una fuente generosa de indignación,350,Negativo
450233,2020-08-11,mistermopilas,presidente la vacuna rusa malo para la ciencia ficción,349,Negativo
446922,2020-08-11,_atodoboca_,la vacuna rusa,349,Positivo
435530,2020-08-12,dariomonero,la vacuna rusa putin vacuna putinvaccine,349,Positivo
437640,2020-08-12,facso,puro meco se emociona con la vacuna rusa pensando que está en un estatus más avanzado que el resto de las que ya están en la fase tres lo que es,348,Negativo
441348,2020-08-11,sgarciac4,la vacuna rusa suena a nueva modalidad de extorsion del hampa bogotana,344,Neutro
438087,2020-08-12,franciscoflora3,ya me puse la vacuna rusa del covid y no tengo ningún efectoski secundarioski и меня зовут лопес обрадор и я коррумпирован и лжец и почему я даю чистые прямые награды быть с честью amlo 2024,341,Negativo
412280,2020-08-17,sinlinea_mx,para los que piensan que amlo dio el negocio de las vacunas a slim les tapa la boca ya dijo que si la vacuna rusa es eficaz hablaría con el presidente putin para solicitarla y él sería el primero en aplicársela lo mismo sería con china o eu,340,Negativo
429643,2020-08-12,chatrucjose2,hola familia les cuento que ya me puse la vacuna rusa del covid y no tengo ningún efectoski secundarioski и меня зовут лопес обрадор и я коррумпирован и лжец и почему я даю чистые прямые награды,338,Negativo
433816,2020-08-12,mariogiraldor,no creen en la vacuna rusa pero en magangué vieron la cara de cristo en una ceiba y salieron corriendo a poner velas y violar cuarentena,336,Negativo
429772,2020-08-12,hondamarla,me dí la vacuna rusa me siento rara,334,Negativo
432149,2020-08-12,mis2centavos,alberto el martes felicita a putin por la vacuna rusa y el miércoles anuncia que fabricaremos la vacuna británica le pega con las dos gambas,333,Negativo
427434,2020-08-12,jabonisimo,me puse la vacuna rusa para el covid y no tengo ningún efectoski secundarioski позволь ему трахнуть свою мать америку,333,Neutro
438521,2020-08-12,yosoylaassange,cuba está autorizada a producir la vacuna rusa con sus recursos médicos y tecnológicos dentro del país la próxima vez que me manden a cuba les hago caso,333,Neutro
446876,2020-08-11,memowsky1,la vacuna rusa contra el covid se llama sputnik la vacuna contra la monotonía también y es de 1 2 1 2 es un honor estar en esta latitud,332,Negativo
432909,2020-08-12,feriglesias,yo no te renuncio al respirador ni loco pero a la vacuna rusa sí dónde hay que anotarse,332,Negativo
427153,2020-08-12,coqitaunder,parece que la vacuna rusa la probaron en volosin,329,Negativo
445931,2020-08-11,guerrerocuba,urgente jefe del fondo de rusia para la inversión directa dijo que producción de la vacuna rusa contra el covid19 en america latina comienza en noviembre cuba goza de condiciones excelentes para producir vacunas y puede convertirse en uno de los centros claves para producirla,328,Negativo
451716,2020-08-11,csarahelen,posiblemente la vacuna rusa llegue a colombia ya polo polo dijo que si era de allá no se la colocaban yo creo que todos los uribistas deberían seguir su consejo repitan conmigo si no es de eeuu o de países capitalistas no me la pongo,328,Negativo
439491,2020-08-11,willianconn,no tienen esa sensación de que estamos a punto de ver la luz de que el virus empezó a demacrarse de que la normalidad aunque alterada viene caminando hacia nosotros y ya le podemos ver el rostro esas noticias de menos consultas la vacuna rusa los clústeres ojalá,327,Negativo
432061,2020-08-12,lgalup,ayer la vacuna rusa era chamuyo y que generaba dudas hoy cómo que se va a producir la vacuna de oxford en argentina si la rusa es la más avanzada twitter qué manicomio hermoso,327,Negativo
417244,2020-08-14,mariafdacabal,noticiafalsa no creo en la vacuna rusa pero ésta frase no es mía nuevamente los promotores de las fakenews hacen de las suyas,327,Negativo
427843,2020-08-12,paracetamol0512,la vacuna rusa estará en el mercado a inicios de septiembre tiene un costo de 10 dólares pero si enseñas tú carnet de militante te la dejan en c 200 córdobas y te dan de bono media libra de frijoles sin gorgojo sólo en el conchita palacios,326,Negativo
454521,2020-08-10,forbes_mexico,con inmunidad y sin efectos secundarios todos los voluntarios que se aplicaron la potencial vacuna rusa contra el coronavirus mostraron resultados positivos y sus autoridades prevén que la vacunación masiva podría iniciar en octubre delasemana,326,Negativo
433242,2020-08-12,subtextoo,yo no se si confiaría tanto en una vacuna rusa considerando que tenían a rasputin siendo inmune al veneno mientras te manoseaba a tu señora y uno acá siendo el hijo hemofílico del último zar,324,Negativo
442703,2020-08-11,tifis,ingredientes de la vacuna rusa agua extracto de moringa,322,Neutro
448374,2020-08-11,polituitts,ya me estoy preparando para solicitar la vacuna rusa,321,Neutro
91302,2020-08-17,planwac,se viene la vacuna china pendientes,321,Neutro
433083,2020-08-12,aroliveros,el sobre la supuesta vacuna rusa frente al covid 19 es como subir a un avión al cielo afirmando que funciona cuando en realidad nunca has hecho un vuelo de prueba tal vez funcione o tal vez te estrelles contra el suelo,320,Negativo
454160,2020-08-11,mrsahuquillo,putin afirma que rusia es el primer país en lograr una vacuna contra la covid 19 segura y eficaz habla pese a las pese a las dudas y alertas de los expertos y más el líder ruso afirma que una de sus hijas se ha puesto la vacuna rusa y que está bien,319,Negativo
412785,2020-08-17,actualidadrt,maduro anuncia que será el primer venezolano en ponerse la vacuna rusa sputnik v contra el coronavirus para dar ejemplo,315,Negativo
443450,2020-08-11,ernesbustamante,el pensamiento mágico domina atávicamente al hombre entre hcq ivermectina dióxido de cloro y ahora la vacuna rusa ya nada me sorprende hay poco interés de ciertos individuos y gobiernos por la ciencia y sus métodos al final la verdad científica prevalece pero cuesta vidas,315,Negativo
422998,2020-08-13,memesnutricion,argentina con la vacuna rusa argentina con la vacuna de oxford,314,Neutro
453055,2020-08-11,javischur,la vacuna rusa es un peligro porque viene con un nanochip que se te adhiere al cuerpo y registra todos tus movimientos tus pasos tu frecuencia cardíaca tu voz tus gustos tus cambios de humor tus amistades sí como tu teléfono,313,Negativo
444372,2020-08-11,fabballarini,hilo muy completo sobre la vacuna rusa recomendable,313,Positivo
451130,2020-08-11,aristeguionline,sputnik v la primera vacuna rusa contra el coronavirus covid 19,312,Neutro
450872,2020-08-11,andresfidanza,la vacuna rusa califica para tema inédito de los redondos tengo otras canciones pandémicas con sus intérpretes y acepto más sugerencias estás muteada arabela spinetta peluquerías clandestinas las pelotas zoompleaños soda stereo take away illya kuryaki,312,Neutro
427521,2020-08-12,quiqueneira,hola les cuento ya me puse la vacuna rusa del covid y no tengo ningún efectoski secundarioski и меня зовут лопес обрадор и я коррумпирован и лжец и почему я даю чистые прямые награды,311,Negativo
432383,2020-08-12,profetaargen,alguien sabe si los que no querían la vacuna rusa están bien ahora que se anunció que argentina también va a producir la vacuna de oxford,310,Negativo
428257,2020-08-12,ironhoms,que si voy a aceptar la vacuna rusa he aceptado aguas locas de extraños en pedas de desconocidos sería una hipocresía de mi parte no hacerlo,309,Negativo
441203,2020-08-11,ivanaszerman,quedate con el que te ame como el gato silvestre ama la vacuna rusa probada en 38 personas,308,Negativo
415163,2020-08-15,hombresenridicu,unos minutos después de que te aplicaron la vacuna rusa cubrebocasvsmart,304,Negativo
444231,2020-08-11,marcoanibal,duda de vacunación la vacuna rusa provocará implementar soviets jesusito putin inocula comunismo,304,Positivo
452889,2020-08-11,seixodani,no os ponéis la vacuna rusa porque su investigación científica no es de fiar pero resulta que hasta hace dos días los estadounidenses tenían que hacer uso de los cohetes rusos soyuz para mandar a sus astronautas al espacio muy lógico todo,303,Negativo
454179,2020-08-11,cnnee,un grupo de compañías farmacéuticas multinacionales advirtió que la vacuna rusa contra el covid 19 podría poner en riesgo a la población,302,Negativo
415172,2020-08-15,mezamerlosc,no creen en la vacuna rusa pero dígales que una muñeca se escapó de un museo y todos,302,Neutro
430048,2020-08-12,econatorz,yo la vacuna rusa esta es la hostia soy inmune al coronavirus k flipas y 0 efectos secundarios yo a los 3 días,301,Negativo
441054,2020-08-11,lictricolor2,ya está lista la vacuna rusa para el covid,301,Neutro
453642,2020-08-11,ivanzambrano,no creo en amor de puta amistad de policía ni en vacuna rusa,299,Negativo
443041,2020-08-11,llantodeburgues,ya llegó su vacuna rusa amigos,299,Negativo
419262,2020-08-14,panampost_es,vacuna rusa no es segura y tiene efectos adversos advierten sus creadores por 13ago,298,Neutro
431647,2020-08-12,elcuervonica,ya me puse la vacuna rusa del covid y no tengo ningún efectoski secundarioski а выборы состоятся в 2021 году и их победит командующий даниэль ортега plomovzkys19,298,Negativo
448879,2020-08-11,diazdelavega1,los datos arrojan que uno de los efectos secundarios de la vacuna rusa es un incremento en la apreciación cinematográfica,297,Neutro
450954,2020-08-11,edgaroc69,así que los libertos no quieren vacuna rusa chucha ni para un chaulafan tienen pero acomplejados y ridículos no les gana nadie,295,Negativo
443054,2020-08-11,brozoxmiswebs,vladimir putin anuncia con bombo y platillo la vacuna rusa contra la covid la oms advierte que aún falta aplicar el protocolo de precalificación y revisión correspondientes,292,Negativo
436720,2020-08-12,elwarpig,esperando que llegue la vacuna rusa a san juan totoltepec,291,Neutro
419481,2020-08-13,rubbistein,me informan que la vacuna rusa sí tiene efectos secundarios mi bro que fue de los primeros en ponérsela actúa como putin,288,Negativo
441047,2020-08-11,paracetamol0512,países en los que se va administrar la vacuna rusa venezuela nicaragua korea del norte cuba mexico chins 2 que 3 países africanos el resto de países sigue esperando una vacuna aprobada por la fda,288,Negativo
446018,2020-08-11,unmalpaso,de la vacuna rusa ni idea del tema sólo venía a decir que todo el músculo científico militar aeroespacial e industrial ruso se sustenta en los pilares soviéticos no hay canal historia suficiente pa tapar eso,286,Negativo
431066,2020-08-12,ziberiai,vacuna rusa yo hago de cuenta que curo al mundo y el mundo hace de cuenta que se cura maravilloso,284,Negativo
422265,2020-08-13,giannijew,cuando ya te aplicas la vacuna rusa,281,Neutro
422375,2020-08-13,unamarcelita,a mi seguidor 5 000 le regalo la vacuna rusa,281,Neutro
423305,2020-08-13,aldrebesa,aupa cuadrilla os cuento ya me he puesto la vacuna rusa del covid 19 y no tengo ningún efectoski secundarioski и все баскские политические заключенные должны вернуться домой,281,Negativo
442089,2020-08-11,wildthing_9,el covid bien confiado mis anticuerpos después de la vacuna rusa,278,Neutro
452368,2020-08-11,elalexgoncalves,no entiendo por qué desconfían de la vacuna rusa,278,Negativo
