,date,username,tweet,replies_count,retweets_count,likes_count,link
139199,2021-03-06,rtultimahora,ÚLTIMA HORA: Maduro recibe la primera dosis de la vacuna rusa Sputnik V contra el coronavirus 🎥 ↓  https://t.co/99MBcXabwv  https://t.co/6rb2KpCnuN,9,79,216,https://twitter.com/RTultimahora/status/1368226165316534281
136353,2021-03-08,aluca2005_i,En Europa: 👎🏻 Sputnik La presidenta la Agencia Europea de Medicamentos aconsejó no aprobar el uso de la vacuna rusa Sputnik V  https://t.co/bAnjB50a6k,18,199,215,https://twitter.com/aluca2005_i/status/1368886647253794818
31705,2021-03-05,limagris,Escándalo: Vacuna china cepa de Beijing solo tiene 11.5% de efectividad. @Minsa_Peru @congresoperu @FSagasti @pcmperu @DanielUrresti1 @rlopezaliaga1 @yonhy_lescano  https://t.co/jcuq6qnXZB,10,87,209,https://twitter.com/Limagris/status/1368032198729826305
31293,2021-03-06,rataneda,"Maldito Vizcarra, pensó primero en su salud y se puso la vacuna china  El gobierno avanza muy lento y no me ponen la vacuna china  Metan preso a Sagasti por comprar la vacuna china",8,45,208,https://twitter.com/rataneda/status/1368055362708905984
30667,2021-03-06,amariateguibnof,"Estos caviares HDP se basan en estudios internacionales para aprobar la vacuna china, pero para aprobar las demás vacunas como la rusa, ahí si se ponen rigurosos y las quieren hacer pasar por la burocracia peruana!",14,82,205,https://twitter.com/amariateguibnof/status/1368190489174945793
137706,2021-03-06,bbcmundo,"La revista médica 'The Lancet' mostró que la vacuna rusa tenía una eficacia del 91,6% contra el coronavirus, a la altura de las mejores del mundo   https://t.co/H9Ni6Kmn1L",7,72,204,https://twitter.com/bbcmundo/status/1368384428163141637
133140,2021-03-12,vetomos,mi abuelo se dió la vacuna rusa y como lo vamos a ir a visitar el domingo mi vieja está imprimiendo un cartel que dice bienvenido compañero EN RUSO amo a mi familia,7,4,203,https://twitter.com/vetomos/status/1370350948464332800
30748,2021-03-06,rppnoticias,"El Ministerio de Salud hizo un llamado a la población ""a no dejarse sorprender por información emitida por fuentes no oficiales y sin rigurosidad científica"" que, presuntamente, indican porcentajes menores de eficacia de la vacuna china.  https://t.co/c7xiL0OIJo",70,59,203,https://twitter.com/RPPNoticias/status/1368182357468020740
29252,2021-03-06,plainvanillagrl,"Con respecto a lo difundido por BO sobre la vacuna china:  1. El Informe preliminar existe, no fake. Coralith García, investigadora principal de la UPCH lo señala.  2. El mismo Ernesto Bustamante ha explicado la metodología para llegar a la interpretación de los % de eficacia 1/3",10,72,202,https://twitter.com/plainvanillagrl/status/1368316186098888705
138190,2021-03-06,julianjarauribe,Maduro se inmunizó con la vacuna rusa Sputnik V y dice no sentir “Skadosky” ni “Fiebrosky”.  https://t.co/fWAiSEG6iI,30,24,202,https://twitter.com/JulianJaraUribe/status/1368310237883727874
143549,2021-03-01,elhigadodmarita,"¿Oiga, Ud. no tiene VERGÜENZA? ¿Por qué no compran la vacuna rusa? ¡Es ""limitada"" porque SU GOBIERNO INDOLENTE así lo ha decidido! ¡Los únicos que se han asegurado el ""derecho"" a las vacunas son una élite de CARADURAS que sale en una lista que MUY PRONTO los hará correr! FÍRMELO.",8,61,199,https://twitter.com/elhigadodmarita/status/1366522984631001091
29266,2021-03-06,restrepojcamilo,A la vacuna China la habíamos mirado por encima del hombro cuando comenzó la pandemia. Ahora dependemos de ella. Error que no cometió Chile. Por eso nos tomó dos meses de ventaja por lo menos. Llevamos a la fecha 260.000 vacunados. Chile lleva 3.200.000.,24,87,197,https://twitter.com/RestrepoJCamilo/status/1368314916852076546
136249,2021-03-08,santosjorgeh,"Vacuna rusa   La presidenta de la Agencia Europea del Medicamento ""desaconsejó"" a los países miembros de la Unión Europea que autoricen con urgencia la vacuna rusa contra el coronavirus , la Sputnik V,  alegando la insuficiencia de datos sobre las personas vacunadas.",9,186,197,https://twitter.com/santosjorgeh/status/1368911702289420289
134480,2021-03-10,el_pais,"España es uno de los países candidatos a fabricar la vacuna rusa Sputnik V, que ya ha sido autorizada en 42 países y tiene una efectividad del 92%  https://t.co/WoGFhGDbUV",18,53,194,https://twitter.com/el_pais/status/1369604055807516673
132958,2021-03-12,alertanews24,🇧🇷 | URGENTE - CORONAVIRUS: Brasil firma un contrato para recibir de 10 millones de dosis de de la vacuna rusa Sputnik V.,3,66,193,https://twitter.com/AlertaNews24/status/1370443294975623171
29548,2021-03-06,lazafer,"Habla completo: lanzar un reportaje con info incompleta sobre la vacuna china, para luego lanzar otro alabando a la ""vacuna peruana"" que no tiene ni medio estudio corriendo. No vale tomar solo el pedacito que te conviene para tratar de minimizar el escándalo que es @willaxtv",7,47,193,https://twitter.com/lazafer/status/1368286067426811904
35448,2021-03-02,presidencialven,"#UltimoMinuto | Llegan a Venezuela 500 mil dosis de la vacuna China. Asimismo, arriban insumos médicos y pruebas moleculares para continuar el combate contra la pandemia del COVID-19  https://t.co/FH43UJM0TC",4,264,192,https://twitter.com/PresidencialVen/status/1366592871026085891
29086,2021-03-06,grazianopazcual,"Hoy hubo 1097 casos, no es más que la consecuencia del festejo en los comités de base del FA por la llegada de una vacuna china en gobierno de Derecha.",4,16,192,https://twitter.com/grazianopazcual/status/1368334260126498820
24674,2021-03-09,aaronsalomong,¡Están aplicando la vacuna china de Sinopharm a los adultos mayores!,21,99,192,https://twitter.com/aaronsalomong/status/1369284111362359307
34824,2021-03-02,m_modernel,Recién me dieron la vacuna China y ya me dieron ganas de redistribuir el ingreso.,13,10,192,https://twitter.com/M_modernel/status/1366796177342144518
29956,2021-03-06,el_analista2020,"Los rojos dicen que las vacunas deben ser gratuitas.  Discrepo.  Después de ver la efectividad de la vacuna china, el Estado debería pagarnos para que nos vacunemos.",8,42,192,https://twitter.com/el_analista2020/status/1368249719496048646
26432,2021-03-07,suignris,"Mónica Delta le pregunta a RLA si es que es por prejuicio que no le gusta la vacuna china, y él responde que no porque le gusta el chifa. 🙄🙄🙄",12,27,191,https://twitter.com/SuiGnris/status/1368745393752862727
133532,2021-03-11,republica_naok,"Dijo @spitta1969 : En cuanto al tema de Sarlo, me parece q Kicillof no diagnostica bien. Xq él acusa d disinformación x parte mía o d la oposición, cuando en realidad vino x parte del Gobierno. Yo no desinformé. No había información suficiente de la vacuna rusa.  https://t.co/I9wcfsjFJm",7,83,191,https://twitter.com/Republica_naOK/status/1370028002541629443
138975,2021-03-06,mippcivzla,"#EnFoto📸| El Pdte de la República, Nicolás Maduro, recibió este #6Mar la primera dosis de la vacuna rusa Sputnik-V contra el COVID-19. #EscudoBolivariano2021 @NicolasMaduro  https://t.co/eCH1ElKFLc",11,785,191,https://twitter.com/Mippcivzla/status/1368244514184380417
132908,2021-03-12,brunocardenosa,"Se avecina ""terremoto"". La vacuna rusa puede ser aprobada e días. Los estudios demuestran la misma eficacia que otras, pero... habrá debate. Ella se la ha puesto. Es una de las periodistas más importantes de Rusia. Y ella va a estar mañana en La rosa de los vientos #rosavientos  https://t.co/1A98w4XDJz",14,26,190,https://twitter.com/brunocardenosa/status/1370461564445327361
140239,2021-03-05,soyluisguaregua,Ya me puse la vacuna rusa. Ahora siento unas enormes ganas de exigir al CNE y al SAIME un cambio de nombre; de Luis Guaregua a Igor Lenin Kustov.,23,49,187,https://twitter.com/SoyLuisGuaregua/status/1367896274561818631
142737,2021-03-02,paracetamol0512,"Ya anda la vacuna Rusa en Nicaragua, mañana me la ponen.🥺",61,9,187,https://twitter.com/Paracetamol0512/status/1366874840087605253
25156,2021-03-08,jackymc10,#Bermudez  “Dice que se  ha basado  en  un informe  de Emiratos  Árabes  para  comprar   la  vacuna  #China!!           MIENTE  #Bermudez!! “Es  un informe directo desde #China”.,6,94,184,https://twitter.com/JackyMc10/status/1369102112257417216
30595,2021-03-06,noticias_tvperu,"🔴 La efectividad de vacuna china Sinopharm es de 79.34%. Conversamos con el titular del @Minsa_Peru, Óscar Ugarte. ""El ensayo clínico de la vacuna china no está concluido, está en proceso"". En vivo:  https://t.co/sp5UWEn6rp  https://t.co/1gZusDPbMf",27,55,181,https://twitter.com/noticias_tvperu/status/1368197393796173832
30051,2021-03-06,memeoperu,1.- La vacuna China es una porquería. EXPLICACIÓN NIVEL COQUITO.  https://t.co/Q0oMnTZjZg,15,58,179,https://twitter.com/MEMEOPERU/status/1368242925956694019
21130,2021-03-12,npyoficial,"URGENTE. Llegan 3.000 dosis de la vacuna china, donadas por los Emiratos Árabes Unidos. #NPY #NosConecta #NoBajemosLaGuardia  https://t.co/2b8kSgi12G",25,49,177,https://twitter.com/npyoficial/status/1370551996495896578
33301,2021-03-03,fpachano,"COVID-19 Ahora tenemos la variante brasilera del SARS-COV-2 en Venezuela, era de esperarse por la cercanía. Esta cepa es más contagiosa y algunos estudios señalan q evade los anticuerpos de la vacuna China Sinovac. La que se trajo al país es la vacuna China Sinopharm eficacia 79%",16,174,177,https://twitter.com/fpachano/status/1367266367611822081
134927,2021-03-09,sacedator,"Lo que está haciendo la UE con la vacuna rusa #SputnikV es una muestra más de la decadencia, de la subordinación geoestratégica a los EE.UU y de negligencia criminal al no garantizar la vacunación a los ritmos anunciados a su población, con un resultado de miles de muertes.",6,112,176,https://twitter.com/sacedator/status/1369366643692998658
32066,2021-03-05,manarellidiego,"""LA VACUNA CHINA QUE HA COMPRADO EL GOBIERNO MORADO NO SIRVE"" BETO ORTIZ",4,49,175,https://twitter.com/manarellidiego/status/1368020032366723074
143149,2021-03-02,actualidadrt,"Un nuevo cargamento de 732.500 dosis de la vacuna rusa Sputnik V llegó el 1 de marzo a Argentina, con lo que ya suman casi 2,5 millones las dosis recibidas por el país sudamericano  https://t.co/IfpGGRzZsF  https://t.co/50TukQMKEO",0,81,175,https://twitter.com/ActualidadRT/status/1366758375648821249
33568,2021-03-03,tavo2366,"Polombia menosprecia una  vacuna porque es de Cuba.  Pero compró la vacuna China y la  Sputnik de la ""Unión Soviética"".  No hay dudas: este país está gobernado por imbéciles muy peligrosos.",6,88,175,https://twitter.com/tavo2366/status/1367171076208414720
35113,2021-03-02,fercarrodeguas,"Ayer vacunaron a mi mamá en el geriátrico en donde esta internada, en CABA, pero le dijeron a mi hermano que lo hicieron con la vacuna china. Tengo entendido que aún no está aprobada para los mayores de 60, alguien sabe si en otro geriátrico de CABA pasó algo así????",51,79,175,https://twitter.com/fercarrodeguas/status/1366739526484451334
33462,2021-03-03,drmiguelmarcos,"Todo el mundo en España hablando de las vacunas de Astra, Moderna y Pfizer y llegan el Rey Emérito y las infantas y se ponen la vacuna china de Sinopharm.  Las sorpresas del guión de la pandemia son inagotables...  https://t.co/7rVrSsIljF",20,38,174,https://twitter.com/drmiguelmarcos/status/1367202162212823044
132959,2021-03-12,rtultimahora,ÚLTIMA HORA:  Brasil firma un contrato para recibir de 10 millones de dosis de de la vacuna rusa Sputnik V  https://t.co/erDraeVJ3p  https://t.co/UZyKSPZ4vQ,5,91,173,https://twitter.com/RTultimahora/status/1370443128986079236
132996,2021-03-12,pinchegorro,Abuela turca con vacuna rusa. esa cara de felicidad hermosa.  https://t.co/qBwIyiul2I,11,0,172,https://twitter.com/pinchegorro/status/1370421508363976704
133924,2021-03-10,ntelevisa_com,"Este miércoles llegó a México un nuevo lote con 200 mil dosis de la vacuna rusa Sputnik V contra COVID-19, que serán aplicadas a adultos mayores #NoticierosTelevisaPlus  https://t.co/MqqLmWTEk3",20,92,170,https://twitter.com/NTelevisa_com/status/1369775362167566336
140640,2021-03-04,elfikuwtf,"NO PERMITIRÉ QUE ME ROBEN LA CUENTA DE HABBO, PREFIERO QUE SE FILTRE QUE LA VACUNA RUSA SOLO ES AGUA A QUE SE ROBEN MIS RARES. NUNCA LOS TENDRÁN.   NUNCAAAAAAAAAAAAAAAAAAAAAAAAAAAAAAAAAAAAAA!!!!!!!!!!!!  https://t.co/VGhWcqjsib",11,10,168,https://twitter.com/ElFikuWTF/status/1367670609635860483
135383,2021-03-09,aristeguionline,Italia será el primer país europeo en producir la vacuna rusa Sputnik V  https://t.co/ObGNFFAw6Q  https://t.co/zOxSRp9RY4,5,40,167,https://twitter.com/AristeguiOnline/status/1369258876613320707
134911,2021-03-09,jhonass,"Ojo!! Cada dosis de sinopharm cuesta casi 3 a 4 veces mas que la vacuna rusa o la de pfizer, y es tan inefectiva que se necesitan 3 dosis.  Al final es mas cara por paciente, eso contando que no tiene estudios concluidos y el caso del vacunagate hace mas fuerte las sospechas.  https://t.co/mf7JC0iZyu",15,73,167,https://twitter.com/Jhonass/status/1369370350744657926
32791,2021-03-04,ramirezmascaro,"No quiero alarmaros, pero las infantas se han puesto la vacuna china, así que ahora los chinos las controlan por 5G. Luego una de ellas fue a visitar a su madre (es decir, a meterle el microchip también a ella). En pocos días, China controlará por remoto a toda la familia real.",20,34,167,https://twitter.com/ramirezmascaro/status/1367555630832226305
28777,2021-03-06,charlieastron,"Patricio recibió la vacuna china (no recomendada para adultos mayores) como más de 90 mil docentes y auxiliares de toda PBA, pero este folleto nefasto busca ensuciarlo. Toda mi solidaridad. Lo peor es que este pseudoperiodismo siempre sale impune.",8,26,166,https://twitter.com/charlieastron/status/1368373279006801922
35377,2021-03-02,planwac,"¡Atención Pueblo!  Ante la llegada de la vacuna china, Gobierno de Narnia anuncia ""notición"" para mañana que estremecerá al país...................  Spoiler: ""Maduro era mal chofer""",10,147,166,https://twitter.com/planwac/status/1366617671664558082
30828,2021-03-06,hipocresiaroja,"El gobierno de @FSagasti admite que le puso una vacuna China🇨🇳 a los peruanos que NO tiene estudio de Fase 3 publicado, eso es terrible. Tampoco desmiente el estudio de la Cayetano donde dice q solo tiene 33% y 11%. Te queda claro que las vacunas son una estafa. Son unos asesinos  https://t.co/aLRsBNNmtz",6,83,165,https://twitter.com/Hipocresiaroja/status/1368172587054997520
29043,2021-03-06,vcabalg,"Álvarez Rodrich, una de las más prominentes meretrices del gobierno de Vizcarra, ha salido a defender la vacuna china y a atacar al general Guibovich. Sintomático, no?",10,58,165,https://twitter.com/vcabalg/status/1368339747001794563
141757,2021-03-04,mianrey,💉 La Agencia Europea del Medicamento inicia la revisión de la vacuna rusa contra el coronavirus Sputnik V  https://t.co/IUvup36Oo7,13,36,163,https://twitter.com/mianrey/status/1367401824286879750
137556,2021-03-07,aristeguionline,Nicolás Maduro y su esposa reciben primera dosis de vacuna rusa Sputnik V | Video  https://t.co/gAjGcIVLT6  https://t.co/sjvR74YKnG,52,28,163,https://twitter.com/AristeguiOnline/status/1368426200767561728
26478,2021-03-07,gianlucaal27,"Ya q se aclararon ciertas dudas de la eficacia de la vacuna china. Ahora surge la pregunta: Por qué mierda DIGEMID autorizó una vacuna q todavía estaba en ensayo? Sobretodo SI el Protocolo dictamina lo contrario, primero ensayo y luego autorización.",8,54,163,https://twitter.com/GianlucaAL27/status/1368741147850457089
34145,2021-03-03,alfonsorojopd,"Elena y Cristina se pusieron la vacuna china en el viaje a Abu Dabi, de una dosis, la misma que su padre  https://t.co/o9XdvCYqWA vía @Periodistadigit",82,21,162,https://twitter.com/AlfonsoRojoPD/status/1367017654796636162
31838,2021-03-05,coctelantiedad,¿Nadie del #GobiernoMorado va a salir a desmentir lo que está denunciando Beto Ortiz?   LA VACUNA CHINA NO SIRVE!,9,51,162,https://twitter.com/CoctelAntiedad/status/1368028823883767818
135479,2021-03-09,dw_espanol,"Italia fabricará la Sputnik V  Será el primer país de la Unión Europea en producir la vacuna rusa, que todavía no está aprobada por la autoridad del medicamento europea (lgc)   https://t.co/nVwzt7nGoY",4,79,162,https://twitter.com/dw_espanol/status/1369234003358855169
140181,2021-03-05,henrychinaski67,"La negativa a la vacuna rusa que le costó la vida a la médica es parte de una construcción mediática de larga data que convierte todo lo que no es de una potencia occidental en ""sospechoso"". Podría haber sido rusa, iraní, siria, cubana, egipcia, ...da lo mismo.",9,55,162,https://twitter.com/HenryChinaski67/status/1367914972060282881
27017,2021-03-07,cplimape,"#CPL | Nuestro decano de Lima, Ricardo Burgos, publicó a través de su cuenta de Facebook su opinión sobre el revuelo que ha causado Beto Ortiz con la difusión de un informe sobre la eficacia de la vacuna china de Sinopharm. 🕵️👇  https://t.co/SqvVVkgHRk",12,85,161,https://twitter.com/CPLimaPe/status/1368668199441625093
20801,2021-03-13,estebanortizmd,"La vacuna de Sinovac de China avanza a paso firme, está en la fase final de evaluación (seguridad y eficacia) por parte OMS La portavoz de esta institución afirma que es probable que se apruebe el uso de emergencia de la vacuna china Sinovac contra el COVID-19 a finales de marzo  https://t.co/oNx6TCxmyj",12,50,159,https://twitter.com/EstebanOrtizMD/status/1370851208668266503
30162,2021-03-06,agildemeisterrh,"Bermudez defiende a capa y espada la maravillosa vacuna china, sustentada en ""estudios clínicos"" en otros países. Insiste en culpar a ""intereses particulares"" (¿?). ""Habrá vacunas para todos"", dice. ¿Y el informe de Cayetano Heredia?...",6,47,159,https://twitter.com/agildemeisterrh/status/1368234735864979457
139844,2021-03-05,jtcmonag,"Increíble. @FSagasti impidió la compra de la vacuna Rusa en beneficio de las chinas. Con esa carita de viejito  intelectual y chévere, ese comunista RCSMadre es un tremendo genocida que le importa un carajo la vida de los peruanos.",8,83,159,https://twitter.com/JTCmonag/status/1368024681337548803
26416,2021-03-07,gatopoliticope,"¿Oye y los candidatos de tu país son buenos?  👉🏻 Rafael López Aliaga en #PuntoFinal:  - La vacuna China es la peor, prefiero la Rusa. ¿Oiga pero eso es prejuicioso no? - No para nada, a mí me gusta el chifa, con eso te digo todo.",17,38,158,https://twitter.com/GatoPoliticoPE/status/1368746774614118402
133005,2021-03-12,grazianopascale,"La de Pfizer no tenia ""costos adicionales"", como la vacuna rusa que compró Argentina.  Esa es la explicación de fondo.",2,42,156,https://twitter.com/grazianopascale/status/1370419628212641799
136045,2021-03-08,ignaciomiri,"No sé ustedes, pero yo personalmente prefiero atenderme con un médico que se dio la vacuna rusa DESPUÉS de que salió publicado el artículo científico que la avala",7,12,155,https://twitter.com/ignaciomiri/status/1368951829963431937
139184,2021-03-06,alertanews24,🇻🇪 | AHORA - CORONAVIRUS: Nicolás Maduro recibe la primera dosis de la vacuna rusa Sputnik V contra el coronavirus:   https://t.co/9afOpLOi4E,49,70,155,https://twitter.com/AlertaNews24/status/1368227090479390720
135762,2021-03-08,juanjopadilla01,Como la vacuna rusa sea igual de buena que su ensaladilla... me la pongo el primero,3,28,155,https://twitter.com/juanjopadilla01/status/1369045063456718855
31565,2021-03-06,jali_cotrina,La mayor estafa q haya ocurrido en el Perú! CONFIRMADO la vacuna china NO SIRVE! Vizcarra y Sagasti deben estar detenidos por crimínales genocidas! EL PAIS EXIGE QUE MAÑANA CONGRESO CENSURE A LA MESA DIRECTIVA Y POR TANTO CAIGA SAGASTI!!  https://t.co/8xjEsFdW4m,24,101,154,https://twitter.com/Jali_Cotrina/status/1368038518686121984
132999,2021-03-12,luis73052841,"Europa NO reconocerá, certificados con la vacuna rusa ni china, para poder circular por el continente. Informo Europa News.",10,119,154,https://twitter.com/Luis73052841/status/1370420803892838405
34051,2021-03-03,marienaristy,"Día 62. Hoy las noticias son alentadoras: Turquía asegura que la vacuna china Sinovac tiene una eficacia del 83,5%, tras finalizar la tercera fase de ensayos, según anunció la Universidad Hacettepe, que hizo la investigación. We ❤️ China. ¡A vacunarse con más fe! ¡Buenos días! ☀️",5,31,153,https://twitter.com/marienaristy/status/1367066360841465860
133050,2021-03-12,pedroleko,Espero que la vacuna rusa cambie mi ADN para poder solicitar mi pasaporte de la comunidad europea,5,26,152,https://twitter.com/Pedroleko/status/1370392382026432519
138530,2021-03-06,tecbpjos,"@MonicaYaya Se ha comprobado que Sagasti no dejo que la vacuna rusa venga al Perú, 6 meses antes, no es delito de lesa humanidad?",5,47,152,https://twitter.com/TecBpJos/status/1368275071031259142
139038,2021-03-06,manarellidiego,"LA PREMIER VIOLETA BERMÚDEZ  DICE"" NOSOTROS HEMOS ADQUIRIDO LAS VACUNAS BASADOS EN ENSAYOS CLÍNICOS EN OTROS PAÍSES"" BAJO ÉSA MISMA RESPUESTA PQ NO COMPRAN HASTA AHORA LA VACUNA RUSA SPUTNIK V QUE SEGÚN ENSAYOS CLÍNICOS TIENEN 92..5 % DE EFICACIA.PQ LA HAN RECHAZADO @VBermudezV  https://t.co/KDSlcz6SQh",13,65,151,https://twitter.com/manarellidiego/status/1368238531525623810
30726,2021-03-06,kuervakk,"Buen día querides!! Pa mí que la vacuna china vino con un chip comunissssta ,me levanté a las 8 y me limpie la vida(?) 😁😬💉 Tengan hermoso sábado 😍😊",29,13,151,https://twitter.com/kuervakk/status/1368184480515698698
21982,2021-03-11,emeraviglia,"En la medida en que la ANMAT no apruebe la vacuna china para mayores de 60, los de esa edad tratemos de no ilusionarnos demasiado. Si además las Sputniks se hacen desear vamos a pasar otro invierno con cagazo y tristeza. Y no me empiecen a putear por decir lo que siento.",41,47,151,https://twitter.com/EMeraviglia/status/1370146699470123011
134167,2021-03-10,marcelaramaya,"La vacuna rusa se aprobó para adultos el 20 de Enero. La oferta a Sarlo fue el 22. O sea, ya habían abierto la inscripción.   Todo hijaputez.",1,41,149,https://twitter.com/MarcelaRAmaya/status/1369705231798448130
138905,2021-03-06,minsaludve,#AlMomento || Arriba a Venezuela segundo cargamento de la vacuna rusa Sputnik-V   #EscudoBolivariano2021  https://t.co/jInw5EDX8d,3,259,149,https://twitter.com/MinSaludVE/status/1368247808139145220
132516,2021-03-13,el_vengak,"Con tal de no volver a dejarle el programa a la nieta, mirtha fue capaz de ponerse la vacuna rusa",2,7,148,https://twitter.com/El_vengaK/status/1370867442046631939
142820,2021-03-02,jesuisespe_,La vacuna rusa #SputnikV era nefasta... excepto para la oligarquía y la realeza.,4,82,148,https://twitter.com/JeSuisEspe_/status/1366851235329040391
33995,2021-03-03,cazatalentos,El emérito y sus hijas se han puesto la vacuna china. Esa vacuna que los españoles no se pondrían nunca. Que cutres todos. Los súbditos y sus monarcas.,3,72,147,https://twitter.com/Cazatalentos/status/1367082271514189825
31845,2021-03-05,agildemeisterrh,"Eficacia según Estudio de Cayetano Heredia: Vacuna china de Wuhan: 33.3%; Vacuna china de Beijin: 11.5% Conclusión: Gobierno de Vizcarra/Sagasti mintieron a los peruanos. Por tanto: a la fecha, las ""vacunas"" chinas NO son vacunas. Los peruanos ""vacunados""... seguirán muriendose.",4,59,146,https://twitter.com/agildemeisterrh/status/1368028601363349508
35402,2021-03-02,barrioykandela,Ya los escualidos pueden escoger entre las la vacuna China o la Vacuna Rusa  #LlegoLaVacunaChina,20,87,146,https://twitter.com/BarrioyKandela/status/1366600715007889408
143357,2021-03-02,barrioykandela,Ya los escualidos pueden escoger entre las la vacuna China o la Vacuna Rusa  #LlegoLaVacunaChina,20,87,146,https://twitter.com/BarrioyKandela/status/1366600715007889408
22747,2021-03-10,jtcmonag,"Tanto chongo de Violenta @VBermudezV, el vago versero @FSagasti y sus guaripoleras y Beto dijo la verdad sobre la vacuna china (Wuhan), confirmado por la UPCH: No sirve.",3,56,146,https://twitter.com/JTCmonag/status/1369831909124149250
135618,2021-03-08,rogeraderly,"El Perú está negociando 8 millones de dosis de la vacuna rusa Sputnik V.   También, aunque el monto puede variar, 10 millones de dosis de Johnson &amp; Johnson.   😊",10,12,145,https://twitter.com/RogerAderly/status/1369109989860728835
35701,2021-03-01,birarasta,Según #MentirasMan6ias la vacuna china no existe 👀  La vacuna China:  https://t.co/rzErHGuK5L,1,25,144,https://twitter.com/birarasta/status/1366471835655827460
143166,2021-03-02,hipocresiaroja,"@RPPNoticias La vacuna rusa cuesta 40 soles, hoy los pobres no tiene oxígeno, que cuesta miles de soles, Veronika Mendoza y el @partidomorado matan a miles de peruanos con su sectarismo",10,43,144,https://twitter.com/Hipocresiaroja/status/1366753272242065408
22542,2021-03-11,rochaperiodista,"Informa el canciller Marcelo Ebrard que ya tenemos en México 5 millones de dosis de la vacuna china de una sola aplicación Cansino, de las cuales un millón ya están envasadas y podrían usarse a fines de marzo.  https://t.co/lZyQaGb7KT",20,50,143,https://twitter.com/rochaperiodista/status/1370005949369421832
20875,2021-03-13,omarprietogob,"Sigue nuestro Pdte. @NicolasMaduro garantizando la protección sanitaria al pueblo en esta batalla contra el #COVID19 Hoy #13Mar Llegó la vacuna china para los trabajadores de primera línea de batalla en los CDI. Igualmente, para nuestros educadores.  #SigamosCuidandonos  https://t.co/4hNavaEmx8",10,208,143,https://twitter.com/OmarPrietoGob/status/1370796758897463299
