,date,username,tweet,replies_count,retweets_count,likes_count,link
180140,2021-02-02,pajaropolitico,"#LoÚltimo | La @COFEPRIS autorizó el uso de emergencia de la vacuna rusa Sputnik V, informó @HLGatell.  https://t.co/NzEWioLS2E",10,73,287,https://twitter.com/Pajaropolitico/status/1356785985107816449
187148,2021-02-02,jorgenomefui,"Mientras que un montón de mequetrefes se disfrazaron de portadores de sabiduría y te llenaron la cabeza con mentiras y desconfianza sobre la vacuna rusa, estas 2 personas llamadas Denis Logunov e Inna Dolzhikova, lejos de estereotipos y pavadas, hicieron mucho por salvar tu vida  https://t.co/548PzLysqC",6,31,287,https://twitter.com/jorgenomefui/status/1356622005500604417
188512,2021-02-02,fpedrosa2,"1. Finalmente era verdad y la vacuna rusa no había pasado la tercera fase. 2. No tenemos vacunas rusas ni de ningún otro tipo. Datos, no opinión.",5,74,287,https://twitter.com/fpedrosa2/status/1356603467456987136
202523,2021-01-27,jagarzaramos,"Con la vacuna rusa #SputnikV el gobierno mexicano estará:  1) Aplicando una vacuna que no tiene autorización plena de @COFEPRIS.  o si Cofepris la avala,  2) Autorizando una vacuna que no está plenamente probada ni con resultados publicados (la Fase 3 concluye hasta mayo).",33,120,286,https://twitter.com/jagarzaramos/status/1354518064130371589
180475,2021-02-02,osvaldo_quiroga,Juntos por el Odio va contra los argentinos cuando auspicia campañas contra las vacunas. Son capaces de cualquier cosa. Todo lo que dijeron de la vacuna rusa muestra la forma en la que hacen política. Son patéticos.,7,84,285,https://twitter.com/osvaldo_quiroga/status/1356774959960494083
55708,2021-01-28,sr_mcgregor,"Hoy me llegó un mensaje “alertándome” sobre lo perjudicial de la vacuna china (Sinopharm). Aló, ⁦@FiscaliaPeru⁩, ¿no hay que investigar este tipo de campañas de desinformación que ponen en peligro la salud pública?  https://t.co/ZoOr9jmytZ",14,138,285,https://twitter.com/Sr_McGregor/status/1354887006447398912
206353,2021-01-27,javierheredis,"@LillyTellez Q no sirve la vacuna rusa ? Dice lo al Medio Oriente y algunos paises que no son gatos del imperialismo , porque ellos se están vacunando con sputnik y todo va bien , infórmate",32,15,285,https://twitter.com/JavierHeredis/status/1354295526611505157
194703,2021-01-29,rochaperiodista,"La ONU espera que la OMS apruebe la vacuna rusa Sputnik V ""lo antes posible""... pero el Comité Tuitero de Expertos en Vacunas de México no le ha dado el aval, que no se adelanten los de la ONU.  https://t.co/EWrKwOE19P",21,133,284,https://twitter.com/rochaperiodista/status/1355253061254602754
50478,2021-02-07,alfredoferrerod,"⁦@RPPNoticias⁩ ⁦@elcomercio_peru⁩ ⁦@ExpresoPeru⁩ ⁦@larepublica_pe⁩ ⁦@canalN_⁩  ⁦@RPPNoticias⁩ aquí más vacunación en Chile ...y nosotros esperando vacuna China que llegaría de a poquitos , Vizcarra un mentiroso e inepto y Sagasti sin liderazgo  https://t.co/JgIMLGFDlb",47,80,283,https://twitter.com/alfredoferrerod/status/1358430041932263434
214367,2021-01-25,infobae,"Tras aplicarse la primera dosis de la vacuna rusa, el intendente de Miramar dio positivo de coronavirus  https://t.co/aD2Bylptru",104,113,283,https://twitter.com/infobae/status/1353807518217220096
209489,2021-01-26,lillytellez,@SinLinea_Mx @MemesVito2 La vacuna rusa no tiene aval de la OMS ni de la comunidad científica internacional.,89,33,283,https://twitter.com/LillyTellez/status/1354172492407926785
167496,2021-02-06,zorrillopablo,SE ACUERDAN DEL GORDITO LECHOSO CUANDO SE REIA DE LA VACUNA RUSA!!! IDIOTA MERCENARIO 😎,15,63,282,https://twitter.com/ZorrilloPablo/status/1358031905036378114
213211,2021-01-26,elmaderense12,Los representantes de la #OposicionMiserable molestos porque tendremos las vacuna Rusa en México. Tratan de minimizarla por ser rusa. Mientras la canciller alemana Merkel hace todo lo posible por adquirirla. Cualquier vacuna que llegue al gobierno es vacuna Chaira. Ni se vacunen.  https://t.co/tY9obGwvqk,30,147,282,https://twitter.com/ElMaderense12/status/1353901583206068227
181567,2021-02-02,edufeiok,Perfil | Otro intendente dio positivo de Covid luego de aplicarse la vacuna rusa Sputnik V  https://t.co/AO6iKFjgfk,80,134,281,https://twitter.com/edufeiok/status/1356738121958883331
215456,2021-01-25,biablitasimpson,@lopezobrador_ Yo después de ponerme la vacuna rusa:  https://t.co/xCFyPHPRC9,1,31,281,https://twitter.com/BiablitaSimpson/status/1353735251286253570
217321,2021-01-24,charlystone79,Putin mirando enamorado como CFK se da la vacuna Rusa  https://t.co/Z7iOEOMWt6,9,77,281,https://twitter.com/CharlyStone79/status/1353392694546972672
185410,2021-02-02,bbcmundo,"Sputnik V: la vacuna rusa contra el coronavirus muestra en un estudio de ""The Lancet"" una eficacia de 92%  https://t.co/DUQFVwqDW8",9,113,279,https://twitter.com/bbcmundo/status/1356648093144526850
213476,2021-01-25,sadimlopez,En una de sus alucinaciones Maradona le dijo que la vacuna rusa es chafa.  https://t.co/JzRp0iqySZ,56,69,279,https://twitter.com/SadimLopez/status/1353885256114450433
179583,2021-02-02,rochaperiodista,"Así celebró López Gatell la aprobación de la vacuna rusa Sputnik V por parte de Cofepris... Algo ""alentador"", dijo.  https://t.co/pI8RMmxZIh",14,103,279,https://twitter.com/rochaperiodista/status/1356797045865144321
205141,2021-01-27,jucanoticias,"Lilly, nadie te quiere callar. No alucines. Pero si muchos quieren que pienses mejor lo que hablas. Pareciera que cada día pierdes más la razón. Actúas como demente. Con fundamento y pruebas: DEMUESTRA lo que dices de la vacuna Rusa. No con tu imaginación. CON PRUEBAS!",26,90,279,https://twitter.com/JucaNoticias/status/1354426690127224832
179865,2021-02-02,tona_je,🚨#ULTIMAHORA | @COFEPRIS autoriza el uso de la vacuna rusa #SputnikV 💉 🇷🇺 🦠,7,50,278,https://twitter.com/Tona_je/status/1356791007610875907
189918,2021-02-02,materia_ciencia,"La vacuna rusa Sputnik V alcanza una eficacia del 92%, según un ensayo con 20.000 participantes  https://t.co/i9jfNJxWRa",6,114,278,https://twitter.com/materia_ciencia/status/1356583747622232066
188171,2021-02-02,rochaperiodista,Lamenta Hugo López Gatell infodemia que lanzan grupos de interés y destaca que la vacuna rusa Sputnik V es segura y eficaz también en adultos mayores de 60 años. Su eficacia es de alrededor del 92 por ciento en ese grupo.  https://t.co/6KVulWSUaP,8,127,278,https://twitter.com/rochaperiodista/status/1356607987381592071
218190,2021-01-23,patriciomonero,"Predicción: con esto de que todo mundo va a poder comprar e importar vacunas, se va a armar un desmadre de antología. Esto de las vacunas rusas compradas por un empresario, que al parecer no son la vacuna rusa, es sólo el comienzo...  https://t.co/SFHhBzWZng",36,83,278,https://twitter.com/Patriciomonero/status/1353045468545077248
196399,2021-01-28,grcerrutti,Rusia no entró con su vacuna en países con organismos regulatorios serios. Esta vacuna solo se probó en Rusia. AstraZeneca probó en varios países. La vacuna rusa vale 10 dólares y nosotros la pagamos 17 dólares. @spitta1969,8,121,277,https://twitter.com/grcerrutti/status/1354979136939372545
170902,2021-02-04,rtultimahora,ÚLTIMA HORA   Paraguay firma un contrato para adquirir la vacuna rusa #SputnikV (@sputnikvaccine) contra el coronavirus  https://t.co/DxOZ739nk0  https://t.co/8Cw5eHRhy1,5,116,276,https://twitter.com/RTultimahora/status/1357412458995023873
55301,2021-01-29,eabusad,"He visto bastante desinformación respecto a las vacunas. Yo me puse las dos dosis de la vacuna china de Sinopharm (que ha comprado el Perú). Si alguien quiere saber la experiencia de los volunarios o tiene dudas, no dude en escribirme para explicarles un poco de primera fuente.  https://t.co/ZnFmoS20xI",27,72,276,https://twitter.com/eabusad/status/1355152581962686465
217433,2021-01-24,todonoticias,Cristina Kirchner se aplicó la vacuna rusa Sputnik V contra el coronavirus   https://t.co/3oThr1nTW8,386,35,276,https://twitter.com/todonoticias/status/1353384318916304897
188147,2021-02-02,proceso,"La revista médica internacional The Lancet puso fin a la polémica sobre la fiabilidad de la vacuna rusa Sputnik V, una de las que están a punto de llegar al país, al publicar resultados de la última fase del ensayo clínico que arrojaron eficacia del 91.6%.  https://t.co/ZcRPVCI13u",20,139,276,https://twitter.com/proceso/status/1356608353896697858
176282,2021-02-03,jotaalonso,"Salvarezza: ""Argentina tiene la capacidad para fabricar la vacuna rusa""  https://t.co/ZOCNqiELoF",4,124,276,https://twitter.com/jotaalonso/status/1356978619436924931
214177,2021-01-25,infobae,"Tras aplicarse la primera dosis de la vacuna rusa, el intendente de Miramar dio positivo de coronavirus  https://t.co/KEklt0phj4  https://t.co/gI5bUdxvhH",68,113,276,https://twitter.com/infobae/status/1353821618959736834
183850,2021-02-02,hopm2004,⚠️💥⚠️💥⚠️💥⚠️💥⚠️💥⚠️💥⚠️ 👀🗣️📢Se filtra la reacción de  Lilly Téllez al ver la publicación de la revista científica The Lance sobre  los estudios de fase 3 de la vacuna rusa Sputnik V. 🤪😂  https://t.co/YaWMNo1oJG,24,176,276,https://twitter.com/hopm2004/status/1356678766664306690
177460,2021-02-03,osvaldo_quiroga,"Muchachas y muchachos de Juntos por el Odio les quiero dar una primicia: la revista ""The Lancet"" la compró @CFKArgentina y ella misma escribió el artículo sobre la vacuna rusa.  El peligro rojo se acerca a nuestras inmaculadas tierras. ¡Estén antentos!",22,66,275,https://twitter.com/osvaldo_quiroga/status/1356936352126951425
212948,2021-01-26,aitorvalls20,Pero la farandulera ridícula ⁦@LillyTellez⁩ no quiere esa vacuna. Jajaja bien por ⁦@lopezobrador_⁩ 🇲🇽🦅 👇 Merkel ofrece apoyo a Moscú para entrada de vacuna rusa Sputnik V a UE  https://t.co/kKABDeNP9o,12,163,275,https://twitter.com/AitorValls20/status/1353919910225833984
198341,2021-01-28,chairita4t,"🌺 Podríamos hacer responsable a @LillyTellez por el posible fallecimiento de gente que se negará a aplicarse la vacuna rusa, y que se ha dedicado a desinformar en su absurdo afán de golpear al Dr. Gatell  #AMLOVERSForever @Chokko30",12,119,275,https://twitter.com/chairita4T/status/1354818037145235463
173176,2021-02-03,arelipaz,"No le haré promoción alguna a la empresa de paquetería, pero ya hay contrato para trasladar la vacuna rusa: @HLGatell",13,44,274,https://twitter.com/AreliPaz/status/1357145359982735361
169476,2021-02-05,ziberiai,Al final Merkel está pidiendo (arrastrándose) a la Unión Europea que permita que entren la vacuna rusa  https://t.co/nWnJ62Eoiu,12,5,274,https://twitter.com/ziberiaI/status/1357683805914595331
177565,2021-02-03,elkotur,NO PUEDEN DEJAR DE ODIAR  LA NACIÓN HOY  La buena noticia es que la vacuna rusa es eficiente; la mala novedad es que esa información se conoce un mes después de que se la empezara a inocular en el país  MORALES SOLA ES IGNORANTE SUPINO LO QUE PUBLICÓ LANCET ES INFORMACIÓN ANMAT,19,140,274,https://twitter.com/elkotur/status/1356931905485217794
185617,2021-02-02,torreon,"'Seré la primera en aplaudir a la vacuna rusa cuando cumpla requisitos', dice @LillyTellez; señala que los mexicanos merecen dosis de calidad   https://t.co/dp9b8ToFVK",213,66,273,https://twitter.com/torreon/status/1356644726519250944
215344,2021-01-25,arouet_v,"Presidente, espero que se encuentre mejor. Le pregunto: ¿La vacuna rusa ya fue autorizada por la OMS? ¿Las autoridades mexicanas conocen el protocolo médico seguido para su elaboración? ¿Si no es así entonces por qué comprarla? ¿Si es así podría informarse?",16,148,273,https://twitter.com/Arouet_V/status/1353740704783216648
206610,2021-01-27,cirogomezl,"#ENVIVO México ya está haciendo llamadas a los adultos mayores que recibirán la vacuna rusa y china contra #COVID19. Según un texto difundido en Argentina por investigadores, la #SputnikV debe aplicarse con precaución en personas con estas enfermedades:  https://t.co/RpBeClMEhp",121,144,272,https://twitter.com/CiroGomezL/status/1354285559741616129
184469,2021-02-02,andy_tow,"La vacuna rusa es gratis. No registra efectos adversos. Si te la ponés no perdés nada y probablemente cuidás tu salud y la de tus seres queridos. En el peor de los casos tenés fiebre un rato y no pasa nada, es inocuo. Cuál es el argumento para no ponérsela? Aparte del negocio",21,48,272,https://twitter.com/andy_tow/status/1356666192086372353
198535,2021-01-28,cirogomezl,"“Sí me aplicaría la vacuna rusa, porque me gustan las rusas”, esto es lo que piensan los mexicanos sobre la #SputnikV:  https://t.co/CtOy5vHrMs",135,65,272,https://twitter.com/CiroGomezL/status/1354805933277392896
218480,2021-01-23,actualidadrt,¿Por qué Europa ya no 'se ríe' de la vacuna rusa #SputnikV?  https://t.co/k2P5qoVjs9,8,179,271,https://twitter.com/ActualidadRT/status/1352981194762301440
187582,2021-02-02,julioargroca21,El negro q lo van a vacunar recién en 10 años y va tener covid antes lo ataca a Nelson Castro con la vacuna rusa Es q ya no tienen tema con q festejar los bestias,27,70,271,https://twitter.com/JulioArgRoca21/status/1356615400700665864
187721,2021-02-02,javier_parra,¿Escucháis eso? Es el silencio de quienes hace unos meses se reían de la vacuna rusa Sputnik V.,3,83,270,https://twitter.com/javier_parra/status/1356613579487731720
181834,2021-02-02,juliohectore,La vacuna rusa tiene 94% efectividad. Las chinas evitan 80-85% casos graves. SON SOLUCIONES que suman a salvar vidas y la economía.   No es momento de lealtades diplomáticas serviles y anacrónicas.   Es momento de audacia y resolver usando todos los recursos posibles.,22,38,270,https://twitter.com/JulioHectorE/status/1356730904182464521
185670,2021-02-02,demiandu,"Mientras la senadora @LillyTellez sigue despotricando contra la vacuna rusa Sputnik V y tratando de enredar a la opinión pública, la petición ciudadana para que se le haga juicio político y se le desafuere, avanza en Sonora  https://t.co/Gw4zWU84td",22,144,270,https://twitter.com/demiandu/status/1356643911851073536
191026,2021-02-01,rochaperiodista,"Carlos Marín cambia el discurso y ahora pide en su columna de Milenio contemplar la vacuna rusa Sputnik V ""sin prejuicios"".  https://t.co/1w97qL6q4n",31,113,269,https://twitter.com/rochaperiodista/status/1356246123980189697
198701,2021-01-28,ecuernavaco,¿En que se parece la vacuna rusa a Citlalli Hernández? ¡En que las dos tienen sus estudios imcompletos!  Buen día.,13,53,269,https://twitter.com/ECuernavaco/status/1354794222059065351
218272,2021-01-23,grazianopascale,"¿Qué lástima que a nadie se le ocurrió preguntar en la conferencia de prensa de @LuisLacallePou si el @casmuoficial había coordinado con el gobierno la compra de la vacuna rusa? Se ve que nadie tomó en serio el anuncio. Porque si lo hubieran tomado en serio, era pregunta de cajón",19,40,269,https://twitter.com/grazianopascale/status/1353023953548308481
52418,2021-02-03,arancibialmte,"Hoy me vacuné con la vacuna china y me siento fantástico, más seguro yo y aportando más seguridad a mis vecinos.",17,58,268,https://twitter.com/arancibialmte/status/1357117388471336960
202198,2021-01-27,g_quadri,"Insisto. Sólo me pondría la vacuna rusa el día que se la ponga Putin, cosa que no ha hecho, ni hará. Xi tampoco se ha inoculado con las vacunas chinas. López le apuesta a ambas. La plantación de la vacunación fue un desastre entre Cancillería y Salud. Como todo con López...",26,53,268,https://twitter.com/g_quadri/status/1354529203165814790
189930,2021-02-02,infobae,"🔴 REITERAMOS | The Lancet publicó datos sobre la vacuna rusa Sputnik V: mostró una efectividad de 91,6 % y no registró efectos adversos graves  https://t.co/GXTkW156Q3",43,84,267,https://twitter.com/infobae/status/1356583562401767425
213107,2021-01-26,marisazavaleta,Nuevamente se postergó el vuelo a Moscú para traer la “supuesta” segunda dosis de la vacuna hasta nuevo aviso.Sigan creyendo en la efectividad de la vacuna rusa! .,25,101,266,https://twitter.com/MarisaZavaleta/status/1353908458056257536
208339,2021-01-26,lillytellez,@jenarovillamil Ofrece apoyo porque la vacuna rusa todavía no cumple los requisitos.,23,24,266,https://twitter.com/LillyTellez/status/1354223449800019968
196695,2021-01-28,_frankyjalisco_,"Estoy seguro que toda la fachisa aceptaría la vacuna Rusa con el simple echo de que #Amlo La Rechazara, con eso la fachisa y más #LadyAntiVacunas seria la primera en decir que anlo Rechazó lo mejor de la nueva mejor vacuna 💉",15,140,265,https://twitter.com/_frankyjalisco_/status/1354949343602634752
209965,2021-01-26,jpalvarezguedea,"Pero, qué hay con la vacuna rusa? Lo primero q tenemos q saber es q la #SputnikV fue la primera vacuna oficialmente autorizada por un gobierno, ya q desde agosto de 2020 el gobierno ruso había dado su beneplácito para aplicarla. Lo raro? No había terminado sus fases d prueba. 🧵  https://t.co/5TmKWWpEcH",8,163,265,https://twitter.com/JPAlvarezGuedea/status/1354152631996973060
190283,2021-02-02,divalustar,"Pensar que la opinión de un intelectual pesa más que los científicos creadores de la vacuna Rusa, eso solo pasa en México y estos reporteros les dan voz🤢🤮👇👇👇👇👇  https://t.co/Ffs5a3zF0h",21,151,265,https://twitter.com/DIVALUSTAR/status/1356439482942251008
192675,2021-01-30,donporfifirio,"Mensaje del General,  La vacuna rusa puede llegar a ser una muy buena noticia pero el gobierno primero debe de demostrar que realmente es segura y eficiente.  De no hacerlo darían una mala impresión y mucha gente le tendría miedo!  Si a las vacunas. A las vacunas probadas!✍️🧐",13,57,264,https://twitter.com/DonPorfifirio/status/1355655951676792835
183153,2021-02-02,adrianstopok,"Les pido que paren de decir que ""la vacuna rusa es eficaz"". La epidemia de boludez e ignorancia es imparable.",59,66,263,https://twitter.com/adrianstopOK/status/1356694559661686790
167805,2021-02-06,elmaderense12,"""La vacuna rusa funciona bien en los rusos, porque son altos y weros. En los mexicanos no, son prietos y chaparritos""                   Hector Aguilar Camin.                   Chayotero Genetista.  https://t.co/KwDiVAxW1O",19,163,263,https://twitter.com/ElMaderense12/status/1357912597572579330
187374,2021-02-02,thefenyxx,Yo hoy despues que anunciaron la efectividad de la vacuna rusa  https://t.co/N6YZ0cIjFs,13,98,263,https://twitter.com/TheFenyxx/status/1356618432960221190
217969,2021-01-23,reinadistancia,"Voy saliendo de una cx de craneo y me entero que un tal empresario Alejandro Cosio anda haciendo triquiñuelas y fraudulencias ,comprando vacuna rusa y el mismo gobierno ruso lo delata de fraude.por cierto es del grupo de adivinen quien??? Sí,de borolas, y hasta del bukele.  🙄🙄",8,144,263,https://twitter.com/ReinaDistancia/status/1353104491013316608
217290,2021-01-24,pagina12,"""NO SOLO ME ESTOY CUIDANDO, SINO QUE TAMBIÉN CUIDO A LOS DEMÁS"" La vicepresidenta reafirmó la seguridad y eficacia de la vacuna rusa contra el coronavirus 👏👏 [ https://t.co/SBTzKGOO3g]  https://t.co/xADm6tcitC",13,38,262,https://twitter.com/pagina12/status/1353394857352581125
186991,2021-02-02,piojo22e,"THE LANCET  La vacuna rusa, alcanza una eficacia promedio 92%.  Para que le quede claro a la EPIDEMIÓLOGA @LillyTellez Los participantes del ensayo recibieron una dosis de rAd26-S y un refuerzo de rAd5-S, 21 días después (Ustedes NO entendieron pero ELA SI)  ¿Ya podemos avanzar?",24,109,262,https://twitter.com/piojo22e/status/1356624274182742017
190092,2021-02-02,radio_formula,"Tras las polémicas declaraciones de Lilly Téllez sobre la vacuna rusa Sputnik V y la baja calidad de esta, la senadora lidera la conversación en redes sociales  https://t.co/G9xosnhpQ6  https://t.co/LQo3pEaXKB",55,35,260,https://twitter.com/Radio_Formula/status/1356512721290858496
184705,2021-02-02,tavo2366,"Me informan que Duque no negoció desde el principio la vacuna rusa, porque a María Fernanda Cabal no le inspiraba confianza esa vacuna.",17,93,260,https://twitter.com/tavo2366/status/1356661117016281089
171831,2021-02-04,simpsonitomx,"— ¡Mis amigos, deténganse! Claro... Podríamos destruir a la vacuna rusa... ¡Pero estaríamos destruyendo una parte de nosotros! — Dense prisa... 😬😓  https://t.co/E9bQzaAj67",2,23,260,https://twitter.com/SimpsonitoMX/status/1357327781411975170
58445,2021-01-24,claux58032843,"Vacuna china no está aprobada por nadie y la defienden a capa y espada , vacuna Peruana es atacada por los mismos Peruanos !!???... Es decir carajo, viven una clase de HDP en Perú , bien traicioneros y codiciosos. El comunista Peruano es el peor de todos los que he visto.........",14,111,259,https://twitter.com/Claux58032843/status/1353455801285840896
53735,2021-02-02,eabusad,Creo que ya he salido hablando como en 7 medios como voluntario de la vacuna china de Sinopharm. Me acabo de sentir presionado. Si algo me pasa los antivacunas se van a dar un festín con mi caso. Mejor me forro en plástico de burbujas.,10,7,259,https://twitter.com/eabusad/status/1356463010169126913
214163,2021-01-25,jo52170739,"Si los Rusos no se quieren poner la vacuna Rusa, ¿por que piensan que los mexicanos si se la van a poner?",17,74,259,https://twitter.com/jo52170739/status/1353823486377140224
172366,2021-02-04,calderonwiliams,Desconfío de un expresidente procesado por recibir dineros del Cartel de Cali sugiriendo en Twitter que el gobierno colombiano se debió hacer el loco con los espías rusos con tal de tener la vacuna rusa. De qué desconfían ustedes? Tema del día en @lafm #DesconfioDe  https://t.co/5rFOBej6GF,22,107,259,https://twitter.com/calderonwiliams/status/1357275822810357760
55494,2021-01-29,jackymc10,"¿Por qué  #Sinopharm es  un secreto  de  Estado???                                                                                                                                            #Mazzetti exigimos  se  sincere el  #precio, que  se  está pagando por la vacuna #China!!",12,104,259,https://twitter.com/JackyMc10/status/1354995317717008385
169024,2021-02-05,marcelopascu,"Rusia Today se esta haciendo un festin con las burlas a la vacuna rusa (que sucedieron en todo el mundo, no solo aca) y como ahora europa se las va a pedir de rodillas...",8,66,258,https://twitter.com/MarceloPascu/status/1357733717779873799
184778,2021-02-02,normanfpearl,"Otro descalabro para la “Dra” ⁦⁦panista ⁦@LillyTellez⁩. La prestigiada revista científica “The Lancet” confirma, ya en fase III, la alta eficiencia de la vacuna rusa sputnik y el descrédito de la señora Téllez.     https://t.co/IAfdJC1LvX",13,150,258,https://twitter.com/NormanFPearl/status/1356659591338201090
52715,2021-02-03,mtruzmanp,"1/2 Hoy tengo dos preguntas que me gustaría compartir con ustedes; desde hace muchos meses no se habla de muertes por el virus chino en China, no he oído tampoco sobre ninguna vacuna china, entonces ¿cómo hizo el régimen chino para controlar su propio virus sin vacunas?",25,241,258,https://twitter.com/mtruzmanp/status/1356997519071449090
176715,2021-02-03,danielapastrana,"""Nunca había oído una postura tan aberrante y anticientífica. Es un verdadero disparate"", dice el subsecretario, sobre la pregunta de fetos humanos para la vacuna rusa. Y yo pienso: ""nunca había oído al subsecretario decir palabras tan altisonantes"" 🙊🤣 #ConferenciaPresidente",15,35,258,https://twitter.com/danielapastrana/status/1356964434913054722
168303,2021-02-05,eryayad,"Avísenle a Tellez para que vaya a defender al PUEBLO Alemán de dicha vacuna 🤣🤣🤣🤣  ""Alemania ofrece apoyo para producir la vacuna rusa Sputnik V""  https://t.co/7ql5smvIhb",12,156,258,https://twitter.com/EryAyad/status/1357824640572399620
179265,2021-02-03,fargote507,"Estoy sorprendido de la cantidad de personas que están contra la vacuna rusa porque creen que aun existe la URSS comunista. El resultado del trabajo de los ""retros"" panameños y los gobiernos que han hecho de Panamá el segundo país que menos invierte en educación en Latinoamérica.",58,53,256,https://twitter.com/fargote507/status/1356806172939063299
202568,2021-01-27,lopezflores_,"Rusia, antigua URSS ha sido siempre el país pionero en desarrollo de tecnología, industria, telecomunicaciones y sobre todo solidaridad internacional: Hoy una senadora #LadyAntiVacunas con el apoyo de Acción Nacional pretenden que nadie acepte la vacuna rusa, son una vergüenza.  https://t.co/j8X7JtR86p",13,81,256,https://twitter.com/LopezFlores_/status/1354516327822733313
53128,2021-02-02,arielviano,"Ahora que dicen que la sputnik es efectiva, van a traer la vacuna china   IMPROVISANDO CON LA SALUD ✌",12,102,256,https://twitter.com/arielviano/status/1356755854205325312
178515,2021-02-03,milenio,Vacuna rusa Sputnik V es aún más efectiva en adultos mayores de 60 años  https://t.co/TU1qgbKcVv  https://t.co/RfHOFs9PoS,6,39,255,https://twitter.com/Milenio/status/1356843358287667201
179278,2021-02-03,divalustar,"Lilly Tellez al enterarse que COFEPRIS autorizó la vacuna Rusa, como plan de emergencia 🙊🤭  https://t.co/AfieMKNtgu",23,127,252,https://twitter.com/DIVALUSTAR/status/1356805608247328768
177554,2021-02-03,luisfcocabezas,"La vacuna rusa acaba de demostrar su eficacia, habló la ciencia, ponga a un lado sus prejuicios, son estos últimos los que pueden terminar matándole",21,79,252,https://twitter.com/luisfcocabezas/status/1356932307953872899
205978,2021-01-27,celsopadillaav1,"@PortillogMayra @HLGatell Gatell estoy revisando a un abogado x que la Vacuna Rusa, tiene alto riesgo si es aplicada a DIABETICOS y morir si la población del país es alta x que USTED LO RECALCO en su conferencia x ende está dando el visto bueno de esta, se le podra demandar x homicidio eso es correcto?",22,56,252,https://twitter.com/CelsoPadillaav1/status/1354311990244757504
